call mtr.add_suppression("Found 1 prepared XA transactions");
CREATE TABLE t1 (c1 INT PRIMARY KEY, c2 INT);
INSERT INTO t1 VALUES (1,1);
XA START 'xid1';
INSERT INTO t1 VALUES (2,2);
UPDATE t1 SET c2=c2+1 WHERE c1=1;
XA END 'xid1';
include/execute_to_conditional_timestamp_sync_point.inc [before_set_prepared_in_tc]
XA PREPARE 'xid1';
# Kill the server
# restart
XA COMMIT 'xid1';
SELECT * FROM t1;
c1	c2
1	2
2	2
XA START 'xid2';
INSERT INTO t1 VALUES (3,3);
UPDATE t1 SET c2=c2+1 WHERE c1=1;
XA END 'xid2';
include/execute_to_conditional_timestamp_sync_point.inc [before_set_prepared_in_tc]
XA PREPARE 'xid2';
# Kill the server
# restart
# Kill the server
# restart
XA COMMIT 'xid2';
SELECT * FROM t1;
c1	c2
1	3
2	2
3	3
DROP TABLE t1;
