include/master-slave.inc
Warnings:
Note	####	Sending passwords in plain text without SSL/TLS is extremely insecure.
Note	####	Storing MySQL user name or password information in the master info repository is not secure and is therefore not recommended. Please consider using the USER and PASSWORD connection options for START SLAVE; see the 'START SLAVE Syntax' in the MySQL Manual for more information.
[connection master]
# 
# mysql_bug113707
# 
CREATE TABLE t1 (path varchar(512) CHARACTER SET latin1 NOT NULL,box geometry NOT NULL SRID 4326,SPATIAL KEY box (box));
insert into t1 values('asdfghjkl', ST_GeomFromText('POINT(39.345 116.123)',4326));
insert into t1 values('wetryiwo', ST_GeomFromText('POINT(35.631122 134.5672332)',4326));
insert into t1 values('223fsdssa', ST_GeomFromText('POINT(52.34445 12.433)',4326));
include/sync_slave_sql_with_master.inc
select ST_X(box),ST_Y(box) from t1 where path='wetryiwo';
ST_X(box)	ST_Y(box)
35.631122	134.5672332
update t1 set box=ST_GeomFromText('POINT(68.32145 123.5432)', 4326) where path='wetryiwo';
include/sync_slave_sql_with_master.inc
select ST_X(box),ST_Y(box) from t1 where path='wetryiwo';
ST_X(box)	ST_Y(box)
68.32145	123.5432
drop table t1;
include/sync_slave_sql_with_master.inc
# 
# All geometry type as index
# 
create table tx52 (c1 int, c2 geometry not null srid 0, spatial index (c2)) comment='disttype=global';
insert into tx52 values(1, point(1, 1));
insert into tx52 values(2, point(2, 2));
insert into tx52 values(3, point(3, 3));
include/sync_slave_sql_with_master.inc
select c1, st_astext(c2) from tx52;
c1	st_astext(c2)
1	POINT(1 1)
2	POINT(2 2)
3	POINT(3 3)
update tx52 set c2 = point(9, 9) where c2 = point(2, 2);
include/sync_slave_sql_with_master.inc
select c1, st_astext(c2) from tx52;
c1	st_astext(c2)
1	POINT(1 1)
2	POINT(9 9)
3	POINT(3 3)
delete from tx52 where c2 = point(9, 9);
include/sync_slave_sql_with_master.inc
select c1, st_astext(c2) from tx52;
c1	st_astext(c2)
1	POINT(1 1)
3	POINT(3 3)
update tx52 set c2 = point(9, 9);
include/sync_slave_sql_with_master.inc
select c1, st_astext(c2) from tx52;
c1	st_astext(c2)
1	POINT(9 9)
3	POINT(9 9)
delete from tx52;
include/sync_slave_sql_with_master.inc
select c1, st_astext(c2) from tx52;
c1	st_astext(c2)
drop table tx52;
create table tx52 (c1 int, c2 point not null srid 0, spatial index (c2)) comment='disttype=global';
insert into tx52 values(1, point(1, 1));
insert into tx52 values(2, point(2, 2));
insert into tx52 values(3, point(3, 3));
include/sync_slave_sql_with_master.inc
select c1, st_astext(c2) from tx52;
c1	st_astext(c2)
1	POINT(1 1)
2	POINT(2 2)
3	POINT(3 3)
update tx52 set c2 = point(9, 9) where c2 = point(2, 2);
include/sync_slave_sql_with_master.inc
select c1, st_astext(c2) from tx52;
c1	st_astext(c2)
1	POINT(1 1)
2	POINT(9 9)
3	POINT(3 3)
delete from tx52 where c2 = point(9, 9);
include/sync_slave_sql_with_master.inc
select c1, st_astext(c2) from tx52;
c1	st_astext(c2)
1	POINT(1 1)
3	POINT(3 3)
update tx52 set c2 = point(9, 9);
include/sync_slave_sql_with_master.inc
select c1, st_astext(c2) from tx52;
c1	st_astext(c2)
1	POINT(9 9)
3	POINT(9 9)
delete from tx52;
include/sync_slave_sql_with_master.inc
select c1, st_astext(c2) from tx52;
c1	st_astext(c2)
drop table tx52;
create table tx52 (c1 int, c2 linestring not null srid 0, spatial index (c2)) comment='disttype=global';
insert into tx52 values(1, linestring(point(1, 1), point(9, 9)));
insert into tx52 values(2, linestring(point(2, 2), point(9, 9)));
insert into tx52 values(3, linestring(point(3, 3), point(9, 9)));
include/sync_slave_sql_with_master.inc
select c1, st_astext(c2) from tx52;
c1	st_astext(c2)
1	LINESTRING(1 1,9 9)
2	LINESTRING(2 2,9 9)
3	LINESTRING(3 3,9 9)
update tx52 set c2 =  linestring(point(4, 4), point(9, 9)) where c2 =  linestring(point(2, 2), point(9, 9));
include/sync_slave_sql_with_master.inc
select c1, st_astext(c2) from tx52;
c1	st_astext(c2)
1	LINESTRING(1 1,9 9)
2	LINESTRING(4 4,9 9)
3	LINESTRING(3 3,9 9)
delete from tx52 where c2 = linestring(point(4, 4), point(9, 9));
include/sync_slave_sql_with_master.inc
select c1, st_astext(c2) from tx52;
c1	st_astext(c2)
1	LINESTRING(1 1,9 9)
3	LINESTRING(3 3,9 9)
update tx52 set c2 = linestring(point(4, 4), point(9, 9));
include/sync_slave_sql_with_master.inc
select c1, st_astext(c2) from tx52;
c1	st_astext(c2)
1	LINESTRING(4 4,9 9)
3	LINESTRING(4 4,9 9)
delete from tx52;
include/sync_slave_sql_with_master.inc
select c1, st_astext(c2) from tx52;
c1	st_astext(c2)
drop table tx52;
create table tx52 (c1 int, c2 polygon not null srid 0, spatial index (c2)) comment='disttype=global';
insert into tx52 values(1, st_geomfromtext('polygon((0 0, 10 0, 10 10, 0 10, 0 0))'));
insert into tx52 values(2, st_geomfromtext('polygon((0 0, 20 0, 20 20, 0 20, 0 0))'));
insert into tx52 values(3, st_geomfromtext('polygon((0 0, 30 0, 30 30, 0 30, 0 0))'));
include/sync_slave_sql_with_master.inc
select c1, st_astext(c2) from tx52;
c1	st_astext(c2)
1	POLYGON((0 0,10 0,10 10,0 10,0 0))
2	POLYGON((0 0,20 0,20 20,0 20,0 0))
3	POLYGON((0 0,30 0,30 30,0 30,0 0))
update tx52 set c2 = st_geomfromtext('polygon((0 0, 90 0, 90 90, 0 90, 0 0))') where c2 = st_geomfromtext('polygon((0 0, 20 0, 20 20, 0 20, 0 0))');
include/sync_slave_sql_with_master.inc
select c1, st_astext(c2) from tx52;
c1	st_astext(c2)
1	POLYGON((0 0,10 0,10 10,0 10,0 0))
2	POLYGON((0 0,90 0,90 90,0 90,0 0))
3	POLYGON((0 0,30 0,30 30,0 30,0 0))
delete from tx52 where c2 = st_geomfromtext('polygon((0 0, 90 0, 90 90, 0 90, 0 0))');
include/sync_slave_sql_with_master.inc
select c1, st_astext(c2) from tx52;
c1	st_astext(c2)
1	POLYGON((0 0,10 0,10 10,0 10,0 0))
3	POLYGON((0 0,30 0,30 30,0 30,0 0))
update tx52 set c2 = st_geomfromtext('polygon((0 0, 90 0, 90 90, 0 90, 0 0))');
include/sync_slave_sql_with_master.inc
select c1, st_astext(c2) from tx52;
c1	st_astext(c2)
1	POLYGON((0 0,90 0,90 90,0 90,0 0))
3	POLYGON((0 0,90 0,90 90,0 90,0 0))
delete from tx52;
include/sync_slave_sql_with_master.inc
select c1, st_astext(c2) from tx52;
c1	st_astext(c2)
drop table tx52;
create table tx52 (c1 int, c2 geometrycollection not null srid 0, spatial index (c2)) comment='disttype=global';
insert into tx52 values(1, st_geomfromtext('geometrycollection(point(1 2), linestring(3 4, 5 6))'));
insert into tx52 values(2, st_geomfromtext('geometrycollection(point(7 8), linestring(9 10, 11 12))'));
insert into tx52 values(3, st_geomfromtext('geometrycollection(point(13 14), linestring(15 16, 17 18))'));
include/sync_slave_sql_with_master.inc
select c1, st_astext(c2) from tx52;
c1	st_astext(c2)
1	GEOMETRYCOLLECTION(POINT(1 2),LINESTRING(3 4,5 6))
2	GEOMETRYCOLLECTION(POINT(7 8),LINESTRING(9 10,11 12))
3	GEOMETRYCOLLECTION(POINT(13 14),LINESTRING(15 16,17 18))
update tx52 set c2 = st_geomfromtext('geometrycollection(point(19 20), linestring(21 22, 23 24))') where c2 = st_geomfromtext('geometrycollection(point(7 8), linestring(9 10, 11 12))');
include/sync_slave_sql_with_master.inc
select c1, st_astext(c2) from tx52;
c1	st_astext(c2)
1	GEOMETRYCOLLECTION(POINT(1 2),LINESTRING(3 4,5 6))
2	GEOMETRYCOLLECTION(POINT(19 20),LINESTRING(21 22,23 24))
3	GEOMETRYCOLLECTION(POINT(13 14),LINESTRING(15 16,17 18))
delete from tx52 where c2 = st_geomfromtext('geometrycollection(point(19 20), linestring(21 22, 23 24))');
include/sync_slave_sql_with_master.inc
select c1, st_astext(c2) from tx52;
c1	st_astext(c2)
1	GEOMETRYCOLLECTION(POINT(1 2),LINESTRING(3 4,5 6))
3	GEOMETRYCOLLECTION(POINT(13 14),LINESTRING(15 16,17 18))
update tx52 set c2 = st_geomfromtext('geometrycollection(point(19 20), linestring(21 22, 23 24))');
include/sync_slave_sql_with_master.inc
select c1, st_astext(c2) from tx52;
c1	st_astext(c2)
1	GEOMETRYCOLLECTION(POINT(19 20),LINESTRING(21 22,23 24))
3	GEOMETRYCOLLECTION(POINT(19 20),LINESTRING(21 22,23 24))
delete from tx52;
include/sync_slave_sql_with_master.inc
select c1, st_astext(c2) from tx52;
c1	st_astext(c2)
drop table tx52;
create table tx52 (c1 int, c2 multipoint not null srid 0, spatial index (c2)) comment='disttype=global';
insert into tx52 values(1, st_multipointfromtext('multipoint(1 1, 9 9)'));
insert into tx52 values(2, st_multipointfromtext('multipoint(2 2, 9 9)'));
insert into tx52 values(3, st_multipointfromtext('multipoint(3 3, 9 9)'));
include/sync_slave_sql_with_master.inc
select c1, st_astext(c2) from tx52;
c1	st_astext(c2)
1	MULTIPOINT((1 1),(9 9))
2	MULTIPOINT((2 2),(9 9))
3	MULTIPOINT((3 3),(9 9))
update tx52 set c2 = st_multipointfromtext('multipoint(0 0, 9 9)') where c2 = st_multipointfromtext('multipoint(2 2, 9 9)');
include/sync_slave_sql_with_master.inc
select c1, st_astext(c2) from tx52;
c1	st_astext(c2)
1	MULTIPOINT((1 1),(9 9))
2	MULTIPOINT((0 0),(9 9))
3	MULTIPOINT((3 3),(9 9))
delete from tx52 where c2 = st_multipointfromtext('multipoint(0 0, 9 9)');
include/sync_slave_sql_with_master.inc
select c1, st_astext(c2) from tx52;
c1	st_astext(c2)
1	MULTIPOINT((1 1),(9 9))
3	MULTIPOINT((3 3),(9 9))
update tx52 set c2 = st_multipointfromtext('multipoint(0 0, 9 9)');
include/sync_slave_sql_with_master.inc
select c1, st_astext(c2) from tx52;
c1	st_astext(c2)
1	MULTIPOINT((0 0),(9 9))
3	MULTIPOINT((0 0),(9 9))
delete from tx52;
include/sync_slave_sql_with_master.inc
select c1, st_astext(c2) from tx52;
c1	st_astext(c2)
drop table tx52;
create table tx52 (c1 int, c2 multilinestring not null srid 0, spatial index (c2)) comment='disttype=global';
insert into tx52 values(1, st_multilinestringfromtext('multilinestring((1 1, 2 2), (3 3, 4 4))'));
insert into tx52 values(2, st_multilinestringfromtext('multilinestring((5 5, 6 6), (7 7, 8 8))'));
insert into tx52 values(3, st_multilinestringfromtext('multilinestring((9 9, 10 10), (11 11, 12 12))'));
include/sync_slave_sql_with_master.inc
select c1, st_astext(c2) from tx52;
c1	st_astext(c2)
1	MULTILINESTRING((1 1,2 2),(3 3,4 4))
2	MULTILINESTRING((5 5,6 6),(7 7,8 8))
3	MULTILINESTRING((9 9,10 10),(11 11,12 12))
update tx52 set c2 = st_multilinestringfromtext('multilinestring((0 0, 9 9), (10 10, 19 19))') where c2 = st_multilinestringfromtext('multilinestring((5 5, 6 6), (7 7, 8 8))');
include/sync_slave_sql_with_master.inc
select c1, st_astext(c2) from tx52;
c1	st_astext(c2)
1	MULTILINESTRING((1 1,2 2),(3 3,4 4))
2	MULTILINESTRING((0 0,9 9),(10 10,19 19))
3	MULTILINESTRING((9 9,10 10),(11 11,12 12))
delete from tx52 where c2 = st_multilinestringfromtext('multilinestring((0 0, 9 9), (10 10, 19 19))');
include/sync_slave_sql_with_master.inc
select c1, st_astext(c2) from tx52;
c1	st_astext(c2)
1	MULTILINESTRING((1 1,2 2),(3 3,4 4))
3	MULTILINESTRING((9 9,10 10),(11 11,12 12))
update tx52 set c2 = st_multilinestringfromtext('multilinestring((0 0, 9 9), (10 10, 19 19))');
include/sync_slave_sql_with_master.inc
select c1, st_astext(c2) from tx52;
c1	st_astext(c2)
1	MULTILINESTRING((0 0,9 9),(10 10,19 19))
3	MULTILINESTRING((0 0,9 9),(10 10,19 19))
delete from tx52;
include/sync_slave_sql_with_master.inc
select c1, st_astext(c2) from tx52;
c1	st_astext(c2)
drop table tx52;
create table tx52 (c1 int, c2 multipolygon not null srid 0, spatial index (c2)) comment='disttype=global';
insert into tx52 values(1, st_multipolygonfromtext('multipolygon(((0 0, 1 0, 1 1, 0 1, 0 0)), ((1 1, 1 2, 2 2, 2 1, 1 1)))'));
insert into tx52 values(2, st_multipolygonfromtext('multipolygon(((2 2, 2 3, 3 3, 3 2, 2 2)), ((3 3, 3 4, 4 4, 4 3, 3 3)))'));
insert into tx52 values(3, st_multipolygonfromtext('multipolygon(((5 5, 5 6, 6 6, 6 5, 5 5)), ((6 6, 6 7, 7 7, 7 6, 6 6)))'));
include/sync_slave_sql_with_master.inc
select c1, st_astext(c2) from tx52;
c1	st_astext(c2)
1	MULTIPOLYGON(((0 0,1 0,1 1,0 1,0 0)),((1 1,1 2,2 2,2 1,1 1)))
2	MULTIPOLYGON(((2 2,2 3,3 3,3 2,2 2)),((3 3,3 4,4 4,4 3,3 3)))
3	MULTIPOLYGON(((5 5,5 6,6 6,6 5,5 5)),((6 6,6 7,7 7,7 6,6 6)))
update tx52 set c2 = st_multipolygonfromtext('multipolygon(((0 0, 0 9, 9 9, 9 0, 0 0)), ((10 10, 10 20, 20 20, 20 10, 10 10)))') where c2 = st_multipolygonfromtext('multipolygon(((2 2, 2 3, 3 3, 3 2, 2 2)), ((3 3, 3 4, 4 4, 4 3, 3 3)))');
include/sync_slave_sql_with_master.inc
select c1, st_astext(c2) from tx52;
c1	st_astext(c2)
1	MULTIPOLYGON(((0 0,1 0,1 1,0 1,0 0)),((1 1,1 2,2 2,2 1,1 1)))
2	MULTIPOLYGON(((0 0,0 9,9 9,9 0,0 0)),((10 10,10 20,20 20,20 10,10 10)))
3	MULTIPOLYGON(((5 5,5 6,6 6,6 5,5 5)),((6 6,6 7,7 7,7 6,6 6)))
delete from tx52 where c2 = st_multipolygonfromtext('multipolygon(((0 0, 0 9, 9 9, 9 0, 0 0)), ((10 10, 10 20, 20 20, 20 10, 10 10)))');
include/sync_slave_sql_with_master.inc
select c1, st_astext(c2) from tx52;
c1	st_astext(c2)
1	MULTIPOLYGON(((0 0,1 0,1 1,0 1,0 0)),((1 1,1 2,2 2,2 1,1 1)))
3	MULTIPOLYGON(((5 5,5 6,6 6,6 5,5 5)),((6 6,6 7,7 7,7 6,6 6)))
update tx52 set c2 = st_multipolygonfromtext('multipolygon(((0 0, 0 9, 9 9, 9 0, 0 0)), ((10 10, 10 20, 20 20, 20 10, 10 10)))');
include/sync_slave_sql_with_master.inc
select c1, st_astext(c2) from tx52;
c1	st_astext(c2)
1	MULTIPOLYGON(((0 0,0 9,9 9,9 0,0 0)),((10 10,10 20,20 20,20 10,10 10)))
3	MULTIPOLYGON(((0 0,0 9,9 9,9 0,0 0)),((10 10,10 20,20 20,20 10,10 10)))
delete from tx52;
include/sync_slave_sql_with_master.inc
select c1, st_astext(c2) from tx52;
c1	st_astext(c2)
drop table tx52;
include/rpl_end.inc
