# 1. Test local increment clone
INSTALL PLUGIN clone SONAME 'CLONE_PLUGIN';
truncate mysql.clone_history;
CLONE LOCAL DATA DIRECTORY = 'CLONE_DATADIR' ENABLE PAGE TRACK;;
CREATE TABLE t1(col1 INT PRIMARY KEY, col2 int, col3 varchar(64), col4 BLOB);
CREATE TABLE t2(col1 INT PRIMARY KEY, col2 int, col3 varchar(64), col4 BLOB)
PARTITION BY KEY(col1) PARTITIONS 5;
CREATE TABLE `l#g/l'g.`(col1 INT PRIMARY KEY, col2 int, col3 varchar(64), col4 BLOB);
insert into t1 values(1,1,1,"aaa");
insert into t1 values(2,2,2,"aaa");
insert into t1 values(3,3,3,"aaa");
insert into t1 values(4,4,4,"aaa");
insert into t1 values(5,5,5,"aaa");
insert into t1 values(6,6,6,"aaa");
insert into t1 values(7,7,7,"aaa");
insert into t1 values(8,8,8,"aaa");
insert into t1 values(9,9,9,"aaa");
insert into t1 values(10,10,10,"aaa");
insert into t1 values(11,11,11,"aaa");
insert into t1 values(12,12,12,"aaa");
insert into t1 values(13,13,13,"aaa");
insert into t1 values(14,14,14,"aaa");
insert into t1 values(15,15,15,"aaa");
insert into t1 values(16,16,16,"aaa");
insert into t1 values(17,17,17,"aaa");
insert into t1 values(18,18,18,"aaa");
insert into t1 values(19,19,19,"aaa");
insert into t1 values(20,20,20,"aaa");
insert into t2 values(1,1,1,"aaa");
insert into t2 values(2,2,2,"aaa");
insert into t2 values(3,3,3,"aaa");
insert into t2 values(4,4,4,"aaa");
insert into t2 values(5,5,5,"aaa");
insert into t2 values(6,6,6,"aaa");
insert into t2 values(7,7,7,"aaa");
insert into t2 values(8,8,8,"aaa");
insert into t2 values(9,9,9,"aaa");
insert into t2 values(10,10,10,"aaa");
insert into t2 values(11,11,11,"aaa");
insert into t2 values(12,12,12,"aaa");
insert into t2 values(13,13,13,"aaa");
insert into t2 values(14,14,14,"aaa");
insert into t2 values(15,15,15,"aaa");
insert into t2 values(16,16,16,"aaa");
insert into t2 values(17,17,17,"aaa");
insert into t2 values(18,18,18,"aaa");
insert into t2 values(19,19,19,"aaa");
insert into t2 values(20,20,20,"aaa");
insert into `l#g/l'g.` values(1,1,1,"aaa");
insert into `l#g/l'g.` values(2,2,2,"aaa");
insert into `l#g/l'g.` values(3,3,3,"aaa");
insert into `l#g/l'g.` values(4,4,4,"aaa");
insert into `l#g/l'g.` values(5,5,5,"aaa");
insert into `l#g/l'g.` values(6,6,6,"aaa");
insert into `l#g/l'g.` values(7,7,7,"aaa");
insert into `l#g/l'g.` values(8,8,8,"aaa");
insert into `l#g/l'g.` values(9,9,9,"aaa");
insert into `l#g/l'g.` values(10,10,10,"aaa");
insert into `l#g/l'g.` values(11,11,11,"aaa");
insert into `l#g/l'g.` values(12,12,12,"aaa");
insert into `l#g/l'g.` values(13,13,13,"aaa");
insert into `l#g/l'g.` values(14,14,14,"aaa");
insert into `l#g/l'g.` values(15,15,15,"aaa");
insert into `l#g/l'g.` values(16,16,16,"aaa");
insert into `l#g/l'g.` values(17,17,17,"aaa");
insert into `l#g/l'g.` values(18,18,18,"aaa");
insert into `l#g/l'g.` values(19,19,19,"aaa");
insert into `l#g/l'g.` values(20,20,20,"aaa");
update t1 set col2=col2+100;
update t2 set col2=col2+100;
update t1 set col2=col2+100;
update t2 set col2=col2+100;
update t1 set col2=col2+100;
update t2 set col2=col2+100;
update t1 set col2=col2+100;
update t2 set col2=col2+100;
update t1 set col3=col3+100;
update t2 set col3=col3+100;
update t1 set col3=col3+100;
update t2 set col3=col3+100;
update t1 set col3=col3+100;
update t2 set col3=col3+100;
update t1 set col3=col3+100;
update t2 set col3=col3+100;
update t1 set col3=col3+100;
update t2 set col3=col3+100;
update t1 set col3=col3+100;
update t2 set col3=col3+100;
CREATE INDEX index_col2 ON t1 (col2);
CREATE INDEX index_col2 ON t2 (col2);
SHOW CREATE TABLE t1;
Table	Create Table
t1	CREATE TABLE `t1` (
  `col1` int NOT NULL,
  `col2` int DEFAULT NULL,
  `col3` varchar(64) DEFAULT NULL,
  `col4` blob,
  PRIMARY KEY (`col1`),
  KEY `index_col2` (`col2`)
) ENGINE=InnoDB DEFAULT CHARSET=utf8mb4 COLLATE=utf8mb4_0900_ai_ci
SELECT count(*) from t1;
count(*)
20
SELECT col1, col2, col3 FROM t1 ORDER BY col1;
col1	col2	col3
1	401	601
2	402	602
3	403	603
4	404	604
5	405	605
6	406	606
7	407	607
8	408	608
9	409	609
10	410	610
11	411	611
12	412	612
13	413	613
14	414	614
15	415	615
16	416	616
17	417	617
18	418	618
19	419	619
20	420	620
SELECT col1, col2, col3 FROM t1 ORDER BY col1;
col1	col2	col3
1	401	601
2	402	602
3	403	603
4	404	604
5	405	605
6	406	606
7	407	607
8	408	608
9	409	609
10	410	610
11	411	611
12	412	612
13	413	613
14	414	614
15	415	615
16	416	616
17	417	617
18	418	618
19	419	619
20	420	620
SHOW CREATE TABLE t2;
Table	Create Table
t2	CREATE TABLE `t2` (
  `col1` int NOT NULL,
  `col2` int DEFAULT NULL,
  `col3` varchar(64) DEFAULT NULL,
  `col4` blob,
  PRIMARY KEY (`col1`),
  KEY `index_col2` (`col2`)
) ENGINE=InnoDB DEFAULT CHARSET=utf8mb4 COLLATE=utf8mb4_0900_ai_ci
/*!50100 PARTITION BY KEY (col1)
PARTITIONS 5 */
SELECT count(*) from t2;
count(*)
20
SELECT col1, col2, col3 FROM t2 ORDER BY col1;
col1	col2	col3
1	401	601
2	402	602
3	403	603
4	404	604
5	405	605
6	406	606
7	407	607
8	408	608
9	409	609
10	410	610
11	411	611
12	412	612
13	413	613
14	414	614
15	415	615
16	416	616
17	417	617
18	418	618
19	419	619
20	420	620
SELECT col1, col2, col3 FROM t2 ORDER BY col1 DESC;
col1	col2	col3
20	420	620
19	419	619
18	418	618
17	417	617
16	416	616
15	415	615
14	414	614
13	413	613
12	412	612
11	411	611
10	410	610
9	409	609
8	408	608
7	407	607
6	406	606
5	405	605
4	404	604
3	403	603
2	402	602
1	401	601
SHOW CREATE TABLE `l#g/l'g.`;
Table	Create Table
l#g/l'g.	CREATE TABLE `l#g/l'g.` (
  `col1` int NOT NULL,
  `col2` int DEFAULT NULL,
  `col3` varchar(64) DEFAULT NULL,
  `col4` blob,
  PRIMARY KEY (`col1`)
) ENGINE=InnoDB DEFAULT CHARSET=utf8mb4 COLLATE=utf8mb4_0900_ai_ci
SELECT count(*) from `l#g/l'g.`;
count(*)
20
SELECT col1, col2, col3 FROM `l#g/l'g.` ORDER BY col1;
col1	col2	col3
1	1	1
2	2	2
3	3	3
4	4	4
5	5	5
6	6	6
7	7	7
8	8	8
9	9	9
10	10	10
11	11	11
12	12	12
13	13	13
14	14	14
15	15	15
16	16	16
17	17	17
18	18	18
19	19	19
20	20	20
SELECT col1, col2, col3 FROM `l#g/l'g.` ORDER BY col1 DESC;
col1	col2	col3
20	20	20
19	19	19
18	18	18
17	17	17
16	16	16
15	15	15
14	14	14
13	13	13
12	12	12
11	11	11
10	10	10
9	9	9
8	8	8
7	7	7
6	6	6
5	5	5
4	4	4
3	3	3
2	2	2
1	1	1
# In connection con1 - Running Insert
begin;
insert into t1 values(120,120,120,"aaa");
# In connection default - Cloning database
SELECT count(*) from t1;
count(*)
20
SELECT col1, col2, col3 FROM t1 ORDER BY col1;
col1	col2	col3
1	401	601
2	402	602
3	403	603
4	404	604
5	405	605
6	406	606
7	407	607
8	408	608
9	409	609
10	410	610
11	411	611
12	412	612
13	413	613
14	414	614
15	415	615
16	416	616
17	417	617
18	418	618
19	419	619
20	420	620
SELECT col1, col2, col3 FROM t1 ORDER BY col1;
col1	col2	col3
1	401	601
2	402	602
3	403	603
4	404	604
5	405	605
6	406	606
7	407	607
8	408	608
9	409	609
10	410	610
11	411	611
12	412	612
13	413	613
14	414	614
15	415	615
16	416	616
17	417	617
18	418	618
19	419	619
20	420	620
SHOW CREATE TABLE t2;
Table	Create Table
t2	CREATE TABLE `t2` (
  `col1` int NOT NULL,
  `col2` int DEFAULT NULL,
  `col3` varchar(64) DEFAULT NULL,
  `col4` blob,
  PRIMARY KEY (`col1`),
  KEY `index_col2` (`col2`)
) ENGINE=InnoDB DEFAULT CHARSET=utf8mb4 COLLATE=utf8mb4_0900_ai_ci
/*!50100 PARTITION BY KEY (col1)
PARTITIONS 5 */
SELECT count(*) from t2;
count(*)
20
SELECT col1, col2, col3 FROM t2 ORDER BY col1;
col1	col2	col3
1	401	601
2	402	602
3	403	603
4	404	604
5	405	605
6	406	606
7	407	607
8	408	608
9	409	609
10	410	610
11	411	611
12	412	612
13	413	613
14	414	614
15	415	615
16	416	616
17	417	617
18	418	618
19	419	619
20	420	620
SELECT col1, col2, col3 FROM t2 ORDER BY col1;
col1	col2	col3
1	401	601
2	402	602
3	403	603
4	404	604
5	405	605
6	406	606
7	407	607
8	408	608
9	409	609
10	410	610
11	411	611
12	412	612
13	413	613
14	414	614
15	415	615
16	416	616
17	417	617
18	418	618
19	419	619
20	420	620
# enable encryption function
set global clone_encrypt_key_path= 'MYSQL_TEST_DIR/std_data/mysql_clone_key';
CLONE LOCAL DATA DIRECTORY = 'CLONE_DATADIR1' ENABLE PAGE TRACK START_LSN=PAGE_TRACK_LSN;;
# In connection default - Finished Cloning
# In connection con1 - Waiting
commit;
# In connection default
# apply delta file from increment clone datadir to full clone
drop table t1;
drop table t2;
drop table `l#g/l'g.`;
UNINSTALL PLUGIN clone;
# 2. Test remote increment clone
INSTALL PLUGIN clone SONAME 'CLONE_PLUGIN';
truncate mysql.clone_history;
SET GLOBAL clone_valid_donor_list = 'HOST:PORT';
CLONE INSTANCE FROM USER@HOST:PORT IDENTIFIED BY '' DATA DIRECTORY = 'CLONE_DATADIR' ENABLE PAGE TRACK;;
CREATE TABLE t1(col1 INT PRIMARY KEY, col2 int, col3 varchar(64), col4 BLOB);
CREATE TABLE t2(col1 INT PRIMARY KEY, col2 int, col3 varchar(64), col4 BLOB)
PARTITION BY KEY(col1) PARTITIONS 5;
insert into t1 values(1,1,1,"aaa");
insert into t1 values(2,2,2,"aaa");
insert into t1 values(3,3,3,"aaa");
insert into t1 values(4,4,4,"aaa");
insert into t1 values(5,5,5,"aaa");
insert into t1 values(6,6,6,"aaa");
insert into t1 values(7,7,7,"aaa");
insert into t1 values(8,8,8,"aaa");
insert into t1 values(9,9,9,"aaa");
insert into t1 values(10,10,10,"aaa");
insert into t1 values(11,11,11,"aaa");
insert into t1 values(12,12,12,"aaa");
insert into t1 values(13,13,13,"aaa");
insert into t1 values(14,14,14,"aaa");
insert into t1 values(15,15,15,"aaa");
insert into t1 values(16,16,16,"aaa");
insert into t1 values(17,17,17,"aaa");
insert into t1 values(18,18,18,"aaa");
insert into t1 values(19,19,19,"aaa");
insert into t1 values(20,20,20,"aaa");
insert into t2 values(1,1,1,"aaa");
insert into t2 values(2,2,2,"aaa");
insert into t2 values(3,3,3,"aaa");
insert into t2 values(4,4,4,"aaa");
insert into t2 values(5,5,5,"aaa");
insert into t2 values(6,6,6,"aaa");
insert into t2 values(7,7,7,"aaa");
insert into t2 values(8,8,8,"aaa");
insert into t2 values(9,9,9,"aaa");
insert into t2 values(10,10,10,"aaa");
insert into t2 values(11,11,11,"aaa");
insert into t2 values(12,12,12,"aaa");
insert into t2 values(13,13,13,"aaa");
insert into t2 values(14,14,14,"aaa");
insert into t2 values(15,15,15,"aaa");
insert into t2 values(16,16,16,"aaa");
insert into t2 values(17,17,17,"aaa");
insert into t2 values(18,18,18,"aaa");
insert into t2 values(19,19,19,"aaa");
insert into t2 values(20,20,20,"aaa");
update t1 set col2=col2+100;
update t2 set col2=col2+100;
update t1 set col2=col2+100;
update t2 set col2=col2+100;
update t1 set col2=col2+100;
update t2 set col2=col2+100;
update t1 set col2=col2+100;
update t2 set col2=col2+100;
update t1 set col3=col3+100;
update t2 set col3=col3+100;
update t1 set col3=col3+100;
update t2 set col3=col3+100;
update t1 set col3=col3+100;
update t2 set col3=col3+100;
update t1 set col3=col3+100;
update t2 set col3=col3+100;
update t1 set col3=col3+100;
update t2 set col3=col3+100;
update t1 set col3=col3+100;
update t2 set col3=col3+100;
CREATE INDEX index_col2 ON t1 (col2);
CREATE INDEX index_col2 ON t2 (col2);
SHOW CREATE TABLE t1;
Table	Create Table
t1	CREATE TABLE `t1` (
  `col1` int NOT NULL,
  `col2` int DEFAULT NULL,
  `col3` varchar(64) DEFAULT NULL,
  `col4` blob,
  PRIMARY KEY (`col1`),
  KEY `index_col2` (`col2`)
) ENGINE=InnoDB DEFAULT CHARSET=utf8mb4 COLLATE=utf8mb4_0900_ai_ci
SELECT count(*) from t1;
count(*)
20
SELECT col1, col2, col3 FROM t1 ORDER BY col1;
col1	col2	col3
1	401	601
2	402	602
3	403	603
4	404	604
5	405	605
6	406	606
7	407	607
8	408	608
9	409	609
10	410	610
11	411	611
12	412	612
13	413	613
14	414	614
15	415	615
16	416	616
17	417	617
18	418	618
19	419	619
20	420	620
SELECT col1, col2, col3 FROM t1 ORDER BY col1;
col1	col2	col3
1	401	601
2	402	602
3	403	603
4	404	604
5	405	605
6	406	606
7	407	607
8	408	608
9	409	609
10	410	610
11	411	611
12	412	612
13	413	613
14	414	614
15	415	615
16	416	616
17	417	617
18	418	618
19	419	619
20	420	620
SHOW CREATE TABLE t2;
Table	Create Table
t2	CREATE TABLE `t2` (
  `col1` int NOT NULL,
  `col2` int DEFAULT NULL,
  `col3` varchar(64) DEFAULT NULL,
  `col4` blob,
  PRIMARY KEY (`col1`),
  KEY `index_col2` (`col2`)
) ENGINE=InnoDB DEFAULT CHARSET=utf8mb4 COLLATE=utf8mb4_0900_ai_ci
/*!50100 PARTITION BY KEY (col1)
PARTITIONS 5 */
SELECT count(*) from t2;
count(*)
20
SELECT col1, col2, col3 FROM t2 ORDER BY col1;
col1	col2	col3
1	401	601
2	402	602
3	403	603
4	404	604
5	405	605
6	406	606
7	407	607
8	408	608
9	409	609
10	410	610
11	411	611
12	412	612
13	413	613
14	414	614
15	415	615
16	416	616
17	417	617
18	418	618
19	419	619
20	420	620
SELECT col1, col2, col3 FROM t2 ORDER BY col1 DESC;
col1	col2	col3
20	420	620
19	419	619
18	418	618
17	417	617
16	416	616
15	415	615
14	414	614
13	413	613
12	412	612
11	411	611
10	410	610
9	409	609
8	408	608
7	407	607
6	406	606
5	405	605
4	404	604
3	403	603
2	402	602
1	401	601
# In connection con1 - Running Insert
begin;
insert into t1 values(120,120,120,"aaa");
# In connection default - Cloning database
SELECT count(*) from t1;
count(*)
20
SELECT col1, col2, col3 FROM t1 ORDER BY col1;
col1	col2	col3
1	401	601
2	402	602
3	403	603
4	404	604
5	405	605
6	406	606
7	407	607
8	408	608
9	409	609
10	410	610
11	411	611
12	412	612
13	413	613
14	414	614
15	415	615
16	416	616
17	417	617
18	418	618
19	419	619
20	420	620
SELECT col1, col2, col3 FROM t1 ORDER BY col1;
col1	col2	col3
1	401	601
2	402	602
3	403	603
4	404	604
5	405	605
6	406	606
7	407	607
8	408	608
9	409	609
10	410	610
11	411	611
12	412	612
13	413	613
14	414	614
15	415	615
16	416	616
17	417	617
18	418	618
19	419	619
20	420	620
SHOW CREATE TABLE t2;
Table	Create Table
t2	CREATE TABLE `t2` (
  `col1` int NOT NULL,
  `col2` int DEFAULT NULL,
  `col3` varchar(64) DEFAULT NULL,
  `col4` blob,
  PRIMARY KEY (`col1`),
  KEY `index_col2` (`col2`)
) ENGINE=InnoDB DEFAULT CHARSET=utf8mb4 COLLATE=utf8mb4_0900_ai_ci
/*!50100 PARTITION BY KEY (col1)
PARTITIONS 5 */
SELECT count(*) from t2;
count(*)
20
SELECT col1, col2, col3 FROM t2 ORDER BY col1;
col1	col2	col3
1	401	601
2	402	602
3	403	603
4	404	604
5	405	605
6	406	606
7	407	607
8	408	608
9	409	609
10	410	610
11	411	611
12	412	612
13	413	613
14	414	614
15	415	615
16	416	616
17	417	617
18	418	618
19	419	619
20	420	620
SELECT col1, col2, col3 FROM t2 ORDER BY col1;
col1	col2	col3
1	401	601
2	402	602
3	403	603
4	404	604
5	405	605
6	406	606
7	407	607
8	408	608
9	409	609
10	410	610
11	411	611
12	412	612
13	413	613
14	414	614
15	415	615
16	416	616
17	417	617
18	418	618
19	419	619
20	420	620
# enable encryption function
set global clone_encrypt_key_path= 'MYSQL_TEST_DIR/std_data/mysql_clone_key';
CLONE INSTANCE FROM USER@HOST:PORT IDENTIFIED BY '' DATA DIRECTORY = 'CLONE_DATADIR1' ENABLE PAGE TRACK START_LSN=PAGE_TRACK_LSN;;
# In connection default - Finished Cloning
# In connection con1 - Waiting
commit;
# In connection default
# apply delta file from increment clone datadir to full clone
drop table t1;
drop table t2;
UNINSTALL PLUGIN clone;
# 3. Test only create databas between full clone and increment
INSTALL PLUGIN clone SONAME 'CLONE_PLUGIN';
truncate mysql.clone_history;
CLONE LOCAL DATA DIRECTORY = 'CLONE_DATADIR' ENABLE PAGE TRACK;;
create database `l#g/l'g.`;
CLONE LOCAL DATA DIRECTORY = 'CLONE_DATADIR1' ENABLE PAGE TRACK START_LSN=PAGE_TRACK_LSN;;
# In connection default - Finished Cloning
# In connection default
# apply delta file from increment clone datadir to full clone
use `TEST_DATABASE`;;
drop database `l#g/l'g.`;
UNINSTALL PLUGIN clone;
# 4. Test do nothing between full clone and increment
INSTALL PLUGIN clone SONAME 'CLONE_PLUGIN';
truncate mysql.clone_history;
CLONE LOCAL DATA DIRECTORY = 'CLONE_DATADIR' ENABLE PAGE TRACK;;
CLONE LOCAL DATA DIRECTORY = 'CLONE_DATADIR1' ENABLE PAGE TRACK START_LSN=PAGE_TRACK_LSN;;
# In connection default - Finished Cloning
# In connection default
UNINSTALL PLUGIN clone;
# 5. Test local increment clone by using based datadir
INSTALL PLUGIN clone SONAME 'CLONE_PLUGIN';
truncate mysql.clone_history;
CLONE LOCAL DATA DIRECTORY = 'CLONE_DATADIR' ENABLE PAGE TRACK;;
use test;
CREATE TABLE t1(col1 INT PRIMARY KEY, col2 int, col3 varchar(64), col4 BLOB);
CREATE TABLE t2(col1 INT PRIMARY KEY, col2 int, col3 varchar(64), col4 BLOB)
PARTITION BY KEY(col1) PARTITIONS 5;
CREATE TABLE `l#g/l'g.`(col1 INT PRIMARY KEY, col2 int, col3 varchar(64), col4 BLOB);
insert into t1 values(1,1,1,"aaa");
insert into t1 values(2,2,2,"aaa");
insert into t1 values(3,3,3,"aaa");
insert into t1 values(4,4,4,"aaa");
insert into t1 values(5,5,5,"aaa");
insert into t1 values(6,6,6,"aaa");
insert into t1 values(7,7,7,"aaa");
insert into t1 values(8,8,8,"aaa");
insert into t1 values(9,9,9,"aaa");
insert into t1 values(10,10,10,"aaa");
insert into t1 values(11,11,11,"aaa");
insert into t1 values(12,12,12,"aaa");
insert into t1 values(13,13,13,"aaa");
insert into t1 values(14,14,14,"aaa");
insert into t1 values(15,15,15,"aaa");
insert into t1 values(16,16,16,"aaa");
insert into t1 values(17,17,17,"aaa");
insert into t1 values(18,18,18,"aaa");
insert into t1 values(19,19,19,"aaa");
insert into t1 values(20,20,20,"aaa");
insert into t2 values(1,1,1,"aaa");
insert into t2 values(2,2,2,"aaa");
insert into t2 values(3,3,3,"aaa");
insert into t2 values(4,4,4,"aaa");
insert into t2 values(5,5,5,"aaa");
insert into t2 values(6,6,6,"aaa");
insert into t2 values(7,7,7,"aaa");
insert into t2 values(8,8,8,"aaa");
insert into t2 values(9,9,9,"aaa");
insert into t2 values(10,10,10,"aaa");
insert into t2 values(11,11,11,"aaa");
insert into t2 values(12,12,12,"aaa");
insert into t2 values(13,13,13,"aaa");
insert into t2 values(14,14,14,"aaa");
insert into t2 values(15,15,15,"aaa");
insert into t2 values(16,16,16,"aaa");
insert into t2 values(17,17,17,"aaa");
insert into t2 values(18,18,18,"aaa");
insert into t2 values(19,19,19,"aaa");
insert into t2 values(20,20,20,"aaa");
insert into `l#g/l'g.` values(1,1,1,"aaa");
insert into `l#g/l'g.` values(2,2,2,"aaa");
insert into `l#g/l'g.` values(3,3,3,"aaa");
insert into `l#g/l'g.` values(4,4,4,"aaa");
insert into `l#g/l'g.` values(5,5,5,"aaa");
insert into `l#g/l'g.` values(6,6,6,"aaa");
insert into `l#g/l'g.` values(7,7,7,"aaa");
insert into `l#g/l'g.` values(8,8,8,"aaa");
insert into `l#g/l'g.` values(9,9,9,"aaa");
insert into `l#g/l'g.` values(10,10,10,"aaa");
insert into `l#g/l'g.` values(11,11,11,"aaa");
insert into `l#g/l'g.` values(12,12,12,"aaa");
insert into `l#g/l'g.` values(13,13,13,"aaa");
insert into `l#g/l'g.` values(14,14,14,"aaa");
insert into `l#g/l'g.` values(15,15,15,"aaa");
insert into `l#g/l'g.` values(16,16,16,"aaa");
insert into `l#g/l'g.` values(17,17,17,"aaa");
insert into `l#g/l'g.` values(18,18,18,"aaa");
insert into `l#g/l'g.` values(19,19,19,"aaa");
insert into `l#g/l'g.` values(20,20,20,"aaa");
update t1 set col2=col2+100;
update t2 set col2=col2+100;
update t1 set col2=col2+100;
update t2 set col2=col2+100;
update t1 set col2=col2+100;
update t2 set col2=col2+100;
update t1 set col2=col2+100;
update t2 set col2=col2+100;
update t1 set col3=col3+100;
update t2 set col3=col3+100;
update t1 set col3=col3+100;
update t2 set col3=col3+100;
update t1 set col3=col3+100;
update t2 set col3=col3+100;
update t1 set col3=col3+100;
update t2 set col3=col3+100;
update t1 set col3=col3+100;
update t2 set col3=col3+100;
update t1 set col3=col3+100;
update t2 set col3=col3+100;
CREATE INDEX index_col2 ON t1 (col2);
CREATE INDEX index_col2 ON t2 (col2);
SHOW CREATE TABLE t1;
Table	Create Table
t1	CREATE TABLE `t1` (
  `col1` int NOT NULL,
  `col2` int DEFAULT NULL,
  `col3` varchar(64) DEFAULT NULL,
  `col4` blob,
  PRIMARY KEY (`col1`),
  KEY `index_col2` (`col2`)
) ENGINE=InnoDB DEFAULT CHARSET=utf8mb4 COLLATE=utf8mb4_0900_ai_ci
SELECT count(*) from t1;
count(*)
20
SELECT col1, col2, col3 FROM t1 ORDER BY col1;
col1	col2	col3
1	401	601
2	402	602
3	403	603
4	404	604
5	405	605
6	406	606
7	407	607
8	408	608
9	409	609
10	410	610
11	411	611
12	412	612
13	413	613
14	414	614
15	415	615
16	416	616
17	417	617
18	418	618
19	419	619
20	420	620
SELECT col1, col2, col3 FROM t1 ORDER BY col1;
col1	col2	col3
1	401	601
2	402	602
3	403	603
4	404	604
5	405	605
6	406	606
7	407	607
8	408	608
9	409	609
10	410	610
11	411	611
12	412	612
13	413	613
14	414	614
15	415	615
16	416	616
17	417	617
18	418	618
19	419	619
20	420	620
SHOW CREATE TABLE t2;
Table	Create Table
t2	CREATE TABLE `t2` (
  `col1` int NOT NULL,
  `col2` int DEFAULT NULL,
  `col3` varchar(64) DEFAULT NULL,
  `col4` blob,
  PRIMARY KEY (`col1`),
  KEY `index_col2` (`col2`)
) ENGINE=InnoDB DEFAULT CHARSET=utf8mb4 COLLATE=utf8mb4_0900_ai_ci
/*!50100 PARTITION BY KEY (col1)
PARTITIONS 5 */
SELECT count(*) from t2;
count(*)
20
SELECT col1, col2, col3 FROM t2 ORDER BY col1;
col1	col2	col3
1	401	601
2	402	602
3	403	603
4	404	604
5	405	605
6	406	606
7	407	607
8	408	608
9	409	609
10	410	610
11	411	611
12	412	612
13	413	613
14	414	614
15	415	615
16	416	616
17	417	617
18	418	618
19	419	619
20	420	620
SELECT col1, col2, col3 FROM t2 ORDER BY col1 DESC;
col1	col2	col3
20	420	620
19	419	619
18	418	618
17	417	617
16	416	616
15	415	615
14	414	614
13	413	613
12	412	612
11	411	611
10	410	610
9	409	609
8	408	608
7	407	607
6	406	606
5	405	605
4	404	604
3	403	603
2	402	602
1	401	601
SHOW CREATE TABLE `l#g/l'g.`;
Table	Create Table
l#g/l'g.	CREATE TABLE `l#g/l'g.` (
  `col1` int NOT NULL,
  `col2` int DEFAULT NULL,
  `col3` varchar(64) DEFAULT NULL,
  `col4` blob,
  PRIMARY KEY (`col1`)
) ENGINE=InnoDB DEFAULT CHARSET=utf8mb4 COLLATE=utf8mb4_0900_ai_ci
SELECT count(*) from `l#g/l'g.`;
count(*)
20
SELECT col1, col2, col3 FROM `l#g/l'g.` ORDER BY col1;
col1	col2	col3
1	1	1
2	2	2
3	3	3
4	4	4
5	5	5
6	6	6
7	7	7
8	8	8
9	9	9
10	10	10
11	11	11
12	12	12
13	13	13
14	14	14
15	15	15
16	16	16
17	17	17
18	18	18
19	19	19
20	20	20
SELECT col1, col2, col3 FROM `l#g/l'g.` ORDER BY col1 DESC;
col1	col2	col3
20	20	20
19	19	19
18	18	18
17	17	17
16	16	16
15	15	15
14	14	14
13	13	13
12	12	12
11	11	11
10	10	10
9	9	9
8	8	8
7	7	7
6	6	6
5	5	5
4	4	4
3	3	3
2	2	2
1	1	1
# In connection con1 - Running Insert
begin;
insert into t1 values(120,120,120,"aaa");
# In connection default - Cloning database
SELECT count(*) from t1;
count(*)
20
SELECT col1, col2, col3 FROM t1 ORDER BY col1;
col1	col2	col3
1	401	601
2	402	602
3	403	603
4	404	604
5	405	605
6	406	606
7	407	607
8	408	608
9	409	609
10	410	610
11	411	611
12	412	612
13	413	613
14	414	614
15	415	615
16	416	616
17	417	617
18	418	618
19	419	619
20	420	620
SELECT col1, col2, col3 FROM t1 ORDER BY col1;
col1	col2	col3
1	401	601
2	402	602
3	403	603
4	404	604
5	405	605
6	406	606
7	407	607
8	408	608
9	409	609
10	410	610
11	411	611
12	412	612
13	413	613
14	414	614
15	415	615
16	416	616
17	417	617
18	418	618
19	419	619
20	420	620
SHOW CREATE TABLE t2;
Table	Create Table
t2	CREATE TABLE `t2` (
  `col1` int NOT NULL,
  `col2` int DEFAULT NULL,
  `col3` varchar(64) DEFAULT NULL,
  `col4` blob,
  PRIMARY KEY (`col1`),
  KEY `index_col2` (`col2`)
) ENGINE=InnoDB DEFAULT CHARSET=utf8mb4 COLLATE=utf8mb4_0900_ai_ci
/*!50100 PARTITION BY KEY (col1)
PARTITIONS 5 */
SELECT count(*) from t2;
count(*)
20
SELECT col1, col2, col3 FROM t2 ORDER BY col1;
col1	col2	col3
1	401	601
2	402	602
3	403	603
4	404	604
5	405	605
6	406	606
7	407	607
8	408	608
9	409	609
10	410	610
11	411	611
12	412	612
13	413	613
14	414	614
15	415	615
16	416	616
17	417	617
18	418	618
19	419	619
20	420	620
SELECT col1, col2, col3 FROM t2 ORDER BY col1;
col1	col2	col3
1	401	601
2	402	602
3	403	603
4	404	604
5	405	605
6	406	606
7	407	607
8	408	608
9	409	609
10	410	610
11	411	611
12	412	612
13	413	613
14	414	614
15	415	615
16	416	616
17	417	617
18	418	618
19	419	619
20	420	620
# enable encryption function
set global clone_encrypt_key_path= 'MYSQL_TEST_DIR/std_data/mysql_clone_key';
CLONE LOCAL DATA DIRECTORY = 'CLONE_DATADIR1' ENABLE PAGE TRACK INCREMENT BASED DIRECTORY = 'CLONE_DATADIR';;
# In connection default - Finished Cloning
# In connection con1 - Waiting
commit;
# In connection default
# apply delta file from increment clone datadir to full clone
drop table t1;
drop table t2;
drop table `l#g/l'g.`;
UNINSTALL PLUGIN clone;
# 6. Test remote increment clone by using based datadir
INSTALL PLUGIN clone SONAME 'CLONE_PLUGIN';
truncate mysql.clone_history;
SET GLOBAL clone_valid_donor_list = 'HOST:PORT';
CLONE INSTANCE FROM USER@HOST:PORT IDENTIFIED BY '' DATA DIRECTORY = 'CLONE_DATADIR' ENABLE PAGE TRACK;;
CREATE TABLE t1(col1 INT PRIMARY KEY, col2 int, col3 varchar(64), col4 BLOB);
CREATE TABLE t2(col1 INT PRIMARY KEY, col2 int, col3 varchar(64), col4 BLOB)
PARTITION BY KEY(col1) PARTITIONS 5;
insert into t1 values(1,1,1,"aaa");
insert into t1 values(2,2,2,"aaa");
insert into t1 values(3,3,3,"aaa");
insert into t1 values(4,4,4,"aaa");
insert into t1 values(5,5,5,"aaa");
insert into t1 values(6,6,6,"aaa");
insert into t1 values(7,7,7,"aaa");
insert into t1 values(8,8,8,"aaa");
insert into t1 values(9,9,9,"aaa");
insert into t1 values(10,10,10,"aaa");
insert into t1 values(11,11,11,"aaa");
insert into t1 values(12,12,12,"aaa");
insert into t1 values(13,13,13,"aaa");
insert into t1 values(14,14,14,"aaa");
insert into t1 values(15,15,15,"aaa");
insert into t1 values(16,16,16,"aaa");
insert into t1 values(17,17,17,"aaa");
insert into t1 values(18,18,18,"aaa");
insert into t1 values(19,19,19,"aaa");
insert into t1 values(20,20,20,"aaa");
insert into t2 values(1,1,1,"aaa");
insert into t2 values(2,2,2,"aaa");
insert into t2 values(3,3,3,"aaa");
insert into t2 values(4,4,4,"aaa");
insert into t2 values(5,5,5,"aaa");
insert into t2 values(6,6,6,"aaa");
insert into t2 values(7,7,7,"aaa");
insert into t2 values(8,8,8,"aaa");
insert into t2 values(9,9,9,"aaa");
insert into t2 values(10,10,10,"aaa");
insert into t2 values(11,11,11,"aaa");
insert into t2 values(12,12,12,"aaa");
insert into t2 values(13,13,13,"aaa");
insert into t2 values(14,14,14,"aaa");
insert into t2 values(15,15,15,"aaa");
insert into t2 values(16,16,16,"aaa");
insert into t2 values(17,17,17,"aaa");
insert into t2 values(18,18,18,"aaa");
insert into t2 values(19,19,19,"aaa");
insert into t2 values(20,20,20,"aaa");
update t1 set col2=col2+100;
update t2 set col2=col2+100;
update t1 set col2=col2+100;
update t2 set col2=col2+100;
update t1 set col2=col2+100;
update t2 set col2=col2+100;
update t1 set col2=col2+100;
update t2 set col2=col2+100;
update t1 set col3=col3+100;
update t2 set col3=col3+100;
update t1 set col3=col3+100;
update t2 set col3=col3+100;
update t1 set col3=col3+100;
update t2 set col3=col3+100;
update t1 set col3=col3+100;
update t2 set col3=col3+100;
update t1 set col3=col3+100;
update t2 set col3=col3+100;
update t1 set col3=col3+100;
update t2 set col3=col3+100;
CREATE INDEX index_col2 ON t1 (col2);
CREATE INDEX index_col2 ON t2 (col2);
SHOW CREATE TABLE t1;
Table	Create Table
t1	CREATE TABLE `t1` (
  `col1` int NOT NULL,
  `col2` int DEFAULT NULL,
  `col3` varchar(64) DEFAULT NULL,
  `col4` blob,
  PRIMARY KEY (`col1`),
  KEY `index_col2` (`col2`)
) ENGINE=InnoDB DEFAULT CHARSET=utf8mb4 COLLATE=utf8mb4_0900_ai_ci
SELECT count(*) from t1;
count(*)
20
SELECT col1, col2, col3 FROM t1 ORDER BY col1;
col1	col2	col3
1	401	601
2	402	602
3	403	603
4	404	604
5	405	605
6	406	606
7	407	607
8	408	608
9	409	609
10	410	610
11	411	611
12	412	612
13	413	613
14	414	614
15	415	615
16	416	616
17	417	617
18	418	618
19	419	619
20	420	620
SELECT col1, col2, col3 FROM t1 ORDER BY col1;
col1	col2	col3
1	401	601
2	402	602
3	403	603
4	404	604
5	405	605
6	406	606
7	407	607
8	408	608
9	409	609
10	410	610
11	411	611
12	412	612
13	413	613
14	414	614
15	415	615
16	416	616
17	417	617
18	418	618
19	419	619
20	420	620
SHOW CREATE TABLE t2;
Table	Create Table
t2	CREATE TABLE `t2` (
  `col1` int NOT NULL,
  `col2` int DEFAULT NULL,
  `col3` varchar(64) DEFAULT NULL,
  `col4` blob,
  PRIMARY KEY (`col1`),
  KEY `index_col2` (`col2`)
) ENGINE=InnoDB DEFAULT CHARSET=utf8mb4 COLLATE=utf8mb4_0900_ai_ci
/*!50100 PARTITION BY KEY (col1)
PARTITIONS 5 */
SELECT count(*) from t2;
count(*)
20
SELECT col1, col2, col3 FROM t2 ORDER BY col1;
col1	col2	col3
1	401	601
2	402	602
3	403	603
4	404	604
5	405	605
6	406	606
7	407	607
8	408	608
9	409	609
10	410	610
11	411	611
12	412	612
13	413	613
14	414	614
15	415	615
16	416	616
17	417	617
18	418	618
19	419	619
20	420	620
SELECT col1, col2, col3 FROM t2 ORDER BY col1 DESC;
col1	col2	col3
20	420	620
19	419	619
18	418	618
17	417	617
16	416	616
15	415	615
14	414	614
13	413	613
12	412	612
11	411	611
10	410	610
9	409	609
8	408	608
7	407	607
6	406	606
5	405	605
4	404	604
3	403	603
2	402	602
1	401	601
# In connection con1 - Running Insert
begin;
insert into t1 values(120,120,120,"aaa");
# In connection default - Cloning database
SELECT count(*) from t1;
count(*)
20
SELECT col1, col2, col3 FROM t1 ORDER BY col1;
col1	col2	col3
1	401	601
2	402	602
3	403	603
4	404	604
5	405	605
6	406	606
7	407	607
8	408	608
9	409	609
10	410	610
11	411	611
12	412	612
13	413	613
14	414	614
15	415	615
16	416	616
17	417	617
18	418	618
19	419	619
20	420	620
SELECT col1, col2, col3 FROM t1 ORDER BY col1;
col1	col2	col3
1	401	601
2	402	602
3	403	603
4	404	604
5	405	605
6	406	606
7	407	607
8	408	608
9	409	609
10	410	610
11	411	611
12	412	612
13	413	613
14	414	614
15	415	615
16	416	616
17	417	617
18	418	618
19	419	619
20	420	620
SHOW CREATE TABLE t2;
Table	Create Table
t2	CREATE TABLE `t2` (
  `col1` int NOT NULL,
  `col2` int DEFAULT NULL,
  `col3` varchar(64) DEFAULT NULL,
  `col4` blob,
  PRIMARY KEY (`col1`),
  KEY `index_col2` (`col2`)
) ENGINE=InnoDB DEFAULT CHARSET=utf8mb4 COLLATE=utf8mb4_0900_ai_ci
/*!50100 PARTITION BY KEY (col1)
PARTITIONS 5 */
SELECT count(*) from t2;
count(*)
20
SELECT col1, col2, col3 FROM t2 ORDER BY col1;
col1	col2	col3
1	401	601
2	402	602
3	403	603
4	404	604
5	405	605
6	406	606
7	407	607
8	408	608
9	409	609
10	410	610
11	411	611
12	412	612
13	413	613
14	414	614
15	415	615
16	416	616
17	417	617
18	418	618
19	419	619
20	420	620
SELECT col1, col2, col3 FROM t2 ORDER BY col1;
col1	col2	col3
1	401	601
2	402	602
3	403	603
4	404	604
5	405	605
6	406	606
7	407	607
8	408	608
9	409	609
10	410	610
11	411	611
12	412	612
13	413	613
14	414	614
15	415	615
16	416	616
17	417	617
18	418	618
19	419	619
20	420	620
# enable encryption function
set global clone_encrypt_key_path= 'MYSQL_TEST_DIR/std_data/mysql_clone_key';
CLONE INSTANCE FROM USER@HOST:PORT IDENTIFIED BY '' DATA DIRECTORY = 'CLONE_DATADIR1' ENABLE PAGE TRACK INCREMENT BASED DIRECTORY = 'CLONE_DATADIR';;
# In connection default - Finished Cloning
# In connection con1 - Waiting
commit;
# In connection default
# apply delta file from increment clone datadir to full clone
drop table t1;
drop table t2;
INSTALL COMPONENT "file://component_mysqlbackup";
SELECT mysqlbackup_page_track_set(false);
mysqlbackup_page_track_set(false)
XXXX
UNINSTALL COMPONENT "file://component_mysqlbackup";
UNINSTALL PLUGIN clone;
