SET NAMES utf8mb4;
SET CHARACTER_SET_CLIENT=utf8mb4;
SET COLLATION_CONNECTION=utf8mb4_bin;
drop database if exists db;
create database db;
use db;
create table t1(c1 int primary key, c2 int , c3 int, c4 int , c5 int, c6 int, key(c2, c3), unique key(c4, c5));
insert into t1 values(1, 1, 1, 1, 1, 1);
insert into t1 values(2, 2, 2, 2, 2, 2);
insert into t1 values(3, 3, 3, 3, 3, 3);
insert into t1 values(4, 4, 4, 4, 4, 4);
call sys_mac.mac_apply_user_policy('root','localhost','P1','L4:C2,C3,C4:G1', 'L2:C2,C3:G1', 'L3:C3,C4:G1','L3:C3:G1');
call sys_mac.mac_apply_row_policy('db', 't1', 'P1', 'L3:C3,C4:G1', 0);
SET NAMES utf8mb4;
SET CHARACTER_SET_CLIENT=utf8mb4;
SET COLLATION_CONNECTION=utf8mb4_bin;
use db;
select * from t1;
c1	c2	c3	c4	c5	c6
1	1	1	1	1	1
2	2	2	2	2	2
3	3	3	3	3	3
4	4	4	4	4	4
#test insert#
insert into t1 values(5, 1, 1, 1, 5, 1);
insert into t1 values(6, 2, 2, 2, 6, 2);
insert into t1 values(7, 3, 3, 3, 7, 3);
insert into t1 values(8, 4, 4, 4, 8, 4);
select mac_set_row_label('P1','L2:C3:G1');
mac_set_row_label('P1','L2:C3:G1')
success to set row label
select mac_get_session_labels('P1');
mac_get_session_labels('P1')

READ_LABEL : L4:C2,C3,C4:G1,G1_1,G1_2,G1_1_1
WRITE_LABEL : L2:C2,C3:G1,G1_1,G1_2,G1_1_1
DEF_READ_LABEL : L3:C3,C4:G1,G1_1,G1_2,G1_1_1
DEF_WRITE_LABEL : L2:C3:G1,G1_1,G1_2,G1_1_1
DEF_ROW_LABEL : L2:C3:G1

insert into t1 values(9, 1, 1, 1, 9, 1);
insert into t1 values(10, 2, 2, 2, 10, 2);
insert into t1 values(11, 3, 3, 3, 11, 3);
insert into t1 values(12, 4, 4, 4, 12, 4);
select mac_set_def_label('P1','L4:C3:G1');
mac_set_def_label('P1','L4:C3:G1')
success to set def label
select mac_get_session_labels('P1');
mac_get_session_labels('P1')

READ_LABEL : L4:C2,C3,C4:G1,G1_1,G1_2,G1_1_1
WRITE_LABEL : L2:C2,C3:G1,G1_1,G1_2,G1_1_1
DEF_READ_LABEL : L4:C3:G1,G1_1,G1_2,G1_1_1
DEF_WRITE_LABEL : L2:C3:G1,G1_1,G1_2,G1_1_1
DEF_ROW_LABEL : L4:C3:G1

insert into t1 values(13, 1, 1, 1, 13, 1);
insert into t1 values(14, 2, 2, 2, 14, 2);
insert into t1 values(15, 3, 3, 3, 15, 3);
insert into t1 values(16, 4, 4, 4, 16, 4);
select mac_set_def_label('P1', 'L3:C2,C3:');
mac_set_def_label('P1', 'L3:C2,C3:')
success to set def label
select mac_get_session_labels('P1');
mac_get_session_labels('P1')

READ_LABEL : L4:C2,C3,C4:G1,G1_1,G1_2,G1_1_1
WRITE_LABEL : L2:C2,C3:G1,G1_1,G1_2,G1_1_1
DEF_READ_LABEL : L3:C2,C3:
DEF_WRITE_LABEL : L2:C2,C3:
DEF_ROW_LABEL : L3:C2,C3:

insert into t1 values(17, 1, 1, 1, 17, 1);
insert into t1 values(18, 2, 2, 2, 18, 2);
insert into t1 values(19, 3, 3, 3, 19, 3);
insert into t1 values(20, 4, 4, 4, 20, 4);
select mac_set_def_label('P1', 'L3:C2:');
mac_set_def_label('P1', 'L3:C2:')
success to set def label
select mac_get_session_labels('P1');
mac_get_session_labels('P1')

READ_LABEL : L4:C2,C3,C4:G1,G1_1,G1_2,G1_1_1
WRITE_LABEL : L2:C2,C3:G1,G1_1,G1_2,G1_1_1
DEF_READ_LABEL : L3:C2:
DEF_WRITE_LABEL : L2:C2:
DEF_ROW_LABEL : L3:C2:

insert into t1 values(21, 1, 1, 1, 21, 1);
insert into t1 values(22, 2, 2, 2, 22, 2);
insert into t1 values(23, 3, 3, 3, 23, 3);
insert into t1 values(24, 4, 4, 4, 24, 4);
select mac_set_def_label('P1', 'L3:C3:');
mac_set_def_label('P1', 'L3:C3:')
success to set def label
select mac_get_session_labels('P1');
mac_get_session_labels('P1')

READ_LABEL : L4:C2,C3,C4:G1,G1_1,G1_2,G1_1_1
WRITE_LABEL : L2:C2,C3:G1,G1_1,G1_2,G1_1_1
DEF_READ_LABEL : L3:C3:
DEF_WRITE_LABEL : L2:C3:
DEF_ROW_LABEL : L3:C3:

insert into t1 values(25, 1, 1, 1, 25, 1);
insert into t1 values(26, 2, 2, 2, 26, 2);
insert into t1 values(27, 3, 3, 3, 27, 3);
insert into t1 values(28, 4, 4, 4, 28, 4);
select mac_set_def_label('P1', 'L3::');
mac_set_def_label('P1', 'L3::')
success to set def label
select mac_get_session_labels('P1');
mac_get_session_labels('P1')

READ_LABEL : L4:C2,C3,C4:G1,G1_1,G1_2,G1_1_1
WRITE_LABEL : L2:C2,C3:G1,G1_1,G1_2,G1_1_1
DEF_READ_LABEL : L3::
DEF_WRITE_LABEL : L2::
DEF_ROW_LABEL : L3::

insert into t1 values(29, 1, 1, 1, 29, 1);
insert into t1 values(30, 2, 2, 2, 30, 2);
insert into t1 values(31, 3, 3, 3, 31, 3);
insert into t1 values(32, 4, 4, 4, 32, 4);
select mac_set_def_label('P1', 'L3:C2:G1');
mac_set_def_label('P1', 'L3:C2:G1')
success to set def label
select mac_get_session_labels('P1');
mac_get_session_labels('P1')

READ_LABEL : L4:C2,C3,C4:G1,G1_1,G1_2,G1_1_1
WRITE_LABEL : L2:C2,C3:G1,G1_1,G1_2,G1_1_1
DEF_READ_LABEL : L3:C2:G1,G1_1,G1_2,G1_1_1
DEF_WRITE_LABEL : L2:C2:G1,G1_1,G1_2,G1_1_1
DEF_ROW_LABEL : L3:C2:G1

insert into t1 values(33, 1, 1, 1, 33, 1);
insert into t1 values(34, 2, 2, 2, 34, 2);
insert into t1 values(35, 3, 3, 3, 35, 3);
insert into t1 values(36, 4, 4, 4, 36, 4);
select mac_set_def_label('P1', 'L3:C2,C3:G1');
mac_set_def_label('P1', 'L3:C2,C3:G1')
success to set def label
select mac_get_session_labels('P1');
mac_get_session_labels('P1')

READ_LABEL : L4:C2,C3,C4:G1,G1_1,G1_2,G1_1_1
WRITE_LABEL : L2:C2,C3:G1,G1_1,G1_2,G1_1_1
DEF_READ_LABEL : L3:C2,C3:G1,G1_1,G1_2,G1_1_1
DEF_WRITE_LABEL : L2:C2,C3:G1,G1_1,G1_2,G1_1_1
DEF_ROW_LABEL : L3:C2,C3:G1

insert into t1 values(37, 1, 1, 1, 37, 1);
insert into t1 values(38, 2, 2, 2, 38, 2);
insert into t1 values(39, 3, 3, 3, 39, 3);
insert into t1 values(40, 4, 4, 4, 40, 4);
select mac_set_def_label('P1', 'L3::G1');
mac_set_def_label('P1', 'L3::G1')
success to set def label
select mac_get_session_labels('P1');
mac_get_session_labels('P1')

READ_LABEL : L4:C2,C3,C4:G1,G1_1,G1_2,G1_1_1
WRITE_LABEL : L2:C2,C3:G1,G1_1,G1_2,G1_1_1
DEF_READ_LABEL : L3::G1,G1_1,G1_2,G1_1_1
DEF_WRITE_LABEL : L2::G1,G1_1,G1_2,G1_1_1
DEF_ROW_LABEL : L3::G1

insert into t1 values(41, 1, 1, 1, 41, 1);
insert into t1 values(42, 2, 2, 2, 42, 2);
insert into t1 values(43, 3, 3, 3, 43, 3);
insert into t1 values(44, 4, 4, 4, 44, 4);
######################################################################
select mac_set_def_label('P1', 'L4:C2,C3,C4:G1');
mac_set_def_label('P1', 'L4:C2,C3,C4:G1')
success to set def label
select * from t1;
c1	c2	c3	c4	c5	c6
1	1	1	1	1	1
10	2	2	2	10	2
11	3	3	3	11	3
12	4	4	4	12	4
13	1	1	1	13	1
14	2	2	2	14	2
15	3	3	3	15	3
16	4	4	4	16	4
17	1	1	1	17	1
18	2	2	2	18	2
19	3	3	3	19	3
2	2	2	2	2	2
20	4	4	4	20	4
21	1	1	1	21	1
22	2	2	2	22	2
23	3	3	3	23	3
24	4	4	4	24	4
25	1	1	1	25	1
26	2	2	2	26	2
27	3	3	3	27	3
28	4	4	4	28	4
29	1	1	1	29	1
3	3	3	3	3	3
30	2	2	2	30	2
31	3	3	3	31	3
32	4	4	4	32	4
33	1	1	1	33	1
34	2	2	2	34	2
35	3	3	3	35	3
36	4	4	4	36	4
37	1	1	1	37	1
38	2	2	2	38	2
39	3	3	3	39	3
4	4	4	4	4	4
40	4	4	4	40	4
41	1	1	1	41	1
42	2	2	2	42	2
43	3	3	3	43	3
44	4	4	4	44	4
5	1	1	1	5	1
6	2	2	2	6	2
7	3	3	3	7	3
8	4	4	4	8	4
9	1	1	1	9	1
select c1, c2, c3, c4, c5, c6, _gdb_mac_policy_1 from t1;
c1	c2	c3	c4	c5	c6	_gdb_mac_policy_1
1	1	1	1	1	1	8
10	2	2	2	10	2	10
11	3	3	3	11	3	10
12	4	4	4	12	4	10
13	1	1	1	13	1	16
14	2	2	2	14	2	16
15	3	3	3	15	3	16
16	4	4	4	16	4	16
17	1	1	1	17	1	17
18	2	2	2	18	2	17
19	3	3	3	19	3	17
2	2	2	2	2	2	8
20	4	4	4	20	4	17
21	1	1	1	21	1	19
22	2	2	2	22	2	19
23	3	3	3	23	3	19
24	4	4	4	24	4	19
25	1	1	1	25	1	21
26	2	2	2	26	2	21
27	3	3	3	27	3	21
28	4	4	4	28	4	21
29	1	1	1	29	1	23
3	3	3	3	3	3	8
30	2	2	2	30	2	23
31	3	3	3	31	3	23
32	4	4	4	32	4	23
33	1	1	1	33	1	26
34	2	2	2	34	2	26
35	3	3	3	35	3	26
36	4	4	4	36	4	26
37	1	1	1	37	1	30
38	2	2	2	38	2	30
39	3	3	3	39	3	30
4	4	4	4	4	4	8
40	4	4	4	40	4	30
41	1	1	1	41	1	32
42	2	2	2	42	2	32
43	3	3	3	43	3	32
44	4	4	4	44	4	32
5	1	1	1	5	1	1
6	2	2	2	6	2	1
7	3	3	3	7	3	1
8	4	4	4	8	4	1
9	1	1	1	9	1	10
select * from t1 where c1 = 1;
c1	c2	c3	c4	c5	c6
1	1	1	1	1	1
select * from t1 where c1 = 5;
c1	c2	c3	c4	c5	c6
5	1	1	1	5	1
select * from t1 where c1 = 9;
c1	c2	c3	c4	c5	c6
9	1	1	1	9	1
select * from t1 where c1 = 13;
c1	c2	c3	c4	c5	c6
13	1	1	1	13	1
select * from t1 where c1 = 17;
c1	c2	c3	c4	c5	c6
17	1	1	1	17	1
select * from t1 where c1 = 21;
c1	c2	c3	c4	c5	c6
21	1	1	1	21	1
select * from t1 where c1 = 25;
c1	c2	c3	c4	c5	c6
25	1	1	1	25	1
select * from t1 where c1 = 29;
c1	c2	c3	c4	c5	c6
29	1	1	1	29	1
select * from t1 where c1 = 33;
c1	c2	c3	c4	c5	c6
33	1	1	1	33	1
select * from t1 where c1 = 37;
c1	c2	c3	c4	c5	c6
37	1	1	1	37	1
select * from t1 where c1 = 40;
c1	c2	c3	c4	c5	c6
40	4	4	4	40	4
select * from t1 where (c1 >= 1 and c1 <= 16) or (c1 > 18 and c1 < 42);
c1	c2	c3	c4	c5	c6
1	1	1	1	1	1
10	2	2	2	10	2
11	3	3	3	11	3
12	4	4	4	12	4
13	1	1	1	13	1
14	2	2	2	14	2
15	3	3	3	15	3
16	4	4	4	16	4
19	3	3	3	19	3
2	2	2	2	2	2
20	4	4	4	20	4
21	1	1	1	21	1
22	2	2	2	22	2
23	3	3	3	23	3
24	4	4	4	24	4
25	1	1	1	25	1
26	2	2	2	26	2
27	3	3	3	27	3
28	4	4	4	28	4
29	1	1	1	29	1
3	3	3	3	3	3
30	2	2	2	30	2
31	3	3	3	31	3
32	4	4	4	32	4
33	1	1	1	33	1
34	2	2	2	34	2
35	3	3	3	35	3
36	4	4	4	36	4
37	1	1	1	37	1
38	2	2	2	38	2
39	3	3	3	39	3
4	4	4	4	4	4
40	4	4	4	40	4
41	1	1	1	41	1
5	1	1	1	5	1
6	2	2	2	6	2
7	3	3	3	7	3
8	4	4	4	8	4
9	1	1	1	9	1
select * from t1 where c1 > 1 and c1 < 14 or c1 = 21 or c1 > 25;
c1	c2	c3	c4	c5	c6
10	2	2	2	10	2
11	3	3	3	11	3
12	4	4	4	12	4
13	1	1	1	13	1
2	2	2	2	2	2
21	1	1	1	21	1
26	2	2	2	26	2
27	3	3	3	27	3
28	4	4	4	28	4
29	1	1	1	29	1
3	3	3	3	3	3
30	2	2	2	30	2
31	3	3	3	31	3
32	4	4	4	32	4
33	1	1	1	33	1
34	2	2	2	34	2
35	3	3	3	35	3
36	4	4	4	36	4
37	1	1	1	37	1
38	2	2	2	38	2
39	3	3	3	39	3
4	4	4	4	4	4
40	4	4	4	40	4
41	1	1	1	41	1
42	2	2	2	42	2
43	3	3	3	43	3
44	4	4	4	44	4
5	1	1	1	5	1
6	2	2	2	6	2
7	3	3	3	7	3
8	4	4	4	8	4
9	1	1	1	9	1
select c1 from t1 where c1 = 1;
c1
1
select c1 from t1 where c1 = 5;
c1
5
select c1 from t1 where c1 = 9;
c1
9
select c1 from t1 where c1 = 13;
c1
13
select c1 from t1 where c1 = 17;
c1
17
select c1 from t1 where c1 = 21;
c1
21
select c1 from t1 where c1 = 25;
c1
25
select c1 from t1 where c1 = 29;
c1
29
select c1 from t1 where c1 = 33;
c1
33
select c1 from t1 where c1 = 37;
c1
37
select c1 from t1 where c2 = 40;
c1
select c1 from t1 where (c1 >= 1 and c1 <= 16) or (c1 > 18 and c1 < 42);
c1
1
10
11
12
13
14
15
16
19
2
20
21
22
23
24
25
26
27
28
29
3
30
31
32
33
34
35
36
37
38
39
4
40
41
5
6
7
8
9
select c1 from t1 where c1 > 1 and c1 < 14 or c1 = 21 or c1 > 25;
c1
10
11
12
13
2
21
26
27
28
29
3
30
31
32
33
34
35
36
37
38
39
4
40
41
42
43
44
5
6
7
8
9
select * from t1 where c2 = 1;
c1	c2	c3	c4	c5	c6
1	1	1	1	1	1
5	1	1	1	5	1
9	1	1	1	9	1
13	1	1	1	13	1
17	1	1	1	17	1
21	1	1	1	21	1
25	1	1	1	25	1
29	1	1	1	29	1
33	1	1	1	33	1
37	1	1	1	37	1
41	1	1	1	41	1
select * from t1 where c2 = 2;
c1	c2	c3	c4	c5	c6
10	2	2	2	10	2
14	2	2	2	14	2
18	2	2	2	18	2
2	2	2	2	2	2
22	2	2	2	22	2
26	2	2	2	26	2
30	2	2	2	30	2
34	2	2	2	34	2
38	2	2	2	38	2
42	2	2	2	42	2
6	2	2	2	6	2
select * from t1 where c2 = 3;
c1	c2	c3	c4	c5	c6
11	3	3	3	11	3
15	3	3	3	15	3
19	3	3	3	19	3
23	3	3	3	23	3
27	3	3	3	27	3
3	3	3	3	3	3
31	3	3	3	31	3
35	3	3	3	35	3
39	3	3	3	39	3
43	3	3	3	43	3
7	3	3	3	7	3
select * from t1 where c2 = 4;
c1	c2	c3	c4	c5	c6
12	4	4	4	12	4
16	4	4	4	16	4
20	4	4	4	20	4
24	4	4	4	24	4
28	4	4	4	28	4
32	4	4	4	32	4
36	4	4	4	36	4
4	4	4	4	4	4
40	4	4	4	40	4
44	4	4	4	44	4
8	4	4	4	8	4
select * from t1 where c2 = 1 and c3 = 1;
c1	c2	c3	c4	c5	c6
1	1	1	1	1	1
13	1	1	1	13	1
17	1	1	1	17	1
21	1	1	1	21	1
25	1	1	1	25	1
29	1	1	1	29	1
33	1	1	1	33	1
37	1	1	1	37	1
41	1	1	1	41	1
5	1	1	1	5	1
9	1	1	1	9	1
select * from t1 where c2 = 2 and c3 = 2;
c1	c2	c3	c4	c5	c6
10	2	2	2	10	2
14	2	2	2	14	2
18	2	2	2	18	2
2	2	2	2	2	2
22	2	2	2	22	2
26	2	2	2	26	2
30	2	2	2	30	2
34	2	2	2	34	2
38	2	2	2	38	2
42	2	2	2	42	2
6	2	2	2	6	2
select * from t1 where c2 = 3 and c3 = 3;
c1	c2	c3	c4	c5	c6
11	3	3	3	11	3
15	3	3	3	15	3
19	3	3	3	19	3
23	3	3	3	23	3
27	3	3	3	27	3
3	3	3	3	3	3
31	3	3	3	31	3
35	3	3	3	35	3
39	3	3	3	39	3
43	3	3	3	43	3
7	3	3	3	7	3
select * from t1 where c2 = 4 and c4 = 4;
c1	c2	c3	c4	c5	c6
12	4	4	4	12	4
16	4	4	4	16	4
20	4	4	4	20	4
24	4	4	4	24	4
28	4	4	4	28	4
32	4	4	4	32	4
36	4	4	4	36	4
4	4	4	4	4	4
40	4	4	4	40	4
44	4	4	4	44	4
8	4	4	4	8	4
select * from t1 where c2 >= 1 and c2 <= 4;
c1	c2	c3	c4	c5	c6
1	1	1	1	1	1
10	2	2	2	10	2
11	3	3	3	11	3
12	4	4	4	12	4
13	1	1	1	13	1
14	2	2	2	14	2
15	3	3	3	15	3
16	4	4	4	16	4
17	1	1	1	17	1
18	2	2	2	18	2
19	3	3	3	19	3
2	2	2	2	2	2
20	4	4	4	20	4
21	1	1	1	21	1
22	2	2	2	22	2
23	3	3	3	23	3
24	4	4	4	24	4
25	1	1	1	25	1
26	2	2	2	26	2
27	3	3	3	27	3
28	4	4	4	28	4
29	1	1	1	29	1
3	3	3	3	3	3
30	2	2	2	30	2
31	3	3	3	31	3
32	4	4	4	32	4
33	1	1	1	33	1
34	2	2	2	34	2
35	3	3	3	35	3
36	4	4	4	36	4
37	1	1	1	37	1
38	2	2	2	38	2
39	3	3	3	39	3
4	4	4	4	4	4
40	4	4	4	40	4
41	1	1	1	41	1
42	2	2	2	42	2
43	3	3	3	43	3
44	4	4	4	44	4
5	1	1	1	5	1
6	2	2	2	6	2
7	3	3	3	7	3
8	4	4	4	8	4
9	1	1	1	9	1
select * from t1 where c2 >= 1 and c2 < 3 or c2 = 4;
c1	c2	c3	c4	c5	c6
1	1	1	1	1	1
10	2	2	2	10	2
12	4	4	4	12	4
13	1	1	1	13	1
14	2	2	2	14	2
16	4	4	4	16	4
17	1	1	1	17	1
18	2	2	2	18	2
2	2	2	2	2	2
20	4	4	4	20	4
21	1	1	1	21	1
22	2	2	2	22	2
24	4	4	4	24	4
25	1	1	1	25	1
26	2	2	2	26	2
28	4	4	4	28	4
29	1	1	1	29	1
30	2	2	2	30	2
32	4	4	4	32	4
33	1	1	1	33	1
34	2	2	2	34	2
36	4	4	4	36	4
37	1	1	1	37	1
38	2	2	2	38	2
4	4	4	4	4	4
40	4	4	4	40	4
41	1	1	1	41	1
42	2	2	2	42	2
44	4	4	4	44	4
5	1	1	1	5	1
6	2	2	2	6	2
8	4	4	4	8	4
9	1	1	1	9	1
select * from t1 where c3 = 1;
c1	c2	c3	c4	c5	c6
1	1	1	1	1	1
13	1	1	1	13	1
17	1	1	1	17	1
21	1	1	1	21	1
25	1	1	1	25	1
29	1	1	1	29	1
33	1	1	1	33	1
37	1	1	1	37	1
41	1	1	1	41	1
5	1	1	1	5	1
9	1	1	1	9	1
select * from t1 where c3 = 2;
c1	c2	c3	c4	c5	c6
10	2	2	2	10	2
14	2	2	2	14	2
18	2	2	2	18	2
2	2	2	2	2	2
22	2	2	2	22	2
26	2	2	2	26	2
30	2	2	2	30	2
34	2	2	2	34	2
38	2	2	2	38	2
42	2	2	2	42	2
6	2	2	2	6	2
select * from t1 where c3 = 3;
c1	c2	c3	c4	c5	c6
11	3	3	3	11	3
15	3	3	3	15	3
19	3	3	3	19	3
23	3	3	3	23	3
27	3	3	3	27	3
3	3	3	3	3	3
31	3	3	3	31	3
35	3	3	3	35	3
39	3	3	3	39	3
43	3	3	3	43	3
7	3	3	3	7	3
select * from t1 where c3 = 4;
c1	c2	c3	c4	c5	c6
12	4	4	4	12	4
16	4	4	4	16	4
20	4	4	4	20	4
24	4	4	4	24	4
28	4	4	4	28	4
32	4	4	4	32	4
36	4	4	4	36	4
4	4	4	4	4	4
40	4	4	4	40	4
44	4	4	4	44	4
8	4	4	4	8	4
select * from t1 where c3 >= 1 and c3 <= 4;
c1	c2	c3	c4	c5	c6
1	1	1	1	1	1
10	2	2	2	10	2
11	3	3	3	11	3
12	4	4	4	12	4
13	1	1	1	13	1
14	2	2	2	14	2
15	3	3	3	15	3
16	4	4	4	16	4
17	1	1	1	17	1
18	2	2	2	18	2
19	3	3	3	19	3
2	2	2	2	2	2
20	4	4	4	20	4
21	1	1	1	21	1
22	2	2	2	22	2
23	3	3	3	23	3
24	4	4	4	24	4
25	1	1	1	25	1
26	2	2	2	26	2
27	3	3	3	27	3
28	4	4	4	28	4
29	1	1	1	29	1
3	3	3	3	3	3
30	2	2	2	30	2
31	3	3	3	31	3
32	4	4	4	32	4
33	1	1	1	33	1
34	2	2	2	34	2
35	3	3	3	35	3
36	4	4	4	36	4
37	1	1	1	37	1
38	2	2	2	38	2
39	3	3	3	39	3
4	4	4	4	4	4
40	4	4	4	40	4
41	1	1	1	41	1
42	2	2	2	42	2
43	3	3	3	43	3
44	4	4	4	44	4
5	1	1	1	5	1
6	2	2	2	6	2
7	3	3	3	7	3
8	4	4	4	8	4
9	1	1	1	9	1
select * from t1 where c4 = 1;
c1	c2	c3	c4	c5	c6
1	1	1	1	1	1
13	1	1	1	13	1
17	1	1	1	17	1
21	1	1	1	21	1
25	1	1	1	25	1
29	1	1	1	29	1
33	1	1	1	33	1
37	1	1	1	37	1
41	1	1	1	41	1
5	1	1	1	5	1
9	1	1	1	9	1
select * from t1 where c4 = 2;
c1	c2	c3	c4	c5	c6
10	2	2	2	10	2
14	2	2	2	14	2
18	2	2	2	18	2
2	2	2	2	2	2
22	2	2	2	22	2
26	2	2	2	26	2
30	2	2	2	30	2
34	2	2	2	34	2
38	2	2	2	38	2
42	2	2	2	42	2
6	2	2	2	6	2
select * from t1 where c4 = 3;
c1	c2	c3	c4	c5	c6
11	3	3	3	11	3
15	3	3	3	15	3
19	3	3	3	19	3
23	3	3	3	23	3
27	3	3	3	27	3
3	3	3	3	3	3
31	3	3	3	31	3
35	3	3	3	35	3
39	3	3	3	39	3
43	3	3	3	43	3
7	3	3	3	7	3
select * from t1 where c4 = 4;
c1	c2	c3	c4	c5	c6
12	4	4	4	12	4
16	4	4	4	16	4
20	4	4	4	20	4
24	4	4	4	24	4
28	4	4	4	28	4
32	4	4	4	32	4
36	4	4	4	36	4
4	4	4	4	4	4
40	4	4	4	40	4
44	4	4	4	44	4
8	4	4	4	8	4
select * from t1 where c4 >= 1 and c4 < 3 or c4 = 4;
c1	c2	c3	c4	c5	c6
1	1	1	1	1	1
10	2	2	2	10	2
12	4	4	4	12	4
13	1	1	1	13	1
14	2	2	2	14	2
16	4	4	4	16	4
17	1	1	1	17	1
18	2	2	2	18	2
2	2	2	2	2	2
20	4	4	4	20	4
21	1	1	1	21	1
22	2	2	2	22	2
24	4	4	4	24	4
25	1	1	1	25	1
26	2	2	2	26	2
28	4	4	4	28	4
29	1	1	1	29	1
30	2	2	2	30	2
32	4	4	4	32	4
33	1	1	1	33	1
34	2	2	2	34	2
36	4	4	4	36	4
37	1	1	1	37	1
38	2	2	2	38	2
4	4	4	4	4	4
40	4	4	4	40	4
41	1	1	1	41	1
42	2	2	2	42	2
44	4	4	4	44	4
5	1	1	1	5	1
6	2	2	2	6	2
8	4	4	4	8	4
9	1	1	1	9	1
select * from t1 where c5 = 1;
c1	c2	c3	c4	c5	c6
1	1	1	1	1	1
select * from t1 where c5 = 5;
c1	c2	c3	c4	c5	c6
5	1	1	1	5	1
select * from t1 where c5 = 9;
c1	c2	c3	c4	c5	c6
9	1	1	1	9	1
select * from t1 where c5 = 13;
c1	c2	c3	c4	c5	c6
13	1	1	1	13	1
select * from t1 where c5 = 17;
c1	c2	c3	c4	c5	c6
17	1	1	1	17	1
select * from t1 where c5 = 21;
c1	c2	c3	c4	c5	c6
21	1	1	1	21	1
select * from t1 where c5 = 25;
c1	c2	c3	c4	c5	c6
25	1	1	1	25	1
select * from t1 where c5 = 29;
c1	c2	c3	c4	c5	c6
29	1	1	1	29	1
select * from t1 where c5 = 33;
c1	c2	c3	c4	c5	c6
33	1	1	1	33	1
select * from t1 where c5 = 37;
c1	c2	c3	c4	c5	c6
37	1	1	1	37	1
select * from t1 where c5 = 40;
c1	c2	c3	c4	c5	c6
40	4	4	4	40	4
select * from t1 where (c5 >= 1 and c5 <= 16) or (c5 > 18 and c5 < 40);
c1	c2	c3	c4	c5	c6
1	1	1	1	1	1
10	2	2	2	10	2
11	3	3	3	11	3
12	4	4	4	12	4
13	1	1	1	13	1
14	2	2	2	14	2
15	3	3	3	15	3
16	4	4	4	16	4
19	3	3	3	19	3
2	2	2	2	2	2
20	4	4	4	20	4
21	1	1	1	21	1
22	2	2	2	22	2
23	3	3	3	23	3
24	4	4	4	24	4
25	1	1	1	25	1
26	2	2	2	26	2
27	3	3	3	27	3
28	4	4	4	28	4
29	1	1	1	29	1
3	3	3	3	3	3
30	2	2	2	30	2
31	3	3	3	31	3
32	4	4	4	32	4
33	1	1	1	33	1
34	2	2	2	34	2
35	3	3	3	35	3
36	4	4	4	36	4
37	1	1	1	37	1
38	2	2	2	38	2
39	3	3	3	39	3
4	4	4	4	4	4
5	1	1	1	5	1
6	2	2	2	6	2
7	3	3	3	7	3
8	4	4	4	8	4
9	1	1	1	9	1
select * from t1 where c5 > 1 and c5 < 14 or c5 = 21 or c5 > 25;
c1	c2	c3	c4	c5	c6
10	2	2	2	10	2
11	3	3	3	11	3
12	4	4	4	12	4
13	1	1	1	13	1
2	2	2	2	2	2
21	1	1	1	21	1
26	2	2	2	26	2
27	3	3	3	27	3
28	4	4	4	28	4
29	1	1	1	29	1
3	3	3	3	3	3
30	2	2	2	30	2
31	3	3	3	31	3
32	4	4	4	32	4
33	1	1	1	33	1
34	2	2	2	34	2
35	3	3	3	35	3
36	4	4	4	36	4
37	1	1	1	37	1
38	2	2	2	38	2
39	3	3	3	39	3
4	4	4	4	4	4
40	4	4	4	40	4
41	1	1	1	41	1
42	2	2	2	42	2
43	3	3	3	43	3
44	4	4	4	44	4
5	1	1	1	5	1
6	2	2	2	6	2
7	3	3	3	7	3
8	4	4	4	8	4
9	1	1	1	9	1
select * from t1 where c6 = 1;
c1	c2	c3	c4	c5	c6
1	1	1	1	1	1
13	1	1	1	13	1
17	1	1	1	17	1
21	1	1	1	21	1
25	1	1	1	25	1
29	1	1	1	29	1
33	1	1	1	33	1
37	1	1	1	37	1
41	1	1	1	41	1
5	1	1	1	5	1
9	1	1	1	9	1
select * from t1 where c6 = 2;
c1	c2	c3	c4	c5	c6
10	2	2	2	10	2
14	2	2	2	14	2
18	2	2	2	18	2
2	2	2	2	2	2
22	2	2	2	22	2
26	2	2	2	26	2
30	2	2	2	30	2
34	2	2	2	34	2
38	2	2	2	38	2
42	2	2	2	42	2
6	2	2	2	6	2
select * from t1 where c6 = 3;
c1	c2	c3	c4	c5	c6
11	3	3	3	11	3
15	3	3	3	15	3
19	3	3	3	19	3
23	3	3	3	23	3
27	3	3	3	27	3
3	3	3	3	3	3
31	3	3	3	31	3
35	3	3	3	35	3
39	3	3	3	39	3
43	3	3	3	43	3
7	3	3	3	7	3
select * from t1 where c6 = 4;
c1	c2	c3	c4	c5	c6
12	4	4	4	12	4
16	4	4	4	16	4
20	4	4	4	20	4
24	4	4	4	24	4
28	4	4	4	28	4
32	4	4	4	32	4
36	4	4	4	36	4
4	4	4	4	4	4
40	4	4	4	40	4
44	4	4	4	44	4
8	4	4	4	8	4
select c1 from t1 order by c1;
c1
1
2
3
4
5
6
7
8
9
10
11
12
13
14
15
16
17
18
19
20
21
22
23
24
25
26
27
28
29
30
31
32
33
34
35
36
37
38
39
40
41
42
43
44
select c2 from t1 order by c2;
c2
1
1
1
1
1
1
1
1
1
1
1
2
2
2
2
2
2
2
2
2
2
2
3
3
3
3
3
3
3
3
3
3
3
4
4
4
4
4
4
4
4
4
4
4
select c3 from t1 order by c3;
c3
1
1
1
1
1
1
1
1
1
1
1
2
2
2
2
2
2
2
2
2
2
2
3
3
3
3
3
3
3
3
3
3
3
4
4
4
4
4
4
4
4
4
4
4
select c4 from t1 order by c4;
c4
1
1
1
1
1
1
1
1
1
1
1
2
2
2
2
2
2
2
2
2
2
2
3
3
3
3
3
3
3
3
3
3
3
4
4
4
4
4
4
4
4
4
4
4
select c5 from t1 order by c5;
c5
1
2
3
4
5
6
7
8
9
10
11
12
13
14
15
16
17
18
19
20
21
22
23
24
25
26
27
28
29
30
31
32
33
34
35
36
37
38
39
40
41
42
43
44
select c6 from t1 order by c6;
c6
1
1
1
1
1
1
1
1
1
1
1
2
2
2
2
2
2
2
2
2
2
2
3
3
3
3
3
3
3
3
3
3
3
4
4
4
4
4
4
4
4
4
4
4
select c1 from t1 order by c1 desc;
c1
44
43
42
41
40
39
38
37
36
35
34
33
32
31
30
29
28
27
26
25
24
23
22
21
20
19
18
17
16
15
14
13
12
11
10
9
8
7
6
5
4
3
2
1
select c2 from t1 order by c2 desc;
c2
4
4
4
4
4
4
4
4
4
4
4
3
3
3
3
3
3
3
3
3
3
3
2
2
2
2
2
2
2
2
2
2
2
1
1
1
1
1
1
1
1
1
1
1
select c3 from t1 order by c3 desc;
c3
4
4
4
4
4
4
4
4
4
4
4
3
3
3
3
3
3
3
3
3
3
3
2
2
2
2
2
2
2
2
2
2
2
1
1
1
1
1
1
1
1
1
1
1
select c4 from t1 order by c4 desc;
c4
4
4
4
4
4
4
4
4
4
4
4
3
3
3
3
3
3
3
3
3
3
3
2
2
2
2
2
2
2
2
2
2
2
1
1
1
1
1
1
1
1
1
1
1
select c5 from t1 order by c5 desc;
c5
44
43
42
41
40
39
38
37
36
35
34
33
32
31
30
29
28
27
26
25
24
23
22
21
20
19
18
17
16
15
14
13
12
11
10
9
8
7
6
5
4
3
2
1
select c6 from t1 order by c6 desc;
c6
4
4
4
4
4
4
4
4
4
4
4
3
3
3
3
3
3
3
3
3
3
3
2
2
2
2
2
2
2
2
2
2
2
1
1
1
1
1
1
1
1
1
1
1
select max(c1) from t1;
max(c1)
44
select max(c2) from t1;
max(c2)
4
select max(c3) from t1;
max(c3)
4
select max(c4) from t1;
max(c4)
4
select max(c5) from t1;
max(c5)
44
select max(c6) from t1;
max(c6)
4
select min(c1) from t1;
min(c1)
1
select min(c2) from t1;
min(c2)
1
select min(c3) from t1;
min(c3)
1
select min(c4) from t1;
min(c4)
1
select min(c5) from t1;
min(c5)
1
select min(c6) from t1;
min(c6)
1
select count(*) from t1;
count(*)
44
select count(1) from t1;
count(1)
44
select count(c1) from t1;
count(c1)
44
select count(c2) from t1;
count(c2)
44
select count(c3) from t1;
count(c3)
44
select count(c4) from t1;
count(c4)
44
select count(c5) from t1;
count(c5)
44
select count(c6) from t1;
count(c6)
44
######################################################################
select mac_set_def_label('P1', 'L3:C2,C3,C4:G1');
mac_set_def_label('P1', 'L3:C2,C3,C4:G1')
success to set def label
select * from t1;
c1	c2	c3	c4	c5	c6
1	1	1	1	1	1
10	2	2	2	10	2
11	3	3	3	11	3
12	4	4	4	12	4
17	1	1	1	17	1
18	2	2	2	18	2
19	3	3	3	19	3
2	2	2	2	2	2
20	4	4	4	20	4
21	1	1	1	21	1
22	2	2	2	22	2
23	3	3	3	23	3
24	4	4	4	24	4
25	1	1	1	25	1
26	2	2	2	26	2
27	3	3	3	27	3
28	4	4	4	28	4
29	1	1	1	29	1
3	3	3	3	3	3
30	2	2	2	30	2
31	3	3	3	31	3
32	4	4	4	32	4
33	1	1	1	33	1
34	2	2	2	34	2
35	3	3	3	35	3
36	4	4	4	36	4
37	1	1	1	37	1
38	2	2	2	38	2
39	3	3	3	39	3
4	4	4	4	4	4
40	4	4	4	40	4
41	1	1	1	41	1
42	2	2	2	42	2
43	3	3	3	43	3
44	4	4	4	44	4
5	1	1	1	5	1
6	2	2	2	6	2
7	3	3	3	7	3
8	4	4	4	8	4
9	1	1	1	9	1
select c1, c2, c3, c4, c5, c6, _gdb_mac_policy_1 from t1;
c1	c2	c3	c4	c5	c6	_gdb_mac_policy_1
1	1	1	1	1	1	8
10	2	2	2	10	2	10
11	3	3	3	11	3	10
12	4	4	4	12	4	10
17	1	1	1	17	1	17
18	2	2	2	18	2	17
19	3	3	3	19	3	17
2	2	2	2	2	2	8
20	4	4	4	20	4	17
21	1	1	1	21	1	19
22	2	2	2	22	2	19
23	3	3	3	23	3	19
24	4	4	4	24	4	19
25	1	1	1	25	1	21
26	2	2	2	26	2	21
27	3	3	3	27	3	21
28	4	4	4	28	4	21
29	1	1	1	29	1	23
3	3	3	3	3	3	8
30	2	2	2	30	2	23
31	3	3	3	31	3	23
32	4	4	4	32	4	23
33	1	1	1	33	1	26
34	2	2	2	34	2	26
35	3	3	3	35	3	26
36	4	4	4	36	4	26
37	1	1	1	37	1	30
38	2	2	2	38	2	30
39	3	3	3	39	3	30
4	4	4	4	4	4	8
40	4	4	4	40	4	30
41	1	1	1	41	1	32
42	2	2	2	42	2	32
43	3	3	3	43	3	32
44	4	4	4	44	4	32
5	1	1	1	5	1	1
6	2	2	2	6	2	1
7	3	3	3	7	3	1
8	4	4	4	8	4	1
9	1	1	1	9	1	10
select * from t1 where c1 = 1;
c1	c2	c3	c4	c5	c6
1	1	1	1	1	1
select * from t1 where c1 = 5;
c1	c2	c3	c4	c5	c6
5	1	1	1	5	1
select * from t1 where c1 = 9;
c1	c2	c3	c4	c5	c6
9	1	1	1	9	1
select * from t1 where c1 = 13;
c1	c2	c3	c4	c5	c6
select * from t1 where c1 = 17;
c1	c2	c3	c4	c5	c6
17	1	1	1	17	1
select * from t1 where c1 = 21;
c1	c2	c3	c4	c5	c6
21	1	1	1	21	1
select * from t1 where c1 = 25;
c1	c2	c3	c4	c5	c6
25	1	1	1	25	1
select * from t1 where c1 = 29;
c1	c2	c3	c4	c5	c6
29	1	1	1	29	1
select * from t1 where c1 = 33;
c1	c2	c3	c4	c5	c6
33	1	1	1	33	1
select * from t1 where c1 = 37;
c1	c2	c3	c4	c5	c6
37	1	1	1	37	1
select * from t1 where c1 = 40;
c1	c2	c3	c4	c5	c6
40	4	4	4	40	4
select * from t1 where (c1 >= 1 and c1 <= 16) or (c1 > 18 and c1 < 42);
c1	c2	c3	c4	c5	c6
1	1	1	1	1	1
10	2	2	2	10	2
11	3	3	3	11	3
12	4	4	4	12	4
19	3	3	3	19	3
2	2	2	2	2	2
20	4	4	4	20	4
21	1	1	1	21	1
22	2	2	2	22	2
23	3	3	3	23	3
24	4	4	4	24	4
25	1	1	1	25	1
26	2	2	2	26	2
27	3	3	3	27	3
28	4	4	4	28	4
29	1	1	1	29	1
3	3	3	3	3	3
30	2	2	2	30	2
31	3	3	3	31	3
32	4	4	4	32	4
33	1	1	1	33	1
34	2	2	2	34	2
35	3	3	3	35	3
36	4	4	4	36	4
37	1	1	1	37	1
38	2	2	2	38	2
39	3	3	3	39	3
4	4	4	4	4	4
40	4	4	4	40	4
41	1	1	1	41	1
5	1	1	1	5	1
6	2	2	2	6	2
7	3	3	3	7	3
8	4	4	4	8	4
9	1	1	1	9	1
select * from t1 where c1 > 1 and c1 < 14 or c1 = 21 or c1 > 25;
c1	c2	c3	c4	c5	c6
10	2	2	2	10	2
11	3	3	3	11	3
12	4	4	4	12	4
2	2	2	2	2	2
21	1	1	1	21	1
26	2	2	2	26	2
27	3	3	3	27	3
28	4	4	4	28	4
29	1	1	1	29	1
3	3	3	3	3	3
30	2	2	2	30	2
31	3	3	3	31	3
32	4	4	4	32	4
33	1	1	1	33	1
34	2	2	2	34	2
35	3	3	3	35	3
36	4	4	4	36	4
37	1	1	1	37	1
38	2	2	2	38	2
39	3	3	3	39	3
4	4	4	4	4	4
40	4	4	4	40	4
41	1	1	1	41	1
42	2	2	2	42	2
43	3	3	3	43	3
44	4	4	4	44	4
5	1	1	1	5	1
6	2	2	2	6	2
7	3	3	3	7	3
8	4	4	4	8	4
9	1	1	1	9	1
select c1 from t1 where c1 = 1;
c1
1
select c1 from t1 where c1 = 5;
c1
5
select c1 from t1 where c1 = 9;
c1
9
select c1 from t1 where c1 = 13;
c1
select c1 from t1 where c1 = 17;
c1
17
select c1 from t1 where c1 = 21;
c1
21
select c1 from t1 where c1 = 25;
c1
25
select c1 from t1 where c1 = 29;
c1
29
select c1 from t1 where c1 = 33;
c1
33
select c1 from t1 where c1 = 37;
c1
37
select c1 from t1 where c2 = 40;
c1
select c1 from t1 where (c1 >= 1 and c1 <= 16) or (c1 > 18 and c1 < 42);
c1
1
10
11
12
19
2
20
21
22
23
24
25
26
27
28
29
3
30
31
32
33
34
35
36
37
38
39
4
40
41
5
6
7
8
9
select c1 from t1 where c1 > 1 and c1 < 14 or c1 = 21 or c1 > 25;
c1
10
11
12
2
21
26
27
28
29
3
30
31
32
33
34
35
36
37
38
39
4
40
41
42
43
44
5
6
7
8
9
select * from t1 where c2 = 1;
c1	c2	c3	c4	c5	c6
1	1	1	1	1	1
5	1	1	1	5	1
9	1	1	1	9	1
17	1	1	1	17	1
21	1	1	1	21	1
25	1	1	1	25	1
29	1	1	1	29	1
33	1	1	1	33	1
37	1	1	1	37	1
41	1	1	1	41	1
select * from t1 where c2 = 2;
c1	c2	c3	c4	c5	c6
10	2	2	2	10	2
18	2	2	2	18	2
2	2	2	2	2	2
22	2	2	2	22	2
26	2	2	2	26	2
30	2	2	2	30	2
34	2	2	2	34	2
38	2	2	2	38	2
42	2	2	2	42	2
6	2	2	2	6	2
select * from t1 where c2 = 3;
c1	c2	c3	c4	c5	c6
11	3	3	3	11	3
19	3	3	3	19	3
23	3	3	3	23	3
27	3	3	3	27	3
3	3	3	3	3	3
31	3	3	3	31	3
35	3	3	3	35	3
39	3	3	3	39	3
43	3	3	3	43	3
7	3	3	3	7	3
select * from t1 where c2 = 4;
c1	c2	c3	c4	c5	c6
12	4	4	4	12	4
20	4	4	4	20	4
24	4	4	4	24	4
28	4	4	4	28	4
32	4	4	4	32	4
36	4	4	4	36	4
4	4	4	4	4	4
40	4	4	4	40	4
44	4	4	4	44	4
8	4	4	4	8	4
select * from t1 where c2 = 1 and c3 = 1;
c1	c2	c3	c4	c5	c6
1	1	1	1	1	1
17	1	1	1	17	1
21	1	1	1	21	1
25	1	1	1	25	1
29	1	1	1	29	1
33	1	1	1	33	1
37	1	1	1	37	1
41	1	1	1	41	1
5	1	1	1	5	1
9	1	1	1	9	1
select * from t1 where c2 = 2 and c3 = 2;
c1	c2	c3	c4	c5	c6
10	2	2	2	10	2
18	2	2	2	18	2
2	2	2	2	2	2
22	2	2	2	22	2
26	2	2	2	26	2
30	2	2	2	30	2
34	2	2	2	34	2
38	2	2	2	38	2
42	2	2	2	42	2
6	2	2	2	6	2
select * from t1 where c2 = 3 and c3 = 3;
c1	c2	c3	c4	c5	c6
11	3	3	3	11	3
19	3	3	3	19	3
23	3	3	3	23	3
27	3	3	3	27	3
3	3	3	3	3	3
31	3	3	3	31	3
35	3	3	3	35	3
39	3	3	3	39	3
43	3	3	3	43	3
7	3	3	3	7	3
select * from t1 where c2 = 4 and c4 = 4;
c1	c2	c3	c4	c5	c6
12	4	4	4	12	4
20	4	4	4	20	4
24	4	4	4	24	4
28	4	4	4	28	4
32	4	4	4	32	4
36	4	4	4	36	4
4	4	4	4	4	4
40	4	4	4	40	4
44	4	4	4	44	4
8	4	4	4	8	4
select * from t1 where c2 >= 1 and c2 <= 4;
c1	c2	c3	c4	c5	c6
1	1	1	1	1	1
10	2	2	2	10	2
11	3	3	3	11	3
12	4	4	4	12	4
17	1	1	1	17	1
18	2	2	2	18	2
19	3	3	3	19	3
2	2	2	2	2	2
20	4	4	4	20	4
21	1	1	1	21	1
22	2	2	2	22	2
23	3	3	3	23	3
24	4	4	4	24	4
25	1	1	1	25	1
26	2	2	2	26	2
27	3	3	3	27	3
28	4	4	4	28	4
29	1	1	1	29	1
3	3	3	3	3	3
30	2	2	2	30	2
31	3	3	3	31	3
32	4	4	4	32	4
33	1	1	1	33	1
34	2	2	2	34	2
35	3	3	3	35	3
36	4	4	4	36	4
37	1	1	1	37	1
38	2	2	2	38	2
39	3	3	3	39	3
4	4	4	4	4	4
40	4	4	4	40	4
41	1	1	1	41	1
42	2	2	2	42	2
43	3	3	3	43	3
44	4	4	4	44	4
5	1	1	1	5	1
6	2	2	2	6	2
7	3	3	3	7	3
8	4	4	4	8	4
9	1	1	1	9	1
select * from t1 where c2 >= 1 and c2 < 3 or c2 = 4;
c1	c2	c3	c4	c5	c6
1	1	1	1	1	1
10	2	2	2	10	2
12	4	4	4	12	4
17	1	1	1	17	1
18	2	2	2	18	2
2	2	2	2	2	2
20	4	4	4	20	4
21	1	1	1	21	1
22	2	2	2	22	2
24	4	4	4	24	4
25	1	1	1	25	1
26	2	2	2	26	2
28	4	4	4	28	4
29	1	1	1	29	1
30	2	2	2	30	2
32	4	4	4	32	4
33	1	1	1	33	1
34	2	2	2	34	2
36	4	4	4	36	4
37	1	1	1	37	1
38	2	2	2	38	2
4	4	4	4	4	4
40	4	4	4	40	4
41	1	1	1	41	1
42	2	2	2	42	2
44	4	4	4	44	4
5	1	1	1	5	1
6	2	2	2	6	2
8	4	4	4	8	4
9	1	1	1	9	1
select * from t1 where c3 = 1;
c1	c2	c3	c4	c5	c6
1	1	1	1	1	1
17	1	1	1	17	1
21	1	1	1	21	1
25	1	1	1	25	1
29	1	1	1	29	1
33	1	1	1	33	1
37	1	1	1	37	1
41	1	1	1	41	1
5	1	1	1	5	1
9	1	1	1	9	1
select * from t1 where c3 = 2;
c1	c2	c3	c4	c5	c6
10	2	2	2	10	2
18	2	2	2	18	2
2	2	2	2	2	2
22	2	2	2	22	2
26	2	2	2	26	2
30	2	2	2	30	2
34	2	2	2	34	2
38	2	2	2	38	2
42	2	2	2	42	2
6	2	2	2	6	2
select * from t1 where c3 = 3;
c1	c2	c3	c4	c5	c6
11	3	3	3	11	3
19	3	3	3	19	3
23	3	3	3	23	3
27	3	3	3	27	3
3	3	3	3	3	3
31	3	3	3	31	3
35	3	3	3	35	3
39	3	3	3	39	3
43	3	3	3	43	3
7	3	3	3	7	3
select * from t1 where c3 = 4;
c1	c2	c3	c4	c5	c6
12	4	4	4	12	4
20	4	4	4	20	4
24	4	4	4	24	4
28	4	4	4	28	4
32	4	4	4	32	4
36	4	4	4	36	4
4	4	4	4	4	4
40	4	4	4	40	4
44	4	4	4	44	4
8	4	4	4	8	4
select * from t1 where c3 >= 1 and c3 <= 4;
c1	c2	c3	c4	c5	c6
1	1	1	1	1	1
10	2	2	2	10	2
11	3	3	3	11	3
12	4	4	4	12	4
17	1	1	1	17	1
18	2	2	2	18	2
19	3	3	3	19	3
2	2	2	2	2	2
20	4	4	4	20	4
21	1	1	1	21	1
22	2	2	2	22	2
23	3	3	3	23	3
24	4	4	4	24	4
25	1	1	1	25	1
26	2	2	2	26	2
27	3	3	3	27	3
28	4	4	4	28	4
29	1	1	1	29	1
3	3	3	3	3	3
30	2	2	2	30	2
31	3	3	3	31	3
32	4	4	4	32	4
33	1	1	1	33	1
34	2	2	2	34	2
35	3	3	3	35	3
36	4	4	4	36	4
37	1	1	1	37	1
38	2	2	2	38	2
39	3	3	3	39	3
4	4	4	4	4	4
40	4	4	4	40	4
41	1	1	1	41	1
42	2	2	2	42	2
43	3	3	3	43	3
44	4	4	4	44	4
5	1	1	1	5	1
6	2	2	2	6	2
7	3	3	3	7	3
8	4	4	4	8	4
9	1	1	1	9	1
select * from t1 where c4 = 1;
c1	c2	c3	c4	c5	c6
1	1	1	1	1	1
17	1	1	1	17	1
21	1	1	1	21	1
25	1	1	1	25	1
29	1	1	1	29	1
33	1	1	1	33	1
37	1	1	1	37	1
41	1	1	1	41	1
5	1	1	1	5	1
9	1	1	1	9	1
select * from t1 where c4 = 2;
c1	c2	c3	c4	c5	c6
10	2	2	2	10	2
18	2	2	2	18	2
2	2	2	2	2	2
22	2	2	2	22	2
26	2	2	2	26	2
30	2	2	2	30	2
34	2	2	2	34	2
38	2	2	2	38	2
42	2	2	2	42	2
6	2	2	2	6	2
select * from t1 where c4 = 3;
c1	c2	c3	c4	c5	c6
11	3	3	3	11	3
19	3	3	3	19	3
23	3	3	3	23	3
27	3	3	3	27	3
3	3	3	3	3	3
31	3	3	3	31	3
35	3	3	3	35	3
39	3	3	3	39	3
43	3	3	3	43	3
7	3	3	3	7	3
select * from t1 where c4 = 4;
c1	c2	c3	c4	c5	c6
12	4	4	4	12	4
20	4	4	4	20	4
24	4	4	4	24	4
28	4	4	4	28	4
32	4	4	4	32	4
36	4	4	4	36	4
4	4	4	4	4	4
40	4	4	4	40	4
44	4	4	4	44	4
8	4	4	4	8	4
select * from t1 where c4 >= 1 and c4 < 3 or c4 = 4;
c1	c2	c3	c4	c5	c6
1	1	1	1	1	1
10	2	2	2	10	2
12	4	4	4	12	4
17	1	1	1	17	1
18	2	2	2	18	2
2	2	2	2	2	2
20	4	4	4	20	4
21	1	1	1	21	1
22	2	2	2	22	2
24	4	4	4	24	4
25	1	1	1	25	1
26	2	2	2	26	2
28	4	4	4	28	4
29	1	1	1	29	1
30	2	2	2	30	2
32	4	4	4	32	4
33	1	1	1	33	1
34	2	2	2	34	2
36	4	4	4	36	4
37	1	1	1	37	1
38	2	2	2	38	2
4	4	4	4	4	4
40	4	4	4	40	4
41	1	1	1	41	1
42	2	2	2	42	2
44	4	4	4	44	4
5	1	1	1	5	1
6	2	2	2	6	2
8	4	4	4	8	4
9	1	1	1	9	1
select * from t1 where c5 = 1;
c1	c2	c3	c4	c5	c6
1	1	1	1	1	1
select * from t1 where c5 = 5;
c1	c2	c3	c4	c5	c6
5	1	1	1	5	1
select * from t1 where c5 = 9;
c1	c2	c3	c4	c5	c6
9	1	1	1	9	1
select * from t1 where c5 = 13;
c1	c2	c3	c4	c5	c6
select * from t1 where c5 = 17;
c1	c2	c3	c4	c5	c6
17	1	1	1	17	1
select * from t1 where c5 = 21;
c1	c2	c3	c4	c5	c6
21	1	1	1	21	1
select * from t1 where c5 = 25;
c1	c2	c3	c4	c5	c6
25	1	1	1	25	1
select * from t1 where c5 = 29;
c1	c2	c3	c4	c5	c6
29	1	1	1	29	1
select * from t1 where c5 = 33;
c1	c2	c3	c4	c5	c6
33	1	1	1	33	1
select * from t1 where c5 = 37;
c1	c2	c3	c4	c5	c6
37	1	1	1	37	1
select * from t1 where c5 = 40;
c1	c2	c3	c4	c5	c6
40	4	4	4	40	4
select * from t1 where (c5 >= 1 and c5 <= 16) or (c5 > 18 and c5 < 40);
c1	c2	c3	c4	c5	c6
1	1	1	1	1	1
10	2	2	2	10	2
11	3	3	3	11	3
12	4	4	4	12	4
19	3	3	3	19	3
2	2	2	2	2	2
20	4	4	4	20	4
21	1	1	1	21	1
22	2	2	2	22	2
23	3	3	3	23	3
24	4	4	4	24	4
25	1	1	1	25	1
26	2	2	2	26	2
27	3	3	3	27	3
28	4	4	4	28	4
29	1	1	1	29	1
3	3	3	3	3	3
30	2	2	2	30	2
31	3	3	3	31	3
32	4	4	4	32	4
33	1	1	1	33	1
34	2	2	2	34	2
35	3	3	3	35	3
36	4	4	4	36	4
37	1	1	1	37	1
38	2	2	2	38	2
39	3	3	3	39	3
4	4	4	4	4	4
5	1	1	1	5	1
6	2	2	2	6	2
7	3	3	3	7	3
8	4	4	4	8	4
9	1	1	1	9	1
select * from t1 where c5 > 1 and c5 < 14 or c5 = 21 or c5 > 25;
c1	c2	c3	c4	c5	c6
10	2	2	2	10	2
11	3	3	3	11	3
12	4	4	4	12	4
2	2	2	2	2	2
21	1	1	1	21	1
26	2	2	2	26	2
27	3	3	3	27	3
28	4	4	4	28	4
29	1	1	1	29	1
3	3	3	3	3	3
30	2	2	2	30	2
31	3	3	3	31	3
32	4	4	4	32	4
33	1	1	1	33	1
34	2	2	2	34	2
35	3	3	3	35	3
36	4	4	4	36	4
37	1	1	1	37	1
38	2	2	2	38	2
39	3	3	3	39	3
4	4	4	4	4	4
40	4	4	4	40	4
41	1	1	1	41	1
42	2	2	2	42	2
43	3	3	3	43	3
44	4	4	4	44	4
5	1	1	1	5	1
6	2	2	2	6	2
7	3	3	3	7	3
8	4	4	4	8	4
9	1	1	1	9	1
select * from t1 where c6 = 1;
c1	c2	c3	c4	c5	c6
1	1	1	1	1	1
17	1	1	1	17	1
21	1	1	1	21	1
25	1	1	1	25	1
29	1	1	1	29	1
33	1	1	1	33	1
37	1	1	1	37	1
41	1	1	1	41	1
5	1	1	1	5	1
9	1	1	1	9	1
select * from t1 where c6 = 2;
c1	c2	c3	c4	c5	c6
10	2	2	2	10	2
18	2	2	2	18	2
2	2	2	2	2	2
22	2	2	2	22	2
26	2	2	2	26	2
30	2	2	2	30	2
34	2	2	2	34	2
38	2	2	2	38	2
42	2	2	2	42	2
6	2	2	2	6	2
select * from t1 where c6 = 3;
c1	c2	c3	c4	c5	c6
11	3	3	3	11	3
19	3	3	3	19	3
23	3	3	3	23	3
27	3	3	3	27	3
3	3	3	3	3	3
31	3	3	3	31	3
35	3	3	3	35	3
39	3	3	3	39	3
43	3	3	3	43	3
7	3	3	3	7	3
select * from t1 where c6 = 4;
c1	c2	c3	c4	c5	c6
12	4	4	4	12	4
20	4	4	4	20	4
24	4	4	4	24	4
28	4	4	4	28	4
32	4	4	4	32	4
36	4	4	4	36	4
4	4	4	4	4	4
40	4	4	4	40	4
44	4	4	4	44	4
8	4	4	4	8	4
select c1 from t1 order by c1;
c1
1
2
3
4
5
6
7
8
9
10
11
12
17
18
19
20
21
22
23
24
25
26
27
28
29
30
31
32
33
34
35
36
37
38
39
40
41
42
43
44
select c2 from t1 order by c2;
c2
1
1
1
1
1
1
1
1
1
1
2
2
2
2
2
2
2
2
2
2
3
3
3
3
3
3
3
3
3
3
4
4
4
4
4
4
4
4
4
4
select c3 from t1 order by c3;
c3
1
1
1
1
1
1
1
1
1
1
2
2
2
2
2
2
2
2
2
2
3
3
3
3
3
3
3
3
3
3
4
4
4
4
4
4
4
4
4
4
select c4 from t1 order by c4;
c4
1
1
1
1
1
1
1
1
1
1
2
2
2
2
2
2
2
2
2
2
3
3
3
3
3
3
3
3
3
3
4
4
4
4
4
4
4
4
4
4
select c5 from t1 order by c5;
c5
1
2
3
4
5
6
7
8
9
10
11
12
17
18
19
20
21
22
23
24
25
26
27
28
29
30
31
32
33
34
35
36
37
38
39
40
41
42
43
44
select c6 from t1 order by c6;
c6
1
1
1
1
1
1
1
1
1
1
2
2
2
2
2
2
2
2
2
2
3
3
3
3
3
3
3
3
3
3
4
4
4
4
4
4
4
4
4
4
select c1 from t1 order by c1 desc;
c1
44
43
42
41
40
39
38
37
36
35
34
33
32
31
30
29
28
27
26
25
24
23
22
21
20
19
18
17
12
11
10
9
8
7
6
5
4
3
2
1
select c2 from t1 order by c2 desc;
c2
4
4
4
4
4
4
4
4
4
4
3
3
3
3
3
3
3
3
3
3
2
2
2
2
2
2
2
2
2
2
1
1
1
1
1
1
1
1
1
1
select c3 from t1 order by c3 desc;
c3
4
4
4
4
4
4
4
4
4
4
3
3
3
3
3
3
3
3
3
3
2
2
2
2
2
2
2
2
2
2
1
1
1
1
1
1
1
1
1
1
select c4 from t1 order by c4 desc;
c4
4
4
4
4
4
4
4
4
4
4
3
3
3
3
3
3
3
3
3
3
2
2
2
2
2
2
2
2
2
2
1
1
1
1
1
1
1
1
1
1
select c5 from t1 order by c5 desc;
c5
44
43
42
41
40
39
38
37
36
35
34
33
32
31
30
29
28
27
26
25
24
23
22
21
20
19
18
17
12
11
10
9
8
7
6
5
4
3
2
1
select c6 from t1 order by c6 desc;
c6
4
4
4
4
4
4
4
4
4
4
3
3
3
3
3
3
3
3
3
3
2
2
2
2
2
2
2
2
2
2
1
1
1
1
1
1
1
1
1
1
select max(c1) from t1;
max(c1)
44
select max(c2) from t1;
max(c2)
4
select max(c3) from t1;
max(c3)
4
select max(c4) from t1;
max(c4)
4
select max(c5) from t1;
max(c5)
44
select max(c6) from t1;
max(c6)
4
select min(c1) from t1;
min(c1)
1
select min(c2) from t1;
min(c2)
1
select min(c3) from t1;
min(c3)
1
select min(c4) from t1;
min(c4)
1
select min(c5) from t1;
min(c5)
1
select min(c6) from t1;
min(c6)
1
select count(*) from t1;
count(*)
40
select count(1) from t1;
count(1)
40
select count(c1) from t1;
count(c1)
40
select count(c2) from t1;
count(c2)
40
select count(c3) from t1;
count(c3)
40
select count(c4) from t1;
count(c4)
40
select count(c5) from t1;
count(c5)
40
select count(c6) from t1;
count(c6)
40
######################################################################
select mac_set_def_label('P1', 'L2:C2,C3,C4:G1');
mac_set_def_label('P1', 'L2:C2,C3,C4:G1')
success to set def label
select * from t1;
c1	c2	c3	c4	c5	c6
10	2	2	2	10	2
11	3	3	3	11	3
12	4	4	4	12	4
9	1	1	1	9	1
select c1, c2, c3, c4, c5, c6, _gdb_mac_policy_1 from t1;
c1	c2	c3	c4	c5	c6	_gdb_mac_policy_1
10	2	2	2	10	2	10
11	3	3	3	11	3	10
12	4	4	4	12	4	10
9	1	1	1	9	1	10
select * from t1 where c1 = 1;
c1	c2	c3	c4	c5	c6
select * from t1 where c1 = 5;
c1	c2	c3	c4	c5	c6
select * from t1 where c1 = 9;
c1	c2	c3	c4	c5	c6
9	1	1	1	9	1
select * from t1 where c1 = 13;
c1	c2	c3	c4	c5	c6
select * from t1 where c1 = 17;
c1	c2	c3	c4	c5	c6
select * from t1 where c1 = 21;
c1	c2	c3	c4	c5	c6
select * from t1 where c1 = 25;
c1	c2	c3	c4	c5	c6
select * from t1 where c1 = 29;
c1	c2	c3	c4	c5	c6
select * from t1 where c1 = 33;
c1	c2	c3	c4	c5	c6
select * from t1 where c1 = 37;
c1	c2	c3	c4	c5	c6
select * from t1 where c1 = 40;
c1	c2	c3	c4	c5	c6
select * from t1 where (c1 >= 1 and c1 <= 16) or (c1 > 18 and c1 < 42);
c1	c2	c3	c4	c5	c6
10	2	2	2	10	2
11	3	3	3	11	3
12	4	4	4	12	4
9	1	1	1	9	1
select * from t1 where c1 > 1 and c1 < 14 or c1 = 21 or c1 > 25;
c1	c2	c3	c4	c5	c6
10	2	2	2	10	2
11	3	3	3	11	3
12	4	4	4	12	4
9	1	1	1	9	1
select c1 from t1 where c1 = 1;
c1
select c1 from t1 where c1 = 5;
c1
select c1 from t1 where c1 = 9;
c1
9
select c1 from t1 where c1 = 13;
c1
select c1 from t1 where c1 = 17;
c1
select c1 from t1 where c1 = 21;
c1
select c1 from t1 where c1 = 25;
c1
select c1 from t1 where c1 = 29;
c1
select c1 from t1 where c1 = 33;
c1
select c1 from t1 where c1 = 37;
c1
select c1 from t1 where c2 = 40;
c1
select c1 from t1 where (c1 >= 1 and c1 <= 16) or (c1 > 18 and c1 < 42);
c1
10
11
12
9
select c1 from t1 where c1 > 1 and c1 < 14 or c1 = 21 or c1 > 25;
c1
10
11
12
9
select * from t1 where c2 = 1;
c1	c2	c3	c4	c5	c6
9	1	1	1	9	1
select * from t1 where c2 = 2;
c1	c2	c3	c4	c5	c6
10	2	2	2	10	2
select * from t1 where c2 = 3;
c1	c2	c3	c4	c5	c6
11	3	3	3	11	3
select * from t1 where c2 = 4;
c1	c2	c3	c4	c5	c6
12	4	4	4	12	4
select * from t1 where c2 = 1 and c3 = 1;
c1	c2	c3	c4	c5	c6
9	1	1	1	9	1
select * from t1 where c2 = 2 and c3 = 2;
c1	c2	c3	c4	c5	c6
10	2	2	2	10	2
select * from t1 where c2 = 3 and c3 = 3;
c1	c2	c3	c4	c5	c6
11	3	3	3	11	3
select * from t1 where c2 = 4 and c4 = 4;
c1	c2	c3	c4	c5	c6
12	4	4	4	12	4
select * from t1 where c2 >= 1 and c2 <= 4;
c1	c2	c3	c4	c5	c6
10	2	2	2	10	2
11	3	3	3	11	3
12	4	4	4	12	4
9	1	1	1	9	1
select * from t1 where c2 >= 1 and c2 < 3 or c2 = 4;
c1	c2	c3	c4	c5	c6
10	2	2	2	10	2
12	4	4	4	12	4
9	1	1	1	9	1
select * from t1 where c3 = 1;
c1	c2	c3	c4	c5	c6
9	1	1	1	9	1
select * from t1 where c3 = 2;
c1	c2	c3	c4	c5	c6
10	2	2	2	10	2
select * from t1 where c3 = 3;
c1	c2	c3	c4	c5	c6
11	3	3	3	11	3
select * from t1 where c3 = 4;
c1	c2	c3	c4	c5	c6
12	4	4	4	12	4
select * from t1 where c3 >= 1 and c3 <= 4;
c1	c2	c3	c4	c5	c6
10	2	2	2	10	2
11	3	3	3	11	3
12	4	4	4	12	4
9	1	1	1	9	1
select * from t1 where c4 = 1;
c1	c2	c3	c4	c5	c6
9	1	1	1	9	1
select * from t1 where c4 = 2;
c1	c2	c3	c4	c5	c6
10	2	2	2	10	2
select * from t1 where c4 = 3;
c1	c2	c3	c4	c5	c6
11	3	3	3	11	3
select * from t1 where c4 = 4;
c1	c2	c3	c4	c5	c6
12	4	4	4	12	4
select * from t1 where c4 >= 1 and c4 < 3 or c4 = 4;
c1	c2	c3	c4	c5	c6
10	2	2	2	10	2
12	4	4	4	12	4
9	1	1	1	9	1
select * from t1 where c5 = 1;
c1	c2	c3	c4	c5	c6
select * from t1 where c5 = 5;
c1	c2	c3	c4	c5	c6
select * from t1 where c5 = 9;
c1	c2	c3	c4	c5	c6
9	1	1	1	9	1
select * from t1 where c5 = 13;
c1	c2	c3	c4	c5	c6
select * from t1 where c5 = 17;
c1	c2	c3	c4	c5	c6
select * from t1 where c5 = 21;
c1	c2	c3	c4	c5	c6
select * from t1 where c5 = 25;
c1	c2	c3	c4	c5	c6
select * from t1 where c5 = 29;
c1	c2	c3	c4	c5	c6
select * from t1 where c5 = 33;
c1	c2	c3	c4	c5	c6
select * from t1 where c5 = 37;
c1	c2	c3	c4	c5	c6
select * from t1 where c5 = 40;
c1	c2	c3	c4	c5	c6
select * from t1 where (c5 >= 1 and c5 <= 16) or (c5 > 18 and c5 < 40);
c1	c2	c3	c4	c5	c6
10	2	2	2	10	2
11	3	3	3	11	3
12	4	4	4	12	4
9	1	1	1	9	1
select * from t1 where c5 > 1 and c5 < 14 or c5 = 21 or c5 > 25;
c1	c2	c3	c4	c5	c6
10	2	2	2	10	2
11	3	3	3	11	3
12	4	4	4	12	4
9	1	1	1	9	1
select * from t1 where c6 = 1;
c1	c2	c3	c4	c5	c6
9	1	1	1	9	1
select * from t1 where c6 = 2;
c1	c2	c3	c4	c5	c6
10	2	2	2	10	2
select * from t1 where c6 = 3;
c1	c2	c3	c4	c5	c6
11	3	3	3	11	3
select * from t1 where c6 = 4;
c1	c2	c3	c4	c5	c6
12	4	4	4	12	4
select c1 from t1 order by c1;
c1
9
10
11
12
select c2 from t1 order by c2;
c2
1
2
3
4
select c3 from t1 order by c3;
c3
1
2
3
4
select c4 from t1 order by c4;
c4
1
2
3
4
select c5 from t1 order by c5;
c5
9
10
11
12
select c6 from t1 order by c6;
c6
1
2
3
4
select c1 from t1 order by c1 desc;
c1
12
11
10
9
select c2 from t1 order by c2 desc;
c2
4
3
2
1
select c3 from t1 order by c3 desc;
c3
4
3
2
1
select c4 from t1 order by c4 desc;
c4
4
3
2
1
select c5 from t1 order by c5 desc;
c5
12
11
10
9
select c6 from t1 order by c6 desc;
c6
4
3
2
1
select max(c1) from t1;
max(c1)
12
select max(c2) from t1;
max(c2)
4
select max(c3) from t1;
max(c3)
4
select max(c4) from t1;
max(c4)
4
select max(c5) from t1;
max(c5)
12
select max(c6) from t1;
max(c6)
4
select min(c1) from t1;
min(c1)
9
select min(c2) from t1;
min(c2)
1
select min(c3) from t1;
min(c3)
1
select min(c4) from t1;
min(c4)
1
select min(c5) from t1;
min(c5)
9
select min(c6) from t1;
min(c6)
1
select count(*) from t1;
count(*)
4
select count(1) from t1;
count(1)
4
select count(c1) from t1;
count(c1)
4
select count(c2) from t1;
count(c2)
4
select count(c3) from t1;
count(c3)
4
select count(c4) from t1;
count(c4)
4
select count(c5) from t1;
count(c5)
4
select count(c6) from t1;
count(c6)
4
######################################################################
select mac_set_def_label('P1', 'L4::');
mac_set_def_label('P1', 'L4::')
success to set def label
select * from t1;
c1	c2	c3	c4	c5	c6
29	1	1	1	29	1
30	2	2	2	30	2
31	3	3	3	31	3
32	4	4	4	32	4
select c1, c2, c3, c4, c5, c6, _gdb_mac_policy_1 from t1;
c1	c2	c3	c4	c5	c6	_gdb_mac_policy_1
29	1	1	1	29	1	23
30	2	2	2	30	2	23
31	3	3	3	31	3	23
32	4	4	4	32	4	23
select * from t1 where c1 = 1;
c1	c2	c3	c4	c5	c6
select * from t1 where c1 = 5;
c1	c2	c3	c4	c5	c6
select * from t1 where c1 = 9;
c1	c2	c3	c4	c5	c6
select * from t1 where c1 = 13;
c1	c2	c3	c4	c5	c6
select * from t1 where c1 = 17;
c1	c2	c3	c4	c5	c6
select * from t1 where c1 = 21;
c1	c2	c3	c4	c5	c6
select * from t1 where c1 = 25;
c1	c2	c3	c4	c5	c6
select * from t1 where c1 = 29;
c1	c2	c3	c4	c5	c6
29	1	1	1	29	1
select * from t1 where c1 = 33;
c1	c2	c3	c4	c5	c6
select * from t1 where c1 = 37;
c1	c2	c3	c4	c5	c6
select * from t1 where c1 = 40;
c1	c2	c3	c4	c5	c6
select * from t1 where (c1 >= 1 and c1 <= 16) or (c1 > 18 and c1 < 42);
c1	c2	c3	c4	c5	c6
29	1	1	1	29	1
30	2	2	2	30	2
31	3	3	3	31	3
32	4	4	4	32	4
select * from t1 where c1 > 1 and c1 < 14 or c1 = 21 or c1 > 25;
c1	c2	c3	c4	c5	c6
29	1	1	1	29	1
30	2	2	2	30	2
31	3	3	3	31	3
32	4	4	4	32	4
select c1 from t1 where c1 = 1;
c1
select c1 from t1 where c1 = 5;
c1
select c1 from t1 where c1 = 9;
c1
select c1 from t1 where c1 = 13;
c1
select c1 from t1 where c1 = 17;
c1
select c1 from t1 where c1 = 21;
c1
select c1 from t1 where c1 = 25;
c1
select c1 from t1 where c1 = 29;
c1
29
select c1 from t1 where c1 = 33;
c1
select c1 from t1 where c1 = 37;
c1
select c1 from t1 where c2 = 40;
c1
select c1 from t1 where (c1 >= 1 and c1 <= 16) or (c1 > 18 and c1 < 42);
c1
29
30
31
32
select c1 from t1 where c1 > 1 and c1 < 14 or c1 = 21 or c1 > 25;
c1
29
30
31
32
select * from t1 where c2 = 1;
c1	c2	c3	c4	c5	c6
29	1	1	1	29	1
select * from t1 where c2 = 2;
c1	c2	c3	c4	c5	c6
30	2	2	2	30	2
select * from t1 where c2 = 3;
c1	c2	c3	c4	c5	c6
31	3	3	3	31	3
select * from t1 where c2 = 4;
c1	c2	c3	c4	c5	c6
32	4	4	4	32	4
select * from t1 where c2 = 1 and c3 = 1;
c1	c2	c3	c4	c5	c6
29	1	1	1	29	1
select * from t1 where c2 = 2 and c3 = 2;
c1	c2	c3	c4	c5	c6
30	2	2	2	30	2
select * from t1 where c2 = 3 and c3 = 3;
c1	c2	c3	c4	c5	c6
31	3	3	3	31	3
select * from t1 where c2 = 4 and c4 = 4;
c1	c2	c3	c4	c5	c6
32	4	4	4	32	4
select * from t1 where c2 >= 1 and c2 <= 4;
c1	c2	c3	c4	c5	c6
29	1	1	1	29	1
30	2	2	2	30	2
31	3	3	3	31	3
32	4	4	4	32	4
select * from t1 where c2 >= 1 and c2 < 3 or c2 = 4;
c1	c2	c3	c4	c5	c6
29	1	1	1	29	1
30	2	2	2	30	2
32	4	4	4	32	4
select * from t1 where c3 = 1;
c1	c2	c3	c4	c5	c6
29	1	1	1	29	1
select * from t1 where c3 = 2;
c1	c2	c3	c4	c5	c6
30	2	2	2	30	2
select * from t1 where c3 = 3;
c1	c2	c3	c4	c5	c6
31	3	3	3	31	3
select * from t1 where c3 = 4;
c1	c2	c3	c4	c5	c6
32	4	4	4	32	4
select * from t1 where c3 >= 1 and c3 <= 4;
c1	c2	c3	c4	c5	c6
29	1	1	1	29	1
30	2	2	2	30	2
31	3	3	3	31	3
32	4	4	4	32	4
select * from t1 where c4 = 1;
c1	c2	c3	c4	c5	c6
29	1	1	1	29	1
select * from t1 where c4 = 2;
c1	c2	c3	c4	c5	c6
30	2	2	2	30	2
select * from t1 where c4 = 3;
c1	c2	c3	c4	c5	c6
31	3	3	3	31	3
select * from t1 where c4 = 4;
c1	c2	c3	c4	c5	c6
32	4	4	4	32	4
select * from t1 where c4 >= 1 and c4 < 3 or c4 = 4;
c1	c2	c3	c4	c5	c6
29	1	1	1	29	1
30	2	2	2	30	2
32	4	4	4	32	4
select * from t1 where c5 = 1;
c1	c2	c3	c4	c5	c6
select * from t1 where c5 = 5;
c1	c2	c3	c4	c5	c6
select * from t1 where c5 = 9;
c1	c2	c3	c4	c5	c6
select * from t1 where c5 = 13;
c1	c2	c3	c4	c5	c6
select * from t1 where c5 = 17;
c1	c2	c3	c4	c5	c6
select * from t1 where c5 = 21;
c1	c2	c3	c4	c5	c6
select * from t1 where c5 = 25;
c1	c2	c3	c4	c5	c6
select * from t1 where c5 = 29;
c1	c2	c3	c4	c5	c6
29	1	1	1	29	1
select * from t1 where c5 = 33;
c1	c2	c3	c4	c5	c6
select * from t1 where c5 = 37;
c1	c2	c3	c4	c5	c6
select * from t1 where c5 = 40;
c1	c2	c3	c4	c5	c6
select * from t1 where (c5 >= 1 and c5 <= 16) or (c5 > 18 and c5 < 40);
c1	c2	c3	c4	c5	c6
29	1	1	1	29	1
30	2	2	2	30	2
31	3	3	3	31	3
32	4	4	4	32	4
select * from t1 where c5 > 1 and c5 < 14 or c5 = 21 or c5 > 25;
c1	c2	c3	c4	c5	c6
29	1	1	1	29	1
30	2	2	2	30	2
31	3	3	3	31	3
32	4	4	4	32	4
select * from t1 where c6 = 1;
c1	c2	c3	c4	c5	c6
29	1	1	1	29	1
select * from t1 where c6 = 2;
c1	c2	c3	c4	c5	c6
30	2	2	2	30	2
select * from t1 where c6 = 3;
c1	c2	c3	c4	c5	c6
31	3	3	3	31	3
select * from t1 where c6 = 4;
c1	c2	c3	c4	c5	c6
32	4	4	4	32	4
select c1 from t1 order by c1;
c1
29
30
31
32
select c2 from t1 order by c2;
c2
1
2
3
4
select c3 from t1 order by c3;
c3
1
2
3
4
select c4 from t1 order by c4;
c4
1
2
3
4
select c5 from t1 order by c5;
c5
29
30
31
32
select c6 from t1 order by c6;
c6
1
2
3
4
select c1 from t1 order by c1 desc;
c1
32
31
30
29
select c2 from t1 order by c2 desc;
c2
4
3
2
1
select c3 from t1 order by c3 desc;
c3
4
3
2
1
select c4 from t1 order by c4 desc;
c4
4
3
2
1
select c5 from t1 order by c5 desc;
c5
32
31
30
29
select c6 from t1 order by c6 desc;
c6
4
3
2
1
select max(c1) from t1;
max(c1)
32
select max(c2) from t1;
max(c2)
4
select max(c3) from t1;
max(c3)
4
select max(c4) from t1;
max(c4)
4
select max(c5) from t1;
max(c5)
32
select max(c6) from t1;
max(c6)
4
select min(c1) from t1;
min(c1)
29
select min(c2) from t1;
min(c2)
1
select min(c3) from t1;
min(c3)
1
select min(c4) from t1;
min(c4)
1
select min(c5) from t1;
min(c5)
29
select min(c6) from t1;
min(c6)
1
select count(*) from t1;
count(*)
4
select count(1) from t1;
count(1)
4
select count(c1) from t1;
count(c1)
4
select count(c2) from t1;
count(c2)
4
select count(c3) from t1;
count(c3)
4
select count(c4) from t1;
count(c4)
4
select count(c5) from t1;
count(c5)
4
select count(c6) from t1;
count(c6)
4
######################################################################
select mac_set_def_label('P1', 'L3::');
mac_set_def_label('P1', 'L3::')
success to set def label
select * from t1;
c1	c2	c3	c4	c5	c6
29	1	1	1	29	1
30	2	2	2	30	2
31	3	3	3	31	3
32	4	4	4	32	4
select c1, c2, c3, c4, c5, c6, _gdb_mac_policy_1 from t1;
c1	c2	c3	c4	c5	c6	_gdb_mac_policy_1
29	1	1	1	29	1	23
30	2	2	2	30	2	23
31	3	3	3	31	3	23
32	4	4	4	32	4	23
select * from t1 where c1 = 1;
c1	c2	c3	c4	c5	c6
select * from t1 where c1 = 5;
c1	c2	c3	c4	c5	c6
select * from t1 where c1 = 9;
c1	c2	c3	c4	c5	c6
select * from t1 where c1 = 13;
c1	c2	c3	c4	c5	c6
select * from t1 where c1 = 17;
c1	c2	c3	c4	c5	c6
select * from t1 where c1 = 21;
c1	c2	c3	c4	c5	c6
select * from t1 where c1 = 25;
c1	c2	c3	c4	c5	c6
select * from t1 where c1 = 29;
c1	c2	c3	c4	c5	c6
29	1	1	1	29	1
select * from t1 where c1 = 33;
c1	c2	c3	c4	c5	c6
select * from t1 where c1 = 37;
c1	c2	c3	c4	c5	c6
select * from t1 where c1 = 40;
c1	c2	c3	c4	c5	c6
select * from t1 where (c1 >= 1 and c1 <= 16) or (c1 > 18 and c1 < 42);
c1	c2	c3	c4	c5	c6
29	1	1	1	29	1
30	2	2	2	30	2
31	3	3	3	31	3
32	4	4	4	32	4
select * from t1 where c1 > 1 and c1 < 14 or c1 = 21 or c1 > 25;
c1	c2	c3	c4	c5	c6
29	1	1	1	29	1
30	2	2	2	30	2
31	3	3	3	31	3
32	4	4	4	32	4
select c1 from t1 where c1 = 1;
c1
select c1 from t1 where c1 = 5;
c1
select c1 from t1 where c1 = 9;
c1
select c1 from t1 where c1 = 13;
c1
select c1 from t1 where c1 = 17;
c1
select c1 from t1 where c1 = 21;
c1
select c1 from t1 where c1 = 25;
c1
select c1 from t1 where c1 = 29;
c1
29
select c1 from t1 where c1 = 33;
c1
select c1 from t1 where c1 = 37;
c1
select c1 from t1 where c2 = 40;
c1
select c1 from t1 where (c1 >= 1 and c1 <= 16) or (c1 > 18 and c1 < 42);
c1
29
30
31
32
select c1 from t1 where c1 > 1 and c1 < 14 or c1 = 21 or c1 > 25;
c1
29
30
31
32
select * from t1 where c2 = 1;
c1	c2	c3	c4	c5	c6
29	1	1	1	29	1
select * from t1 where c2 = 2;
c1	c2	c3	c4	c5	c6
30	2	2	2	30	2
select * from t1 where c2 = 3;
c1	c2	c3	c4	c5	c6
31	3	3	3	31	3
select * from t1 where c2 = 4;
c1	c2	c3	c4	c5	c6
32	4	4	4	32	4
select * from t1 where c2 = 1 and c3 = 1;
c1	c2	c3	c4	c5	c6
29	1	1	1	29	1
select * from t1 where c2 = 2 and c3 = 2;
c1	c2	c3	c4	c5	c6
30	2	2	2	30	2
select * from t1 where c2 = 3 and c3 = 3;
c1	c2	c3	c4	c5	c6
31	3	3	3	31	3
select * from t1 where c2 = 4 and c4 = 4;
c1	c2	c3	c4	c5	c6
32	4	4	4	32	4
select * from t1 where c2 >= 1 and c2 <= 4;
c1	c2	c3	c4	c5	c6
29	1	1	1	29	1
30	2	2	2	30	2
31	3	3	3	31	3
32	4	4	4	32	4
select * from t1 where c2 >= 1 and c2 < 3 or c2 = 4;
c1	c2	c3	c4	c5	c6
29	1	1	1	29	1
30	2	2	2	30	2
32	4	4	4	32	4
select * from t1 where c3 = 1;
c1	c2	c3	c4	c5	c6
29	1	1	1	29	1
select * from t1 where c3 = 2;
c1	c2	c3	c4	c5	c6
30	2	2	2	30	2
select * from t1 where c3 = 3;
c1	c2	c3	c4	c5	c6
31	3	3	3	31	3
select * from t1 where c3 = 4;
c1	c2	c3	c4	c5	c6
32	4	4	4	32	4
select * from t1 where c3 >= 1 and c3 <= 4;
c1	c2	c3	c4	c5	c6
29	1	1	1	29	1
30	2	2	2	30	2
31	3	3	3	31	3
32	4	4	4	32	4
select * from t1 where c4 = 1;
c1	c2	c3	c4	c5	c6
29	1	1	1	29	1
select * from t1 where c4 = 2;
c1	c2	c3	c4	c5	c6
30	2	2	2	30	2
select * from t1 where c4 = 3;
c1	c2	c3	c4	c5	c6
31	3	3	3	31	3
select * from t1 where c4 = 4;
c1	c2	c3	c4	c5	c6
32	4	4	4	32	4
select * from t1 where c4 >= 1 and c4 < 3 or c4 = 4;
c1	c2	c3	c4	c5	c6
29	1	1	1	29	1
30	2	2	2	30	2
32	4	4	4	32	4
select * from t1 where c5 = 1;
c1	c2	c3	c4	c5	c6
select * from t1 where c5 = 5;
c1	c2	c3	c4	c5	c6
select * from t1 where c5 = 9;
c1	c2	c3	c4	c5	c6
select * from t1 where c5 = 13;
c1	c2	c3	c4	c5	c6
select * from t1 where c5 = 17;
c1	c2	c3	c4	c5	c6
select * from t1 where c5 = 21;
c1	c2	c3	c4	c5	c6
select * from t1 where c5 = 25;
c1	c2	c3	c4	c5	c6
select * from t1 where c5 = 29;
c1	c2	c3	c4	c5	c6
29	1	1	1	29	1
select * from t1 where c5 = 33;
c1	c2	c3	c4	c5	c6
select * from t1 where c5 = 37;
c1	c2	c3	c4	c5	c6
select * from t1 where c5 = 40;
c1	c2	c3	c4	c5	c6
select * from t1 where (c5 >= 1 and c5 <= 16) or (c5 > 18 and c5 < 40);
c1	c2	c3	c4	c5	c6
29	1	1	1	29	1
30	2	2	2	30	2
31	3	3	3	31	3
32	4	4	4	32	4
select * from t1 where c5 > 1 and c5 < 14 or c5 = 21 or c5 > 25;
c1	c2	c3	c4	c5	c6
29	1	1	1	29	1
30	2	2	2	30	2
31	3	3	3	31	3
32	4	4	4	32	4
select * from t1 where c6 = 1;
c1	c2	c3	c4	c5	c6
29	1	1	1	29	1
select * from t1 where c6 = 2;
c1	c2	c3	c4	c5	c6
30	2	2	2	30	2
select * from t1 where c6 = 3;
c1	c2	c3	c4	c5	c6
31	3	3	3	31	3
select * from t1 where c6 = 4;
c1	c2	c3	c4	c5	c6
32	4	4	4	32	4
select c1 from t1 order by c1;
c1
29
30
31
32
select c2 from t1 order by c2;
c2
1
2
3
4
select c3 from t1 order by c3;
c3
1
2
3
4
select c4 from t1 order by c4;
c4
1
2
3
4
select c5 from t1 order by c5;
c5
29
30
31
32
select c6 from t1 order by c6;
c6
1
2
3
4
select c1 from t1 order by c1 desc;
c1
32
31
30
29
select c2 from t1 order by c2 desc;
c2
4
3
2
1
select c3 from t1 order by c3 desc;
c3
4
3
2
1
select c4 from t1 order by c4 desc;
c4
4
3
2
1
select c5 from t1 order by c5 desc;
c5
32
31
30
29
select c6 from t1 order by c6 desc;
c6
4
3
2
1
select max(c1) from t1;
max(c1)
32
select max(c2) from t1;
max(c2)
4
select max(c3) from t1;
max(c3)
4
select max(c4) from t1;
max(c4)
4
select max(c5) from t1;
max(c5)
32
select max(c6) from t1;
max(c6)
4
select min(c1) from t1;
min(c1)
29
select min(c2) from t1;
min(c2)
1
select min(c3) from t1;
min(c3)
1
select min(c4) from t1;
min(c4)
1
select min(c5) from t1;
min(c5)
29
select min(c6) from t1;
min(c6)
1
select count(*) from t1;
count(*)
4
select count(1) from t1;
count(1)
4
select count(c1) from t1;
count(c1)
4
select count(c2) from t1;
count(c2)
4
select count(c3) from t1;
count(c3)
4
select count(c4) from t1;
count(c4)
4
select count(c5) from t1;
count(c5)
4
select count(c6) from t1;
count(c6)
4
######################################################################
select mac_set_def_label('P1', 'L2::');
mac_set_def_label('P1', 'L2::')
success to set def label
select * from t1;
c1	c2	c3	c4	c5	c6
select c1, c2, c3, c4, c5, c6, _gdb_mac_policy_1 from t1;
c1	c2	c3	c4	c5	c6	_gdb_mac_policy_1
select * from t1 where c1 = 1;
c1	c2	c3	c4	c5	c6
select * from t1 where c1 = 5;
c1	c2	c3	c4	c5	c6
select * from t1 where c1 = 9;
c1	c2	c3	c4	c5	c6
select * from t1 where c1 = 13;
c1	c2	c3	c4	c5	c6
select * from t1 where c1 = 17;
c1	c2	c3	c4	c5	c6
select * from t1 where c1 = 21;
c1	c2	c3	c4	c5	c6
select * from t1 where c1 = 25;
c1	c2	c3	c4	c5	c6
select * from t1 where c1 = 29;
c1	c2	c3	c4	c5	c6
select * from t1 where c1 = 33;
c1	c2	c3	c4	c5	c6
select * from t1 where c1 = 37;
c1	c2	c3	c4	c5	c6
select * from t1 where c1 = 40;
c1	c2	c3	c4	c5	c6
select * from t1 where (c1 >= 1 and c1 <= 16) or (c1 > 18 and c1 < 42);
c1	c2	c3	c4	c5	c6
select * from t1 where c1 > 1 and c1 < 14 or c1 = 21 or c1 > 25;
c1	c2	c3	c4	c5	c6
select c1 from t1 where c1 = 1;
c1
select c1 from t1 where c1 = 5;
c1
select c1 from t1 where c1 = 9;
c1
select c1 from t1 where c1 = 13;
c1
select c1 from t1 where c1 = 17;
c1
select c1 from t1 where c1 = 21;
c1
select c1 from t1 where c1 = 25;
c1
select c1 from t1 where c1 = 29;
c1
select c1 from t1 where c1 = 33;
c1
select c1 from t1 where c1 = 37;
c1
select c1 from t1 where c2 = 40;
c1
select c1 from t1 where (c1 >= 1 and c1 <= 16) or (c1 > 18 and c1 < 42);
c1
select c1 from t1 where c1 > 1 and c1 < 14 or c1 = 21 or c1 > 25;
c1
select * from t1 where c2 = 1;
c1	c2	c3	c4	c5	c6
select * from t1 where c2 = 2;
c1	c2	c3	c4	c5	c6
select * from t1 where c2 = 3;
c1	c2	c3	c4	c5	c6
select * from t1 where c2 = 4;
c1	c2	c3	c4	c5	c6
select * from t1 where c2 = 1 and c3 = 1;
c1	c2	c3	c4	c5	c6
select * from t1 where c2 = 2 and c3 = 2;
c1	c2	c3	c4	c5	c6
select * from t1 where c2 = 3 and c3 = 3;
c1	c2	c3	c4	c5	c6
select * from t1 where c2 = 4 and c4 = 4;
c1	c2	c3	c4	c5	c6
select * from t1 where c2 >= 1 and c2 <= 4;
c1	c2	c3	c4	c5	c6
select * from t1 where c2 >= 1 and c2 < 3 or c2 = 4;
c1	c2	c3	c4	c5	c6
select * from t1 where c3 = 1;
c1	c2	c3	c4	c5	c6
select * from t1 where c3 = 2;
c1	c2	c3	c4	c5	c6
select * from t1 where c3 = 3;
c1	c2	c3	c4	c5	c6
select * from t1 where c3 = 4;
c1	c2	c3	c4	c5	c6
select * from t1 where c3 >= 1 and c3 <= 4;
c1	c2	c3	c4	c5	c6
select * from t1 where c4 = 1;
c1	c2	c3	c4	c5	c6
select * from t1 where c4 = 2;
c1	c2	c3	c4	c5	c6
select * from t1 where c4 = 3;
c1	c2	c3	c4	c5	c6
select * from t1 where c4 = 4;
c1	c2	c3	c4	c5	c6
select * from t1 where c4 >= 1 and c4 < 3 or c4 = 4;
c1	c2	c3	c4	c5	c6
select * from t1 where c5 = 1;
c1	c2	c3	c4	c5	c6
select * from t1 where c5 = 5;
c1	c2	c3	c4	c5	c6
select * from t1 where c5 = 9;
c1	c2	c3	c4	c5	c6
select * from t1 where c5 = 13;
c1	c2	c3	c4	c5	c6
select * from t1 where c5 = 17;
c1	c2	c3	c4	c5	c6
select * from t1 where c5 = 21;
c1	c2	c3	c4	c5	c6
select * from t1 where c5 = 25;
c1	c2	c3	c4	c5	c6
select * from t1 where c5 = 29;
c1	c2	c3	c4	c5	c6
select * from t1 where c5 = 33;
c1	c2	c3	c4	c5	c6
select * from t1 where c5 = 37;
c1	c2	c3	c4	c5	c6
select * from t1 where c5 = 40;
c1	c2	c3	c4	c5	c6
select * from t1 where (c5 >= 1 and c5 <= 16) or (c5 > 18 and c5 < 40);
c1	c2	c3	c4	c5	c6
select * from t1 where c5 > 1 and c5 < 14 or c5 = 21 or c5 > 25;
c1	c2	c3	c4	c5	c6
select * from t1 where c6 = 1;
c1	c2	c3	c4	c5	c6
select * from t1 where c6 = 2;
c1	c2	c3	c4	c5	c6
select * from t1 where c6 = 3;
c1	c2	c3	c4	c5	c6
select * from t1 where c6 = 4;
c1	c2	c3	c4	c5	c6
select c1 from t1 order by c1;
c1
select c2 from t1 order by c2;
c2
select c3 from t1 order by c3;
c3
select c4 from t1 order by c4;
c4
select c5 from t1 order by c5;
c5
select c6 from t1 order by c6;
c6
select c1 from t1 order by c1 desc;
c1
select c2 from t1 order by c2 desc;
c2
select c3 from t1 order by c3 desc;
c3
select c4 from t1 order by c4 desc;
c4
select c5 from t1 order by c5 desc;
c5
select c6 from t1 order by c6 desc;
c6
select max(c1) from t1;
max(c1)
NULL
select max(c2) from t1;
max(c2)
NULL
select max(c3) from t1;
max(c3)
NULL
select max(c4) from t1;
max(c4)
NULL
select max(c5) from t1;
max(c5)
NULL
select max(c6) from t1;
max(c6)
NULL
select min(c1) from t1;
min(c1)
NULL
select min(c2) from t1;
min(c2)
NULL
select min(c3) from t1;
min(c3)
NULL
select min(c4) from t1;
min(c4)
NULL
select min(c5) from t1;
min(c5)
NULL
select min(c6) from t1;
min(c6)
NULL
select count(*) from t1;
count(*)
0
select count(1) from t1;
count(1)
0
select count(c1) from t1;
count(c1)
0
select count(c2) from t1;
count(c2)
0
select count(c3) from t1;
count(c3)
0
select count(c4) from t1;
count(c4)
0
select count(c5) from t1;
count(c5)
0
select count(c6) from t1;
count(c6)
0
######################################################################
select mac_set_def_label('P1', 'L3:C2:');
mac_set_def_label('P1', 'L3:C2:')
success to set def label
select * from t1;
c1	c2	c3	c4	c5	c6
21	1	1	1	21	1
22	2	2	2	22	2
23	3	3	3	23	3
24	4	4	4	24	4
29	1	1	1	29	1
30	2	2	2	30	2
31	3	3	3	31	3
32	4	4	4	32	4
select c1, c2, c3, c4, c5, c6, _gdb_mac_policy_1 from t1;
c1	c2	c3	c4	c5	c6	_gdb_mac_policy_1
21	1	1	1	21	1	19
22	2	2	2	22	2	19
23	3	3	3	23	3	19
24	4	4	4	24	4	19
29	1	1	1	29	1	23
30	2	2	2	30	2	23
31	3	3	3	31	3	23
32	4	4	4	32	4	23
select * from t1 where c1 = 1;
c1	c2	c3	c4	c5	c6
select * from t1 where c1 = 5;
c1	c2	c3	c4	c5	c6
select * from t1 where c1 = 9;
c1	c2	c3	c4	c5	c6
select * from t1 where c1 = 13;
c1	c2	c3	c4	c5	c6
select * from t1 where c1 = 17;
c1	c2	c3	c4	c5	c6
select * from t1 where c1 = 21;
c1	c2	c3	c4	c5	c6
21	1	1	1	21	1
select * from t1 where c1 = 25;
c1	c2	c3	c4	c5	c6
select * from t1 where c1 = 29;
c1	c2	c3	c4	c5	c6
29	1	1	1	29	1
select * from t1 where c1 = 33;
c1	c2	c3	c4	c5	c6
select * from t1 where c1 = 37;
c1	c2	c3	c4	c5	c6
select * from t1 where c1 = 40;
c1	c2	c3	c4	c5	c6
select * from t1 where (c1 >= 1 and c1 <= 16) or (c1 > 18 and c1 < 42);
c1	c2	c3	c4	c5	c6
21	1	1	1	21	1
22	2	2	2	22	2
23	3	3	3	23	3
24	4	4	4	24	4
29	1	1	1	29	1
30	2	2	2	30	2
31	3	3	3	31	3
32	4	4	4	32	4
select * from t1 where c1 > 1 and c1 < 14 or c1 = 21 or c1 > 25;
c1	c2	c3	c4	c5	c6
21	1	1	1	21	1
29	1	1	1	29	1
30	2	2	2	30	2
31	3	3	3	31	3
32	4	4	4	32	4
select c1 from t1 where c1 = 1;
c1
select c1 from t1 where c1 = 5;
c1
select c1 from t1 where c1 = 9;
c1
select c1 from t1 where c1 = 13;
c1
select c1 from t1 where c1 = 17;
c1
select c1 from t1 where c1 = 21;
c1
21
select c1 from t1 where c1 = 25;
c1
select c1 from t1 where c1 = 29;
c1
29
select c1 from t1 where c1 = 33;
c1
select c1 from t1 where c1 = 37;
c1
select c1 from t1 where c2 = 40;
c1
select c1 from t1 where (c1 >= 1 and c1 <= 16) or (c1 > 18 and c1 < 42);
c1
21
22
23
24
29
30
31
32
select c1 from t1 where c1 > 1 and c1 < 14 or c1 = 21 or c1 > 25;
c1
21
29
30
31
32
select * from t1 where c2 = 1;
c1	c2	c3	c4	c5	c6
21	1	1	1	21	1
29	1	1	1	29	1
select * from t1 where c2 = 2;
c1	c2	c3	c4	c5	c6
22	2	2	2	22	2
30	2	2	2	30	2
select * from t1 where c2 = 3;
c1	c2	c3	c4	c5	c6
23	3	3	3	23	3
31	3	3	3	31	3
select * from t1 where c2 = 4;
c1	c2	c3	c4	c5	c6
24	4	4	4	24	4
32	4	4	4	32	4
select * from t1 where c2 = 1 and c3 = 1;
c1	c2	c3	c4	c5	c6
21	1	1	1	21	1
29	1	1	1	29	1
select * from t1 where c2 = 2 and c3 = 2;
c1	c2	c3	c4	c5	c6
22	2	2	2	22	2
30	2	2	2	30	2
select * from t1 where c2 = 3 and c3 = 3;
c1	c2	c3	c4	c5	c6
23	3	3	3	23	3
31	3	3	3	31	3
select * from t1 where c2 = 4 and c4 = 4;
c1	c2	c3	c4	c5	c6
24	4	4	4	24	4
32	4	4	4	32	4
select * from t1 where c2 >= 1 and c2 <= 4;
c1	c2	c3	c4	c5	c6
21	1	1	1	21	1
22	2	2	2	22	2
23	3	3	3	23	3
24	4	4	4	24	4
29	1	1	1	29	1
30	2	2	2	30	2
31	3	3	3	31	3
32	4	4	4	32	4
select * from t1 where c2 >= 1 and c2 < 3 or c2 = 4;
c1	c2	c3	c4	c5	c6
21	1	1	1	21	1
22	2	2	2	22	2
24	4	4	4	24	4
29	1	1	1	29	1
30	2	2	2	30	2
32	4	4	4	32	4
select * from t1 where c3 = 1;
c1	c2	c3	c4	c5	c6
21	1	1	1	21	1
29	1	1	1	29	1
select * from t1 where c3 = 2;
c1	c2	c3	c4	c5	c6
22	2	2	2	22	2
30	2	2	2	30	2
select * from t1 where c3 = 3;
c1	c2	c3	c4	c5	c6
23	3	3	3	23	3
31	3	3	3	31	3
select * from t1 where c3 = 4;
c1	c2	c3	c4	c5	c6
24	4	4	4	24	4
32	4	4	4	32	4
select * from t1 where c3 >= 1 and c3 <= 4;
c1	c2	c3	c4	c5	c6
21	1	1	1	21	1
22	2	2	2	22	2
23	3	3	3	23	3
24	4	4	4	24	4
29	1	1	1	29	1
30	2	2	2	30	2
31	3	3	3	31	3
32	4	4	4	32	4
select * from t1 where c4 = 1;
c1	c2	c3	c4	c5	c6
21	1	1	1	21	1
29	1	1	1	29	1
select * from t1 where c4 = 2;
c1	c2	c3	c4	c5	c6
22	2	2	2	22	2
30	2	2	2	30	2
select * from t1 where c4 = 3;
c1	c2	c3	c4	c5	c6
23	3	3	3	23	3
31	3	3	3	31	3
select * from t1 where c4 = 4;
c1	c2	c3	c4	c5	c6
24	4	4	4	24	4
32	4	4	4	32	4
select * from t1 where c4 >= 1 and c4 < 3 or c4 = 4;
c1	c2	c3	c4	c5	c6
21	1	1	1	21	1
22	2	2	2	22	2
24	4	4	4	24	4
29	1	1	1	29	1
30	2	2	2	30	2
32	4	4	4	32	4
select * from t1 where c5 = 1;
c1	c2	c3	c4	c5	c6
select * from t1 where c5 = 5;
c1	c2	c3	c4	c5	c6
select * from t1 where c5 = 9;
c1	c2	c3	c4	c5	c6
select * from t1 where c5 = 13;
c1	c2	c3	c4	c5	c6
select * from t1 where c5 = 17;
c1	c2	c3	c4	c5	c6
select * from t1 where c5 = 21;
c1	c2	c3	c4	c5	c6
21	1	1	1	21	1
select * from t1 where c5 = 25;
c1	c2	c3	c4	c5	c6
select * from t1 where c5 = 29;
c1	c2	c3	c4	c5	c6
29	1	1	1	29	1
select * from t1 where c5 = 33;
c1	c2	c3	c4	c5	c6
select * from t1 where c5 = 37;
c1	c2	c3	c4	c5	c6
select * from t1 where c5 = 40;
c1	c2	c3	c4	c5	c6
select * from t1 where (c5 >= 1 and c5 <= 16) or (c5 > 18 and c5 < 40);
c1	c2	c3	c4	c5	c6
21	1	1	1	21	1
22	2	2	2	22	2
23	3	3	3	23	3
24	4	4	4	24	4
29	1	1	1	29	1
30	2	2	2	30	2
31	3	3	3	31	3
32	4	4	4	32	4
select * from t1 where c5 > 1 and c5 < 14 or c5 = 21 or c5 > 25;
c1	c2	c3	c4	c5	c6
21	1	1	1	21	1
29	1	1	1	29	1
30	2	2	2	30	2
31	3	3	3	31	3
32	4	4	4	32	4
select * from t1 where c6 = 1;
c1	c2	c3	c4	c5	c6
21	1	1	1	21	1
29	1	1	1	29	1
select * from t1 where c6 = 2;
c1	c2	c3	c4	c5	c6
22	2	2	2	22	2
30	2	2	2	30	2
select * from t1 where c6 = 3;
c1	c2	c3	c4	c5	c6
23	3	3	3	23	3
31	3	3	3	31	3
select * from t1 where c6 = 4;
c1	c2	c3	c4	c5	c6
24	4	4	4	24	4
32	4	4	4	32	4
select c1 from t1 order by c1;
c1
21
22
23
24
29
30
31
32
select c2 from t1 order by c2;
c2
1
1
2
2
3
3
4
4
select c3 from t1 order by c3;
c3
1
1
2
2
3
3
4
4
select c4 from t1 order by c4;
c4
1
1
2
2
3
3
4
4
select c5 from t1 order by c5;
c5
21
22
23
24
29
30
31
32
select c6 from t1 order by c6;
c6
1
1
2
2
3
3
4
4
select c1 from t1 order by c1 desc;
c1
32
31
30
29
24
23
22
21
select c2 from t1 order by c2 desc;
c2
4
4
3
3
2
2
1
1
select c3 from t1 order by c3 desc;
c3
4
4
3
3
2
2
1
1
select c4 from t1 order by c4 desc;
c4
4
4
3
3
2
2
1
1
select c5 from t1 order by c5 desc;
c5
32
31
30
29
24
23
22
21
select c6 from t1 order by c6 desc;
c6
4
4
3
3
2
2
1
1
select max(c1) from t1;
max(c1)
32
select max(c2) from t1;
max(c2)
4
select max(c3) from t1;
max(c3)
4
select max(c4) from t1;
max(c4)
4
select max(c5) from t1;
max(c5)
32
select max(c6) from t1;
max(c6)
4
select min(c1) from t1;
min(c1)
21
select min(c2) from t1;
min(c2)
1
select min(c3) from t1;
min(c3)
1
select min(c4) from t1;
min(c4)
1
select min(c5) from t1;
min(c5)
21
select min(c6) from t1;
min(c6)
1
select count(*) from t1;
count(*)
8
select count(1) from t1;
count(1)
8
select count(c1) from t1;
count(c1)
8
select count(c2) from t1;
count(c2)
8
select count(c3) from t1;
count(c3)
8
select count(c4) from t1;
count(c4)
8
select count(c5) from t1;
count(c5)
8
select count(c6) from t1;
count(c6)
8
######################################################################
select mac_set_def_label('P1', 'L3:C3:');
mac_set_def_label('P1', 'L3:C3:')
success to set def label
select * from t1;
c1	c2	c3	c4	c5	c6
25	1	1	1	25	1
26	2	2	2	26	2
27	3	3	3	27	3
28	4	4	4	28	4
29	1	1	1	29	1
30	2	2	2	30	2
31	3	3	3	31	3
32	4	4	4	32	4
select c1, c2, c3, c4, c5, c6, _gdb_mac_policy_1 from t1;
c1	c2	c3	c4	c5	c6	_gdb_mac_policy_1
25	1	1	1	25	1	21
26	2	2	2	26	2	21
27	3	3	3	27	3	21
28	4	4	4	28	4	21
29	1	1	1	29	1	23
30	2	2	2	30	2	23
31	3	3	3	31	3	23
32	4	4	4	32	4	23
select * from t1 where c1 = 1;
c1	c2	c3	c4	c5	c6
select * from t1 where c1 = 5;
c1	c2	c3	c4	c5	c6
select * from t1 where c1 = 9;
c1	c2	c3	c4	c5	c6
select * from t1 where c1 = 13;
c1	c2	c3	c4	c5	c6
select * from t1 where c1 = 17;
c1	c2	c3	c4	c5	c6
select * from t1 where c1 = 21;
c1	c2	c3	c4	c5	c6
select * from t1 where c1 = 25;
c1	c2	c3	c4	c5	c6
25	1	1	1	25	1
select * from t1 where c1 = 29;
c1	c2	c3	c4	c5	c6
29	1	1	1	29	1
select * from t1 where c1 = 33;
c1	c2	c3	c4	c5	c6
select * from t1 where c1 = 37;
c1	c2	c3	c4	c5	c6
select * from t1 where c1 = 40;
c1	c2	c3	c4	c5	c6
select * from t1 where (c1 >= 1 and c1 <= 16) or (c1 > 18 and c1 < 42);
c1	c2	c3	c4	c5	c6
25	1	1	1	25	1
26	2	2	2	26	2
27	3	3	3	27	3
28	4	4	4	28	4
29	1	1	1	29	1
30	2	2	2	30	2
31	3	3	3	31	3
32	4	4	4	32	4
select * from t1 where c1 > 1 and c1 < 14 or c1 = 21 or c1 > 25;
c1	c2	c3	c4	c5	c6
26	2	2	2	26	2
27	3	3	3	27	3
28	4	4	4	28	4
29	1	1	1	29	1
30	2	2	2	30	2
31	3	3	3	31	3
32	4	4	4	32	4
select c1 from t1 where c1 = 1;
c1
select c1 from t1 where c1 = 5;
c1
select c1 from t1 where c1 = 9;
c1
select c1 from t1 where c1 = 13;
c1
select c1 from t1 where c1 = 17;
c1
select c1 from t1 where c1 = 21;
c1
select c1 from t1 where c1 = 25;
c1
25
select c1 from t1 where c1 = 29;
c1
29
select c1 from t1 where c1 = 33;
c1
select c1 from t1 where c1 = 37;
c1
select c1 from t1 where c2 = 40;
c1
select c1 from t1 where (c1 >= 1 and c1 <= 16) or (c1 > 18 and c1 < 42);
c1
25
26
27
28
29
30
31
32
select c1 from t1 where c1 > 1 and c1 < 14 or c1 = 21 or c1 > 25;
c1
26
27
28
29
30
31
32
select * from t1 where c2 = 1;
c1	c2	c3	c4	c5	c6
25	1	1	1	25	1
29	1	1	1	29	1
select * from t1 where c2 = 2;
c1	c2	c3	c4	c5	c6
26	2	2	2	26	2
30	2	2	2	30	2
select * from t1 where c2 = 3;
c1	c2	c3	c4	c5	c6
27	3	3	3	27	3
31	3	3	3	31	3
select * from t1 where c2 = 4;
c1	c2	c3	c4	c5	c6
28	4	4	4	28	4
32	4	4	4	32	4
select * from t1 where c2 = 1 and c3 = 1;
c1	c2	c3	c4	c5	c6
25	1	1	1	25	1
29	1	1	1	29	1
select * from t1 where c2 = 2 and c3 = 2;
c1	c2	c3	c4	c5	c6
26	2	2	2	26	2
30	2	2	2	30	2
select * from t1 where c2 = 3 and c3 = 3;
c1	c2	c3	c4	c5	c6
27	3	3	3	27	3
31	3	3	3	31	3
select * from t1 where c2 = 4 and c4 = 4;
c1	c2	c3	c4	c5	c6
28	4	4	4	28	4
32	4	4	4	32	4
select * from t1 where c2 >= 1 and c2 <= 4;
c1	c2	c3	c4	c5	c6
25	1	1	1	25	1
26	2	2	2	26	2
27	3	3	3	27	3
28	4	4	4	28	4
29	1	1	1	29	1
30	2	2	2	30	2
31	3	3	3	31	3
32	4	4	4	32	4
select * from t1 where c2 >= 1 and c2 < 3 or c2 = 4;
c1	c2	c3	c4	c5	c6
25	1	1	1	25	1
26	2	2	2	26	2
28	4	4	4	28	4
29	1	1	1	29	1
30	2	2	2	30	2
32	4	4	4	32	4
select * from t1 where c3 = 1;
c1	c2	c3	c4	c5	c6
25	1	1	1	25	1
29	1	1	1	29	1
select * from t1 where c3 = 2;
c1	c2	c3	c4	c5	c6
26	2	2	2	26	2
30	2	2	2	30	2
select * from t1 where c3 = 3;
c1	c2	c3	c4	c5	c6
27	3	3	3	27	3
31	3	3	3	31	3
select * from t1 where c3 = 4;
c1	c2	c3	c4	c5	c6
28	4	4	4	28	4
32	4	4	4	32	4
select * from t1 where c3 >= 1 and c3 <= 4;
c1	c2	c3	c4	c5	c6
25	1	1	1	25	1
26	2	2	2	26	2
27	3	3	3	27	3
28	4	4	4	28	4
29	1	1	1	29	1
30	2	2	2	30	2
31	3	3	3	31	3
32	4	4	4	32	4
select * from t1 where c4 = 1;
c1	c2	c3	c4	c5	c6
25	1	1	1	25	1
29	1	1	1	29	1
select * from t1 where c4 = 2;
c1	c2	c3	c4	c5	c6
26	2	2	2	26	2
30	2	2	2	30	2
select * from t1 where c4 = 3;
c1	c2	c3	c4	c5	c6
27	3	3	3	27	3
31	3	3	3	31	3
select * from t1 where c4 = 4;
c1	c2	c3	c4	c5	c6
28	4	4	4	28	4
32	4	4	4	32	4
select * from t1 where c4 >= 1 and c4 < 3 or c4 = 4;
c1	c2	c3	c4	c5	c6
25	1	1	1	25	1
26	2	2	2	26	2
28	4	4	4	28	4
29	1	1	1	29	1
30	2	2	2	30	2
32	4	4	4	32	4
select * from t1 where c5 = 1;
c1	c2	c3	c4	c5	c6
select * from t1 where c5 = 5;
c1	c2	c3	c4	c5	c6
select * from t1 where c5 = 9;
c1	c2	c3	c4	c5	c6
select * from t1 where c5 = 13;
c1	c2	c3	c4	c5	c6
select * from t1 where c5 = 17;
c1	c2	c3	c4	c5	c6
select * from t1 where c5 = 21;
c1	c2	c3	c4	c5	c6
select * from t1 where c5 = 25;
c1	c2	c3	c4	c5	c6
25	1	1	1	25	1
select * from t1 where c5 = 29;
c1	c2	c3	c4	c5	c6
29	1	1	1	29	1
select * from t1 where c5 = 33;
c1	c2	c3	c4	c5	c6
select * from t1 where c5 = 37;
c1	c2	c3	c4	c5	c6
select * from t1 where c5 = 40;
c1	c2	c3	c4	c5	c6
select * from t1 where (c5 >= 1 and c5 <= 16) or (c5 > 18 and c5 < 40);
c1	c2	c3	c4	c5	c6
25	1	1	1	25	1
26	2	2	2	26	2
27	3	3	3	27	3
28	4	4	4	28	4
29	1	1	1	29	1
30	2	2	2	30	2
31	3	3	3	31	3
32	4	4	4	32	4
select * from t1 where c5 > 1 and c5 < 14 or c5 = 21 or c5 > 25;
c1	c2	c3	c4	c5	c6
26	2	2	2	26	2
27	3	3	3	27	3
28	4	4	4	28	4
29	1	1	1	29	1
30	2	2	2	30	2
31	3	3	3	31	3
32	4	4	4	32	4
select * from t1 where c6 = 1;
c1	c2	c3	c4	c5	c6
25	1	1	1	25	1
29	1	1	1	29	1
select * from t1 where c6 = 2;
c1	c2	c3	c4	c5	c6
26	2	2	2	26	2
30	2	2	2	30	2
select * from t1 where c6 = 3;
c1	c2	c3	c4	c5	c6
27	3	3	3	27	3
31	3	3	3	31	3
select * from t1 where c6 = 4;
c1	c2	c3	c4	c5	c6
28	4	4	4	28	4
32	4	4	4	32	4
select c1 from t1 order by c1;
c1
25
26
27
28
29
30
31
32
select c2 from t1 order by c2;
c2
1
1
2
2
3
3
4
4
select c3 from t1 order by c3;
c3
1
1
2
2
3
3
4
4
select c4 from t1 order by c4;
c4
1
1
2
2
3
3
4
4
select c5 from t1 order by c5;
c5
25
26
27
28
29
30
31
32
select c6 from t1 order by c6;
c6
1
1
2
2
3
3
4
4
select c1 from t1 order by c1 desc;
c1
32
31
30
29
28
27
26
25
select c2 from t1 order by c2 desc;
c2
4
4
3
3
2
2
1
1
select c3 from t1 order by c3 desc;
c3
4
4
3
3
2
2
1
1
select c4 from t1 order by c4 desc;
c4
4
4
3
3
2
2
1
1
select c5 from t1 order by c5 desc;
c5
32
31
30
29
28
27
26
25
select c6 from t1 order by c6 desc;
c6
4
4
3
3
2
2
1
1
select max(c1) from t1;
max(c1)
32
select max(c2) from t1;
max(c2)
4
select max(c3) from t1;
max(c3)
4
select max(c4) from t1;
max(c4)
4
select max(c5) from t1;
max(c5)
32
select max(c6) from t1;
max(c6)
4
select min(c1) from t1;
min(c1)
25
select min(c2) from t1;
min(c2)
1
select min(c3) from t1;
min(c3)
1
select min(c4) from t1;
min(c4)
1
select min(c5) from t1;
min(c5)
25
select min(c6) from t1;
min(c6)
1
select count(*) from t1;
count(*)
8
select count(1) from t1;
count(1)
8
select count(c1) from t1;
count(c1)
8
select count(c2) from t1;
count(c2)
8
select count(c3) from t1;
count(c3)
8
select count(c4) from t1;
count(c4)
8
select count(c5) from t1;
count(c5)
8
select count(c6) from t1;
count(c6)
8
######################################################################
select mac_set_def_label('P1', 'L3:C4:');
mac_set_def_label('P1', 'L3:C4:')
success to set def label
select * from t1;
c1	c2	c3	c4	c5	c6
29	1	1	1	29	1
30	2	2	2	30	2
31	3	3	3	31	3
32	4	4	4	32	4
select c1, c2, c3, c4, c5, c6, _gdb_mac_policy_1 from t1;
c1	c2	c3	c4	c5	c6	_gdb_mac_policy_1
29	1	1	1	29	1	23
30	2	2	2	30	2	23
31	3	3	3	31	3	23
32	4	4	4	32	4	23
select * from t1 where c1 = 1;
c1	c2	c3	c4	c5	c6
select * from t1 where c1 = 5;
c1	c2	c3	c4	c5	c6
select * from t1 where c1 = 9;
c1	c2	c3	c4	c5	c6
select * from t1 where c1 = 13;
c1	c2	c3	c4	c5	c6
select * from t1 where c1 = 17;
c1	c2	c3	c4	c5	c6
select * from t1 where c1 = 21;
c1	c2	c3	c4	c5	c6
select * from t1 where c1 = 25;
c1	c2	c3	c4	c5	c6
select * from t1 where c1 = 29;
c1	c2	c3	c4	c5	c6
29	1	1	1	29	1
select * from t1 where c1 = 33;
c1	c2	c3	c4	c5	c6
select * from t1 where c1 = 37;
c1	c2	c3	c4	c5	c6
select * from t1 where c1 = 40;
c1	c2	c3	c4	c5	c6
select * from t1 where (c1 >= 1 and c1 <= 16) or (c1 > 18 and c1 < 42);
c1	c2	c3	c4	c5	c6
29	1	1	1	29	1
30	2	2	2	30	2
31	3	3	3	31	3
32	4	4	4	32	4
select * from t1 where c1 > 1 and c1 < 14 or c1 = 21 or c1 > 25;
c1	c2	c3	c4	c5	c6
29	1	1	1	29	1
30	2	2	2	30	2
31	3	3	3	31	3
32	4	4	4	32	4
select c1 from t1 where c1 = 1;
c1
select c1 from t1 where c1 = 5;
c1
select c1 from t1 where c1 = 9;
c1
select c1 from t1 where c1 = 13;
c1
select c1 from t1 where c1 = 17;
c1
select c1 from t1 where c1 = 21;
c1
select c1 from t1 where c1 = 25;
c1
select c1 from t1 where c1 = 29;
c1
29
select c1 from t1 where c1 = 33;
c1
select c1 from t1 where c1 = 37;
c1
select c1 from t1 where c2 = 40;
c1
select c1 from t1 where (c1 >= 1 and c1 <= 16) or (c1 > 18 and c1 < 42);
c1
29
30
31
32
select c1 from t1 where c1 > 1 and c1 < 14 or c1 = 21 or c1 > 25;
c1
29
30
31
32
select * from t1 where c2 = 1;
c1	c2	c3	c4	c5	c6
29	1	1	1	29	1
select * from t1 where c2 = 2;
c1	c2	c3	c4	c5	c6
30	2	2	2	30	2
select * from t1 where c2 = 3;
c1	c2	c3	c4	c5	c6
31	3	3	3	31	3
select * from t1 where c2 = 4;
c1	c2	c3	c4	c5	c6
32	4	4	4	32	4
select * from t1 where c2 = 1 and c3 = 1;
c1	c2	c3	c4	c5	c6
29	1	1	1	29	1
select * from t1 where c2 = 2 and c3 = 2;
c1	c2	c3	c4	c5	c6
30	2	2	2	30	2
select * from t1 where c2 = 3 and c3 = 3;
c1	c2	c3	c4	c5	c6
31	3	3	3	31	3
select * from t1 where c2 = 4 and c4 = 4;
c1	c2	c3	c4	c5	c6
32	4	4	4	32	4
select * from t1 where c2 >= 1 and c2 <= 4;
c1	c2	c3	c4	c5	c6
29	1	1	1	29	1
30	2	2	2	30	2
31	3	3	3	31	3
32	4	4	4	32	4
select * from t1 where c2 >= 1 and c2 < 3 or c2 = 4;
c1	c2	c3	c4	c5	c6
29	1	1	1	29	1
30	2	2	2	30	2
32	4	4	4	32	4
select * from t1 where c3 = 1;
c1	c2	c3	c4	c5	c6
29	1	1	1	29	1
select * from t1 where c3 = 2;
c1	c2	c3	c4	c5	c6
30	2	2	2	30	2
select * from t1 where c3 = 3;
c1	c2	c3	c4	c5	c6
31	3	3	3	31	3
select * from t1 where c3 = 4;
c1	c2	c3	c4	c5	c6
32	4	4	4	32	4
select * from t1 where c3 >= 1 and c3 <= 4;
c1	c2	c3	c4	c5	c6
29	1	1	1	29	1
30	2	2	2	30	2
31	3	3	3	31	3
32	4	4	4	32	4
select * from t1 where c4 = 1;
c1	c2	c3	c4	c5	c6
29	1	1	1	29	1
select * from t1 where c4 = 2;
c1	c2	c3	c4	c5	c6
30	2	2	2	30	2
select * from t1 where c4 = 3;
c1	c2	c3	c4	c5	c6
31	3	3	3	31	3
select * from t1 where c4 = 4;
c1	c2	c3	c4	c5	c6
32	4	4	4	32	4
select * from t1 where c4 >= 1 and c4 < 3 or c4 = 4;
c1	c2	c3	c4	c5	c6
29	1	1	1	29	1
30	2	2	2	30	2
32	4	4	4	32	4
select * from t1 where c5 = 1;
c1	c2	c3	c4	c5	c6
select * from t1 where c5 = 5;
c1	c2	c3	c4	c5	c6
select * from t1 where c5 = 9;
c1	c2	c3	c4	c5	c6
select * from t1 where c5 = 13;
c1	c2	c3	c4	c5	c6
select * from t1 where c5 = 17;
c1	c2	c3	c4	c5	c6
select * from t1 where c5 = 21;
c1	c2	c3	c4	c5	c6
select * from t1 where c5 = 25;
c1	c2	c3	c4	c5	c6
select * from t1 where c5 = 29;
c1	c2	c3	c4	c5	c6
29	1	1	1	29	1
select * from t1 where c5 = 33;
c1	c2	c3	c4	c5	c6
select * from t1 where c5 = 37;
c1	c2	c3	c4	c5	c6
select * from t1 where c5 = 40;
c1	c2	c3	c4	c5	c6
select * from t1 where (c5 >= 1 and c5 <= 16) or (c5 > 18 and c5 < 40);
c1	c2	c3	c4	c5	c6
29	1	1	1	29	1
30	2	2	2	30	2
31	3	3	3	31	3
32	4	4	4	32	4
select * from t1 where c5 > 1 and c5 < 14 or c5 = 21 or c5 > 25;
c1	c2	c3	c4	c5	c6
29	1	1	1	29	1
30	2	2	2	30	2
31	3	3	3	31	3
32	4	4	4	32	4
select * from t1 where c6 = 1;
c1	c2	c3	c4	c5	c6
29	1	1	1	29	1
select * from t1 where c6 = 2;
c1	c2	c3	c4	c5	c6
30	2	2	2	30	2
select * from t1 where c6 = 3;
c1	c2	c3	c4	c5	c6
31	3	3	3	31	3
select * from t1 where c6 = 4;
c1	c2	c3	c4	c5	c6
32	4	4	4	32	4
select c1 from t1 order by c1;
c1
29
30
31
32
select c2 from t1 order by c2;
c2
1
2
3
4
select c3 from t1 order by c3;
c3
1
2
3
4
select c4 from t1 order by c4;
c4
1
2
3
4
select c5 from t1 order by c5;
c5
29
30
31
32
select c6 from t1 order by c6;
c6
1
2
3
4
select c1 from t1 order by c1 desc;
c1
32
31
30
29
select c2 from t1 order by c2 desc;
c2
4
3
2
1
select c3 from t1 order by c3 desc;
c3
4
3
2
1
select c4 from t1 order by c4 desc;
c4
4
3
2
1
select c5 from t1 order by c5 desc;
c5
32
31
30
29
select c6 from t1 order by c6 desc;
c6
4
3
2
1
select max(c1) from t1;
max(c1)
32
select max(c2) from t1;
max(c2)
4
select max(c3) from t1;
max(c3)
4
select max(c4) from t1;
max(c4)
4
select max(c5) from t1;
max(c5)
32
select max(c6) from t1;
max(c6)
4
select min(c1) from t1;
min(c1)
29
select min(c2) from t1;
min(c2)
1
select min(c3) from t1;
min(c3)
1
select min(c4) from t1;
min(c4)
1
select min(c5) from t1;
min(c5)
29
select min(c6) from t1;
min(c6)
1
select count(*) from t1;
count(*)
4
select count(1) from t1;
count(1)
4
select count(c1) from t1;
count(c1)
4
select count(c2) from t1;
count(c2)
4
select count(c3) from t1;
count(c3)
4
select count(c4) from t1;
count(c4)
4
select count(c5) from t1;
count(c5)
4
select count(c6) from t1;
count(c6)
4
######################################################################
select mac_set_def_label('P1', 'L3:C2,C3,C4:');
mac_set_def_label('P1', 'L3:C2,C3,C4:')
success to set def label
select * from t1;
c1	c2	c3	c4	c5	c6
17	1	1	1	17	1
18	2	2	2	18	2
19	3	3	3	19	3
20	4	4	4	20	4
21	1	1	1	21	1
22	2	2	2	22	2
23	3	3	3	23	3
24	4	4	4	24	4
25	1	1	1	25	1
26	2	2	2	26	2
27	3	3	3	27	3
28	4	4	4	28	4
29	1	1	1	29	1
30	2	2	2	30	2
31	3	3	3	31	3
32	4	4	4	32	4
select c1, c2, c3, c4, c5, c6, _gdb_mac_policy_1 from t1;
c1	c2	c3	c4	c5	c6	_gdb_mac_policy_1
17	1	1	1	17	1	17
18	2	2	2	18	2	17
19	3	3	3	19	3	17
20	4	4	4	20	4	17
21	1	1	1	21	1	19
22	2	2	2	22	2	19
23	3	3	3	23	3	19
24	4	4	4	24	4	19
25	1	1	1	25	1	21
26	2	2	2	26	2	21
27	3	3	3	27	3	21
28	4	4	4	28	4	21
29	1	1	1	29	1	23
30	2	2	2	30	2	23
31	3	3	3	31	3	23
32	4	4	4	32	4	23
select * from t1 where c1 = 1;
c1	c2	c3	c4	c5	c6
select * from t1 where c1 = 5;
c1	c2	c3	c4	c5	c6
select * from t1 where c1 = 9;
c1	c2	c3	c4	c5	c6
select * from t1 where c1 = 13;
c1	c2	c3	c4	c5	c6
select * from t1 where c1 = 17;
c1	c2	c3	c4	c5	c6
17	1	1	1	17	1
select * from t1 where c1 = 21;
c1	c2	c3	c4	c5	c6
21	1	1	1	21	1
select * from t1 where c1 = 25;
c1	c2	c3	c4	c5	c6
25	1	1	1	25	1
select * from t1 where c1 = 29;
c1	c2	c3	c4	c5	c6
29	1	1	1	29	1
select * from t1 where c1 = 33;
c1	c2	c3	c4	c5	c6
select * from t1 where c1 = 37;
c1	c2	c3	c4	c5	c6
select * from t1 where c1 = 40;
c1	c2	c3	c4	c5	c6
select * from t1 where (c1 >= 1 and c1 <= 16) or (c1 > 18 and c1 < 42);
c1	c2	c3	c4	c5	c6
19	3	3	3	19	3
20	4	4	4	20	4
21	1	1	1	21	1
22	2	2	2	22	2
23	3	3	3	23	3
24	4	4	4	24	4
25	1	1	1	25	1
26	2	2	2	26	2
27	3	3	3	27	3
28	4	4	4	28	4
29	1	1	1	29	1
30	2	2	2	30	2
31	3	3	3	31	3
32	4	4	4	32	4
select * from t1 where c1 > 1 and c1 < 14 or c1 = 21 or c1 > 25;
c1	c2	c3	c4	c5	c6
21	1	1	1	21	1
26	2	2	2	26	2
27	3	3	3	27	3
28	4	4	4	28	4
29	1	1	1	29	1
30	2	2	2	30	2
31	3	3	3	31	3
32	4	4	4	32	4
select c1 from t1 where c1 = 1;
c1
select c1 from t1 where c1 = 5;
c1
select c1 from t1 where c1 = 9;
c1
select c1 from t1 where c1 = 13;
c1
select c1 from t1 where c1 = 17;
c1
17
select c1 from t1 where c1 = 21;
c1
21
select c1 from t1 where c1 = 25;
c1
25
select c1 from t1 where c1 = 29;
c1
29
select c1 from t1 where c1 = 33;
c1
select c1 from t1 where c1 = 37;
c1
select c1 from t1 where c2 = 40;
c1
select c1 from t1 where (c1 >= 1 and c1 <= 16) or (c1 > 18 and c1 < 42);
c1
19
20
21
22
23
24
25
26
27
28
29
30
31
32
select c1 from t1 where c1 > 1 and c1 < 14 or c1 = 21 or c1 > 25;
c1
21
26
27
28
29
30
31
32
select * from t1 where c2 = 1;
c1	c2	c3	c4	c5	c6
17	1	1	1	17	1
21	1	1	1	21	1
25	1	1	1	25	1
29	1	1	1	29	1
select * from t1 where c2 = 2;
c1	c2	c3	c4	c5	c6
18	2	2	2	18	2
22	2	2	2	22	2
26	2	2	2	26	2
30	2	2	2	30	2
select * from t1 where c2 = 3;
c1	c2	c3	c4	c5	c6
19	3	3	3	19	3
23	3	3	3	23	3
27	3	3	3	27	3
31	3	3	3	31	3
select * from t1 where c2 = 4;
c1	c2	c3	c4	c5	c6
20	4	4	4	20	4
24	4	4	4	24	4
28	4	4	4	28	4
32	4	4	4	32	4
select * from t1 where c2 = 1 and c3 = 1;
c1	c2	c3	c4	c5	c6
17	1	1	1	17	1
21	1	1	1	21	1
25	1	1	1	25	1
29	1	1	1	29	1
select * from t1 where c2 = 2 and c3 = 2;
c1	c2	c3	c4	c5	c6
18	2	2	2	18	2
22	2	2	2	22	2
26	2	2	2	26	2
30	2	2	2	30	2
select * from t1 where c2 = 3 and c3 = 3;
c1	c2	c3	c4	c5	c6
19	3	3	3	19	3
23	3	3	3	23	3
27	3	3	3	27	3
31	3	3	3	31	3
select * from t1 where c2 = 4 and c4 = 4;
c1	c2	c3	c4	c5	c6
20	4	4	4	20	4
24	4	4	4	24	4
28	4	4	4	28	4
32	4	4	4	32	4
select * from t1 where c2 >= 1 and c2 <= 4;
c1	c2	c3	c4	c5	c6
17	1	1	1	17	1
18	2	2	2	18	2
19	3	3	3	19	3
20	4	4	4	20	4
21	1	1	1	21	1
22	2	2	2	22	2
23	3	3	3	23	3
24	4	4	4	24	4
25	1	1	1	25	1
26	2	2	2	26	2
27	3	3	3	27	3
28	4	4	4	28	4
29	1	1	1	29	1
30	2	2	2	30	2
31	3	3	3	31	3
32	4	4	4	32	4
select * from t1 where c2 >= 1 and c2 < 3 or c2 = 4;
c1	c2	c3	c4	c5	c6
17	1	1	1	17	1
18	2	2	2	18	2
20	4	4	4	20	4
21	1	1	1	21	1
22	2	2	2	22	2
24	4	4	4	24	4
25	1	1	1	25	1
26	2	2	2	26	2
28	4	4	4	28	4
29	1	1	1	29	1
30	2	2	2	30	2
32	4	4	4	32	4
select * from t1 where c3 = 1;
c1	c2	c3	c4	c5	c6
17	1	1	1	17	1
21	1	1	1	21	1
25	1	1	1	25	1
29	1	1	1	29	1
select * from t1 where c3 = 2;
c1	c2	c3	c4	c5	c6
18	2	2	2	18	2
22	2	2	2	22	2
26	2	2	2	26	2
30	2	2	2	30	2
select * from t1 where c3 = 3;
c1	c2	c3	c4	c5	c6
19	3	3	3	19	3
23	3	3	3	23	3
27	3	3	3	27	3
31	3	3	3	31	3
select * from t1 where c3 = 4;
c1	c2	c3	c4	c5	c6
20	4	4	4	20	4
24	4	4	4	24	4
28	4	4	4	28	4
32	4	4	4	32	4
select * from t1 where c3 >= 1 and c3 <= 4;
c1	c2	c3	c4	c5	c6
17	1	1	1	17	1
18	2	2	2	18	2
19	3	3	3	19	3
20	4	4	4	20	4
21	1	1	1	21	1
22	2	2	2	22	2
23	3	3	3	23	3
24	4	4	4	24	4
25	1	1	1	25	1
26	2	2	2	26	2
27	3	3	3	27	3
28	4	4	4	28	4
29	1	1	1	29	1
30	2	2	2	30	2
31	3	3	3	31	3
32	4	4	4	32	4
select * from t1 where c4 = 1;
c1	c2	c3	c4	c5	c6
17	1	1	1	17	1
21	1	1	1	21	1
25	1	1	1	25	1
29	1	1	1	29	1
select * from t1 where c4 = 2;
c1	c2	c3	c4	c5	c6
18	2	2	2	18	2
22	2	2	2	22	2
26	2	2	2	26	2
30	2	2	2	30	2
select * from t1 where c4 = 3;
c1	c2	c3	c4	c5	c6
19	3	3	3	19	3
23	3	3	3	23	3
27	3	3	3	27	3
31	3	3	3	31	3
select * from t1 where c4 = 4;
c1	c2	c3	c4	c5	c6
20	4	4	4	20	4
24	4	4	4	24	4
28	4	4	4	28	4
32	4	4	4	32	4
select * from t1 where c4 >= 1 and c4 < 3 or c4 = 4;
c1	c2	c3	c4	c5	c6
17	1	1	1	17	1
18	2	2	2	18	2
20	4	4	4	20	4
21	1	1	1	21	1
22	2	2	2	22	2
24	4	4	4	24	4
25	1	1	1	25	1
26	2	2	2	26	2
28	4	4	4	28	4
29	1	1	1	29	1
30	2	2	2	30	2
32	4	4	4	32	4
select * from t1 where c5 = 1;
c1	c2	c3	c4	c5	c6
select * from t1 where c5 = 5;
c1	c2	c3	c4	c5	c6
select * from t1 where c5 = 9;
c1	c2	c3	c4	c5	c6
select * from t1 where c5 = 13;
c1	c2	c3	c4	c5	c6
select * from t1 where c5 = 17;
c1	c2	c3	c4	c5	c6
17	1	1	1	17	1
select * from t1 where c5 = 21;
c1	c2	c3	c4	c5	c6
21	1	1	1	21	1
select * from t1 where c5 = 25;
c1	c2	c3	c4	c5	c6
25	1	1	1	25	1
select * from t1 where c5 = 29;
c1	c2	c3	c4	c5	c6
29	1	1	1	29	1
select * from t1 where c5 = 33;
c1	c2	c3	c4	c5	c6
select * from t1 where c5 = 37;
c1	c2	c3	c4	c5	c6
select * from t1 where c5 = 40;
c1	c2	c3	c4	c5	c6
select * from t1 where (c5 >= 1 and c5 <= 16) or (c5 > 18 and c5 < 40);
c1	c2	c3	c4	c5	c6
19	3	3	3	19	3
20	4	4	4	20	4
21	1	1	1	21	1
22	2	2	2	22	2
23	3	3	3	23	3
24	4	4	4	24	4
25	1	1	1	25	1
26	2	2	2	26	2
27	3	3	3	27	3
28	4	4	4	28	4
29	1	1	1	29	1
30	2	2	2	30	2
31	3	3	3	31	3
32	4	4	4	32	4
select * from t1 where c5 > 1 and c5 < 14 or c5 = 21 or c5 > 25;
c1	c2	c3	c4	c5	c6
21	1	1	1	21	1
26	2	2	2	26	2
27	3	3	3	27	3
28	4	4	4	28	4
29	1	1	1	29	1
30	2	2	2	30	2
31	3	3	3	31	3
32	4	4	4	32	4
select * from t1 where c6 = 1;
c1	c2	c3	c4	c5	c6
17	1	1	1	17	1
21	1	1	1	21	1
25	1	1	1	25	1
29	1	1	1	29	1
select * from t1 where c6 = 2;
c1	c2	c3	c4	c5	c6
18	2	2	2	18	2
22	2	2	2	22	2
26	2	2	2	26	2
30	2	2	2	30	2
select * from t1 where c6 = 3;
c1	c2	c3	c4	c5	c6
19	3	3	3	19	3
23	3	3	3	23	3
27	3	3	3	27	3
31	3	3	3	31	3
select * from t1 where c6 = 4;
c1	c2	c3	c4	c5	c6
20	4	4	4	20	4
24	4	4	4	24	4
28	4	4	4	28	4
32	4	4	4	32	4
select c1 from t1 order by c1;
c1
17
18
19
20
21
22
23
24
25
26
27
28
29
30
31
32
select c2 from t1 order by c2;
c2
1
1
1
1
2
2
2
2
3
3
3
3
4
4
4
4
select c3 from t1 order by c3;
c3
1
1
1
1
2
2
2
2
3
3
3
3
4
4
4
4
select c4 from t1 order by c4;
c4
1
1
1
1
2
2
2
2
3
3
3
3
4
4
4
4
select c5 from t1 order by c5;
c5
17
18
19
20
21
22
23
24
25
26
27
28
29
30
31
32
select c6 from t1 order by c6;
c6
1
1
1
1
2
2
2
2
3
3
3
3
4
4
4
4
select c1 from t1 order by c1 desc;
c1
32
31
30
29
28
27
26
25
24
23
22
21
20
19
18
17
select c2 from t1 order by c2 desc;
c2
4
4
4
4
3
3
3
3
2
2
2
2
1
1
1
1
select c3 from t1 order by c3 desc;
c3
4
4
4
4
3
3
3
3
2
2
2
2
1
1
1
1
select c4 from t1 order by c4 desc;
c4
4
4
4
4
3
3
3
3
2
2
2
2
1
1
1
1
select c5 from t1 order by c5 desc;
c5
32
31
30
29
28
27
26
25
24
23
22
21
20
19
18
17
select c6 from t1 order by c6 desc;
c6
4
4
4
4
3
3
3
3
2
2
2
2
1
1
1
1
select max(c1) from t1;
max(c1)
32
select max(c2) from t1;
max(c2)
4
select max(c3) from t1;
max(c3)
4
select max(c4) from t1;
max(c4)
4
select max(c5) from t1;
max(c5)
32
select max(c6) from t1;
max(c6)
4
select min(c1) from t1;
min(c1)
17
select min(c2) from t1;
min(c2)
1
select min(c3) from t1;
min(c3)
1
select min(c4) from t1;
min(c4)
1
select min(c5) from t1;
min(c5)
17
select min(c6) from t1;
min(c6)
1
select count(*) from t1;
count(*)
16
select count(1) from t1;
count(1)
16
select count(c1) from t1;
count(c1)
16
select count(c2) from t1;
count(c2)
16
select count(c3) from t1;
count(c3)
16
select count(c4) from t1;
count(c4)
16
select count(c5) from t1;
count(c5)
16
select count(c6) from t1;
count(c6)
16
######################################################################
select mac_set_def_label('P1', 'L3:C2,C3,C4:');
mac_set_def_label('P1', 'L3:C2,C3,C4:')
success to set def label
select * from t1;
c1	c2	c3	c4	c5	c6
17	1	1	1	17	1
18	2	2	2	18	2
19	3	3	3	19	3
20	4	4	4	20	4
21	1	1	1	21	1
22	2	2	2	22	2
23	3	3	3	23	3
24	4	4	4	24	4
25	1	1	1	25	1
26	2	2	2	26	2
27	3	3	3	27	3
28	4	4	4	28	4
29	1	1	1	29	1
30	2	2	2	30	2
31	3	3	3	31	3
32	4	4	4	32	4
select c1, c2, c3, c4, c5, c6, _gdb_mac_policy_1 from t1;
c1	c2	c3	c4	c5	c6	_gdb_mac_policy_1
17	1	1	1	17	1	17
18	2	2	2	18	2	17
19	3	3	3	19	3	17
20	4	4	4	20	4	17
21	1	1	1	21	1	19
22	2	2	2	22	2	19
23	3	3	3	23	3	19
24	4	4	4	24	4	19
25	1	1	1	25	1	21
26	2	2	2	26	2	21
27	3	3	3	27	3	21
28	4	4	4	28	4	21
29	1	1	1	29	1	23
30	2	2	2	30	2	23
31	3	3	3	31	3	23
32	4	4	4	32	4	23
select * from t1 where c1 = 1;
c1	c2	c3	c4	c5	c6
select * from t1 where c1 = 5;
c1	c2	c3	c4	c5	c6
select * from t1 where c1 = 9;
c1	c2	c3	c4	c5	c6
select * from t1 where c1 = 13;
c1	c2	c3	c4	c5	c6
select * from t1 where c1 = 17;
c1	c2	c3	c4	c5	c6
17	1	1	1	17	1
select * from t1 where c1 = 21;
c1	c2	c3	c4	c5	c6
21	1	1	1	21	1
select * from t1 where c1 = 25;
c1	c2	c3	c4	c5	c6
25	1	1	1	25	1
select * from t1 where c1 = 29;
c1	c2	c3	c4	c5	c6
29	1	1	1	29	1
select * from t1 where c1 = 33;
c1	c2	c3	c4	c5	c6
select * from t1 where c1 = 37;
c1	c2	c3	c4	c5	c6
select * from t1 where c1 = 40;
c1	c2	c3	c4	c5	c6
select * from t1 where (c1 >= 1 and c1 <= 16) or (c1 > 18 and c1 < 42);
c1	c2	c3	c4	c5	c6
19	3	3	3	19	3
20	4	4	4	20	4
21	1	1	1	21	1
22	2	2	2	22	2
23	3	3	3	23	3
24	4	4	4	24	4
25	1	1	1	25	1
26	2	2	2	26	2
27	3	3	3	27	3
28	4	4	4	28	4
29	1	1	1	29	1
30	2	2	2	30	2
31	3	3	3	31	3
32	4	4	4	32	4
select * from t1 where c1 > 1 and c1 < 14 or c1 = 21 or c1 > 25;
c1	c2	c3	c4	c5	c6
21	1	1	1	21	1
26	2	2	2	26	2
27	3	3	3	27	3
28	4	4	4	28	4
29	1	1	1	29	1
30	2	2	2	30	2
31	3	3	3	31	3
32	4	4	4	32	4
select c1 from t1 where c1 = 1;
c1
select c1 from t1 where c1 = 5;
c1
select c1 from t1 where c1 = 9;
c1
select c1 from t1 where c1 = 13;
c1
select c1 from t1 where c1 = 17;
c1
17
select c1 from t1 where c1 = 21;
c1
21
select c1 from t1 where c1 = 25;
c1
25
select c1 from t1 where c1 = 29;
c1
29
select c1 from t1 where c1 = 33;
c1
select c1 from t1 where c1 = 37;
c1
select c1 from t1 where c2 = 40;
c1
select c1 from t1 where (c1 >= 1 and c1 <= 16) or (c1 > 18 and c1 < 42);
c1
19
20
21
22
23
24
25
26
27
28
29
30
31
32
select c1 from t1 where c1 > 1 and c1 < 14 or c1 = 21 or c1 > 25;
c1
21
26
27
28
29
30
31
32
select * from t1 where c2 = 1;
c1	c2	c3	c4	c5	c6
17	1	1	1	17	1
21	1	1	1	21	1
25	1	1	1	25	1
29	1	1	1	29	1
select * from t1 where c2 = 2;
c1	c2	c3	c4	c5	c6
18	2	2	2	18	2
22	2	2	2	22	2
26	2	2	2	26	2
30	2	2	2	30	2
select * from t1 where c2 = 3;
c1	c2	c3	c4	c5	c6
19	3	3	3	19	3
23	3	3	3	23	3
27	3	3	3	27	3
31	3	3	3	31	3
select * from t1 where c2 = 4;
c1	c2	c3	c4	c5	c6
20	4	4	4	20	4
24	4	4	4	24	4
28	4	4	4	28	4
32	4	4	4	32	4
select * from t1 where c2 = 1 and c3 = 1;
c1	c2	c3	c4	c5	c6
17	1	1	1	17	1
21	1	1	1	21	1
25	1	1	1	25	1
29	1	1	1	29	1
select * from t1 where c2 = 2 and c3 = 2;
c1	c2	c3	c4	c5	c6
18	2	2	2	18	2
22	2	2	2	22	2
26	2	2	2	26	2
30	2	2	2	30	2
select * from t1 where c2 = 3 and c3 = 3;
c1	c2	c3	c4	c5	c6
19	3	3	3	19	3
23	3	3	3	23	3
27	3	3	3	27	3
31	3	3	3	31	3
select * from t1 where c2 = 4 and c4 = 4;
c1	c2	c3	c4	c5	c6
20	4	4	4	20	4
24	4	4	4	24	4
28	4	4	4	28	4
32	4	4	4	32	4
select * from t1 where c2 >= 1 and c2 <= 4;
c1	c2	c3	c4	c5	c6
17	1	1	1	17	1
18	2	2	2	18	2
19	3	3	3	19	3
20	4	4	4	20	4
21	1	1	1	21	1
22	2	2	2	22	2
23	3	3	3	23	3
24	4	4	4	24	4
25	1	1	1	25	1
26	2	2	2	26	2
27	3	3	3	27	3
28	4	4	4	28	4
29	1	1	1	29	1
30	2	2	2	30	2
31	3	3	3	31	3
32	4	4	4	32	4
select * from t1 where c2 >= 1 and c2 < 3 or c2 = 4;
c1	c2	c3	c4	c5	c6
17	1	1	1	17	1
18	2	2	2	18	2
20	4	4	4	20	4
21	1	1	1	21	1
22	2	2	2	22	2
24	4	4	4	24	4
25	1	1	1	25	1
26	2	2	2	26	2
28	4	4	4	28	4
29	1	1	1	29	1
30	2	2	2	30	2
32	4	4	4	32	4
select * from t1 where c3 = 1;
c1	c2	c3	c4	c5	c6
17	1	1	1	17	1
21	1	1	1	21	1
25	1	1	1	25	1
29	1	1	1	29	1
select * from t1 where c3 = 2;
c1	c2	c3	c4	c5	c6
18	2	2	2	18	2
22	2	2	2	22	2
26	2	2	2	26	2
30	2	2	2	30	2
select * from t1 where c3 = 3;
c1	c2	c3	c4	c5	c6
19	3	3	3	19	3
23	3	3	3	23	3
27	3	3	3	27	3
31	3	3	3	31	3
select * from t1 where c3 = 4;
c1	c2	c3	c4	c5	c6
20	4	4	4	20	4
24	4	4	4	24	4
28	4	4	4	28	4
32	4	4	4	32	4
select * from t1 where c3 >= 1 and c3 <= 4;
c1	c2	c3	c4	c5	c6
17	1	1	1	17	1
18	2	2	2	18	2
19	3	3	3	19	3
20	4	4	4	20	4
21	1	1	1	21	1
22	2	2	2	22	2
23	3	3	3	23	3
24	4	4	4	24	4
25	1	1	1	25	1
26	2	2	2	26	2
27	3	3	3	27	3
28	4	4	4	28	4
29	1	1	1	29	1
30	2	2	2	30	2
31	3	3	3	31	3
32	4	4	4	32	4
select * from t1 where c4 = 1;
c1	c2	c3	c4	c5	c6
17	1	1	1	17	1
21	1	1	1	21	1
25	1	1	1	25	1
29	1	1	1	29	1
select * from t1 where c4 = 2;
c1	c2	c3	c4	c5	c6
18	2	2	2	18	2
22	2	2	2	22	2
26	2	2	2	26	2
30	2	2	2	30	2
select * from t1 where c4 = 3;
c1	c2	c3	c4	c5	c6
19	3	3	3	19	3
23	3	3	3	23	3
27	3	3	3	27	3
31	3	3	3	31	3
select * from t1 where c4 = 4;
c1	c2	c3	c4	c5	c6
20	4	4	4	20	4
24	4	4	4	24	4
28	4	4	4	28	4
32	4	4	4	32	4
select * from t1 where c4 >= 1 and c4 < 3 or c4 = 4;
c1	c2	c3	c4	c5	c6
17	1	1	1	17	1
18	2	2	2	18	2
20	4	4	4	20	4
21	1	1	1	21	1
22	2	2	2	22	2
24	4	4	4	24	4
25	1	1	1	25	1
26	2	2	2	26	2
28	4	4	4	28	4
29	1	1	1	29	1
30	2	2	2	30	2
32	4	4	4	32	4
select * from t1 where c5 = 1;
c1	c2	c3	c4	c5	c6
select * from t1 where c5 = 5;
c1	c2	c3	c4	c5	c6
select * from t1 where c5 = 9;
c1	c2	c3	c4	c5	c6
select * from t1 where c5 = 13;
c1	c2	c3	c4	c5	c6
select * from t1 where c5 = 17;
c1	c2	c3	c4	c5	c6
17	1	1	1	17	1
select * from t1 where c5 = 21;
c1	c2	c3	c4	c5	c6
21	1	1	1	21	1
select * from t1 where c5 = 25;
c1	c2	c3	c4	c5	c6
25	1	1	1	25	1
select * from t1 where c5 = 29;
c1	c2	c3	c4	c5	c6
29	1	1	1	29	1
select * from t1 where c5 = 33;
c1	c2	c3	c4	c5	c6
select * from t1 where c5 = 37;
c1	c2	c3	c4	c5	c6
select * from t1 where c5 = 40;
c1	c2	c3	c4	c5	c6
select * from t1 where (c5 >= 1 and c5 <= 16) or (c5 > 18 and c5 < 40);
c1	c2	c3	c4	c5	c6
19	3	3	3	19	3
20	4	4	4	20	4
21	1	1	1	21	1
22	2	2	2	22	2
23	3	3	3	23	3
24	4	4	4	24	4
25	1	1	1	25	1
26	2	2	2	26	2
27	3	3	3	27	3
28	4	4	4	28	4
29	1	1	1	29	1
30	2	2	2	30	2
31	3	3	3	31	3
32	4	4	4	32	4
select * from t1 where c5 > 1 and c5 < 14 or c5 = 21 or c5 > 25;
c1	c2	c3	c4	c5	c6
21	1	1	1	21	1
26	2	2	2	26	2
27	3	3	3	27	3
28	4	4	4	28	4
29	1	1	1	29	1
30	2	2	2	30	2
31	3	3	3	31	3
32	4	4	4	32	4
select * from t1 where c6 = 1;
c1	c2	c3	c4	c5	c6
17	1	1	1	17	1
21	1	1	1	21	1
25	1	1	1	25	1
29	1	1	1	29	1
select * from t1 where c6 = 2;
c1	c2	c3	c4	c5	c6
18	2	2	2	18	2
22	2	2	2	22	2
26	2	2	2	26	2
30	2	2	2	30	2
select * from t1 where c6 = 3;
c1	c2	c3	c4	c5	c6
19	3	3	3	19	3
23	3	3	3	23	3
27	3	3	3	27	3
31	3	3	3	31	3
select * from t1 where c6 = 4;
c1	c2	c3	c4	c5	c6
20	4	4	4	20	4
24	4	4	4	24	4
28	4	4	4	28	4
32	4	4	4	32	4
select c1 from t1 order by c1;
c1
17
18
19
20
21
22
23
24
25
26
27
28
29
30
31
32
select c2 from t1 order by c2;
c2
1
1
1
1
2
2
2
2
3
3
3
3
4
4
4
4
select c3 from t1 order by c3;
c3
1
1
1
1
2
2
2
2
3
3
3
3
4
4
4
4
select c4 from t1 order by c4;
c4
1
1
1
1
2
2
2
2
3
3
3
3
4
4
4
4
select c5 from t1 order by c5;
c5
17
18
19
20
21
22
23
24
25
26
27
28
29
30
31
32
select c6 from t1 order by c6;
c6
1
1
1
1
2
2
2
2
3
3
3
3
4
4
4
4
select c1 from t1 order by c1 desc;
c1
32
31
30
29
28
27
26
25
24
23
22
21
20
19
18
17
select c2 from t1 order by c2 desc;
c2
4
4
4
4
3
3
3
3
2
2
2
2
1
1
1
1
select c3 from t1 order by c3 desc;
c3
4
4
4
4
3
3
3
3
2
2
2
2
1
1
1
1
select c4 from t1 order by c4 desc;
c4
4
4
4
4
3
3
3
3
2
2
2
2
1
1
1
1
select c5 from t1 order by c5 desc;
c5
32
31
30
29
28
27
26
25
24
23
22
21
20
19
18
17
select c6 from t1 order by c6 desc;
c6
4
4
4
4
3
3
3
3
2
2
2
2
1
1
1
1
select max(c1) from t1;
max(c1)
32
select max(c2) from t1;
max(c2)
4
select max(c3) from t1;
max(c3)
4
select max(c4) from t1;
max(c4)
4
select max(c5) from t1;
max(c5)
32
select max(c6) from t1;
max(c6)
4
select min(c1) from t1;
min(c1)
17
select min(c2) from t1;
min(c2)
1
select min(c3) from t1;
min(c3)
1
select min(c4) from t1;
min(c4)
1
select min(c5) from t1;
min(c5)
17
select min(c6) from t1;
min(c6)
1
select count(*) from t1;
count(*)
16
select count(1) from t1;
count(1)
16
select count(c1) from t1;
count(c1)
16
select count(c2) from t1;
count(c2)
16
select count(c3) from t1;
count(c3)
16
select count(c4) from t1;
count(c4)
16
select count(c5) from t1;
count(c5)
16
select count(c6) from t1;
count(c6)
16
######################################################################
select mac_set_def_label('P1', 'L3::G1');
mac_set_def_label('P1', 'L3::G1')
success to set def label
select * from t1;
c1	c2	c3	c4	c5	c6
29	1	1	1	29	1
30	2	2	2	30	2
31	3	3	3	31	3
32	4	4	4	32	4
41	1	1	1	41	1
42	2	2	2	42	2
43	3	3	3	43	3
44	4	4	4	44	4
select c1, c2, c3, c4, c5, c6, _gdb_mac_policy_1 from t1;
c1	c2	c3	c4	c5	c6	_gdb_mac_policy_1
29	1	1	1	29	1	23
30	2	2	2	30	2	23
31	3	3	3	31	3	23
32	4	4	4	32	4	23
41	1	1	1	41	1	32
42	2	2	2	42	2	32
43	3	3	3	43	3	32
44	4	4	4	44	4	32
select * from t1 where c1 = 1;
c1	c2	c3	c4	c5	c6
select * from t1 where c1 = 5;
c1	c2	c3	c4	c5	c6
select * from t1 where c1 = 9;
c1	c2	c3	c4	c5	c6
select * from t1 where c1 = 13;
c1	c2	c3	c4	c5	c6
select * from t1 where c1 = 17;
c1	c2	c3	c4	c5	c6
select * from t1 where c1 = 21;
c1	c2	c3	c4	c5	c6
select * from t1 where c1 = 25;
c1	c2	c3	c4	c5	c6
select * from t1 where c1 = 29;
c1	c2	c3	c4	c5	c6
29	1	1	1	29	1
select * from t1 where c1 = 33;
c1	c2	c3	c4	c5	c6
select * from t1 where c1 = 37;
c1	c2	c3	c4	c5	c6
select * from t1 where c1 = 40;
c1	c2	c3	c4	c5	c6
select * from t1 where (c1 >= 1 and c1 <= 16) or (c1 > 18 and c1 < 42);
c1	c2	c3	c4	c5	c6
29	1	1	1	29	1
30	2	2	2	30	2
31	3	3	3	31	3
32	4	4	4	32	4
41	1	1	1	41	1
select * from t1 where c1 > 1 and c1 < 14 or c1 = 21 or c1 > 25;
c1	c2	c3	c4	c5	c6
29	1	1	1	29	1
30	2	2	2	30	2
31	3	3	3	31	3
32	4	4	4	32	4
41	1	1	1	41	1
42	2	2	2	42	2
43	3	3	3	43	3
44	4	4	4	44	4
select c1 from t1 where c1 = 1;
c1
select c1 from t1 where c1 = 5;
c1
select c1 from t1 where c1 = 9;
c1
select c1 from t1 where c1 = 13;
c1
select c1 from t1 where c1 = 17;
c1
select c1 from t1 where c1 = 21;
c1
select c1 from t1 where c1 = 25;
c1
select c1 from t1 where c1 = 29;
c1
29
select c1 from t1 where c1 = 33;
c1
select c1 from t1 where c1 = 37;
c1
select c1 from t1 where c2 = 40;
c1
select c1 from t1 where (c1 >= 1 and c1 <= 16) or (c1 > 18 and c1 < 42);
c1
29
30
31
32
41
select c1 from t1 where c1 > 1 and c1 < 14 or c1 = 21 or c1 > 25;
c1
29
30
31
32
41
42
43
44
select * from t1 where c2 = 1;
c1	c2	c3	c4	c5	c6
29	1	1	1	29	1
41	1	1	1	41	1
select * from t1 where c2 = 2;
c1	c2	c3	c4	c5	c6
30	2	2	2	30	2
42	2	2	2	42	2
select * from t1 where c2 = 3;
c1	c2	c3	c4	c5	c6
31	3	3	3	31	3
43	3	3	3	43	3
select * from t1 where c2 = 4;
c1	c2	c3	c4	c5	c6
32	4	4	4	32	4
44	4	4	4	44	4
select * from t1 where c2 = 1 and c3 = 1;
c1	c2	c3	c4	c5	c6
29	1	1	1	29	1
41	1	1	1	41	1
select * from t1 where c2 = 2 and c3 = 2;
c1	c2	c3	c4	c5	c6
30	2	2	2	30	2
42	2	2	2	42	2
select * from t1 where c2 = 3 and c3 = 3;
c1	c2	c3	c4	c5	c6
31	3	3	3	31	3
43	3	3	3	43	3
select * from t1 where c2 = 4 and c4 = 4;
c1	c2	c3	c4	c5	c6
32	4	4	4	32	4
44	4	4	4	44	4
select * from t1 where c2 >= 1 and c2 <= 4;
c1	c2	c3	c4	c5	c6
29	1	1	1	29	1
30	2	2	2	30	2
31	3	3	3	31	3
32	4	4	4	32	4
41	1	1	1	41	1
42	2	2	2	42	2
43	3	3	3	43	3
44	4	4	4	44	4
select * from t1 where c2 >= 1 and c2 < 3 or c2 = 4;
c1	c2	c3	c4	c5	c6
29	1	1	1	29	1
30	2	2	2	30	2
32	4	4	4	32	4
41	1	1	1	41	1
42	2	2	2	42	2
44	4	4	4	44	4
select * from t1 where c3 = 1;
c1	c2	c3	c4	c5	c6
29	1	1	1	29	1
41	1	1	1	41	1
select * from t1 where c3 = 2;
c1	c2	c3	c4	c5	c6
30	2	2	2	30	2
42	2	2	2	42	2
select * from t1 where c3 = 3;
c1	c2	c3	c4	c5	c6
31	3	3	3	31	3
43	3	3	3	43	3
select * from t1 where c3 = 4;
c1	c2	c3	c4	c5	c6
32	4	4	4	32	4
44	4	4	4	44	4
select * from t1 where c3 >= 1 and c3 <= 4;
c1	c2	c3	c4	c5	c6
29	1	1	1	29	1
30	2	2	2	30	2
31	3	3	3	31	3
32	4	4	4	32	4
41	1	1	1	41	1
42	2	2	2	42	2
43	3	3	3	43	3
44	4	4	4	44	4
select * from t1 where c4 = 1;
c1	c2	c3	c4	c5	c6
29	1	1	1	29	1
41	1	1	1	41	1
select * from t1 where c4 = 2;
c1	c2	c3	c4	c5	c6
30	2	2	2	30	2
42	2	2	2	42	2
select * from t1 where c4 = 3;
c1	c2	c3	c4	c5	c6
31	3	3	3	31	3
43	3	3	3	43	3
select * from t1 where c4 = 4;
c1	c2	c3	c4	c5	c6
32	4	4	4	32	4
44	4	4	4	44	4
select * from t1 where c4 >= 1 and c4 < 3 or c4 = 4;
c1	c2	c3	c4	c5	c6
29	1	1	1	29	1
30	2	2	2	30	2
32	4	4	4	32	4
41	1	1	1	41	1
42	2	2	2	42	2
44	4	4	4	44	4
select * from t1 where c5 = 1;
c1	c2	c3	c4	c5	c6
select * from t1 where c5 = 5;
c1	c2	c3	c4	c5	c6
select * from t1 where c5 = 9;
c1	c2	c3	c4	c5	c6
select * from t1 where c5 = 13;
c1	c2	c3	c4	c5	c6
select * from t1 where c5 = 17;
c1	c2	c3	c4	c5	c6
select * from t1 where c5 = 21;
c1	c2	c3	c4	c5	c6
select * from t1 where c5 = 25;
c1	c2	c3	c4	c5	c6
select * from t1 where c5 = 29;
c1	c2	c3	c4	c5	c6
29	1	1	1	29	1
select * from t1 where c5 = 33;
c1	c2	c3	c4	c5	c6
select * from t1 where c5 = 37;
c1	c2	c3	c4	c5	c6
select * from t1 where c5 = 40;
c1	c2	c3	c4	c5	c6
select * from t1 where (c5 >= 1 and c5 <= 16) or (c5 > 18 and c5 < 40);
c1	c2	c3	c4	c5	c6
29	1	1	1	29	1
30	2	2	2	30	2
31	3	3	3	31	3
32	4	4	4	32	4
select * from t1 where c5 > 1 and c5 < 14 or c5 = 21 or c5 > 25;
c1	c2	c3	c4	c5	c6
29	1	1	1	29	1
30	2	2	2	30	2
31	3	3	3	31	3
32	4	4	4	32	4
41	1	1	1	41	1
42	2	2	2	42	2
43	3	3	3	43	3
44	4	4	4	44	4
select * from t1 where c6 = 1;
c1	c2	c3	c4	c5	c6
29	1	1	1	29	1
41	1	1	1	41	1
select * from t1 where c6 = 2;
c1	c2	c3	c4	c5	c6
30	2	2	2	30	2
42	2	2	2	42	2
select * from t1 where c6 = 3;
c1	c2	c3	c4	c5	c6
31	3	3	3	31	3
43	3	3	3	43	3
select * from t1 where c6 = 4;
c1	c2	c3	c4	c5	c6
32	4	4	4	32	4
44	4	4	4	44	4
select c1 from t1 order by c1;
c1
29
30
31
32
41
42
43
44
select c2 from t1 order by c2;
c2
1
1
2
2
3
3
4
4
select c3 from t1 order by c3;
c3
1
1
2
2
3
3
4
4
select c4 from t1 order by c4;
c4
1
1
2
2
3
3
4
4
select c5 from t1 order by c5;
c5
29
30
31
32
41
42
43
44
select c6 from t1 order by c6;
c6
1
1
2
2
3
3
4
4
select c1 from t1 order by c1 desc;
c1
44
43
42
41
32
31
30
29
select c2 from t1 order by c2 desc;
c2
4
4
3
3
2
2
1
1
select c3 from t1 order by c3 desc;
c3
4
4
3
3
2
2
1
1
select c4 from t1 order by c4 desc;
c4
4
4
3
3
2
2
1
1
select c5 from t1 order by c5 desc;
c5
44
43
42
41
32
31
30
29
select c6 from t1 order by c6 desc;
c6
4
4
3
3
2
2
1
1
select max(c1) from t1;
max(c1)
44
select max(c2) from t1;
max(c2)
4
select max(c3) from t1;
max(c3)
4
select max(c4) from t1;
max(c4)
4
select max(c5) from t1;
max(c5)
44
select max(c6) from t1;
max(c6)
4
select min(c1) from t1;
min(c1)
29
select min(c2) from t1;
min(c2)
1
select min(c3) from t1;
min(c3)
1
select min(c4) from t1;
min(c4)
1
select min(c5) from t1;
min(c5)
29
select min(c6) from t1;
min(c6)
1
select count(*) from t1;
count(*)
8
select count(1) from t1;
count(1)
8
select count(c1) from t1;
count(c1)
8
select count(c2) from t1;
count(c2)
8
select count(c3) from t1;
count(c3)
8
select count(c4) from t1;
count(c4)
8
select count(c5) from t1;
count(c5)
8
select count(c6) from t1;
count(c6)
8
######################################################################
select mac_set_def_label('P1', 'L3:C2:G1');
mac_set_def_label('P1', 'L3:C2:G1')
success to set def label
select * from t1;
c1	c2	c3	c4	c5	c6
21	1	1	1	21	1
22	2	2	2	22	2
23	3	3	3	23	3
24	4	4	4	24	4
29	1	1	1	29	1
30	2	2	2	30	2
31	3	3	3	31	3
32	4	4	4	32	4
33	1	1	1	33	1
34	2	2	2	34	2
35	3	3	3	35	3
36	4	4	4	36	4
41	1	1	1	41	1
42	2	2	2	42	2
43	3	3	3	43	3
44	4	4	4	44	4
select c1, c2, c3, c4, c5, c6, _gdb_mac_policy_1 from t1;
c1	c2	c3	c4	c5	c6	_gdb_mac_policy_1
21	1	1	1	21	1	19
22	2	2	2	22	2	19
23	3	3	3	23	3	19
24	4	4	4	24	4	19
29	1	1	1	29	1	23
30	2	2	2	30	2	23
31	3	3	3	31	3	23
32	4	4	4	32	4	23
33	1	1	1	33	1	26
34	2	2	2	34	2	26
35	3	3	3	35	3	26
36	4	4	4	36	4	26
41	1	1	1	41	1	32
42	2	2	2	42	2	32
43	3	3	3	43	3	32
44	4	4	4	44	4	32
select * from t1 where c1 = 1;
c1	c2	c3	c4	c5	c6
select * from t1 where c1 = 5;
c1	c2	c3	c4	c5	c6
select * from t1 where c1 = 9;
c1	c2	c3	c4	c5	c6
select * from t1 where c1 = 13;
c1	c2	c3	c4	c5	c6
select * from t1 where c1 = 17;
c1	c2	c3	c4	c5	c6
select * from t1 where c1 = 21;
c1	c2	c3	c4	c5	c6
21	1	1	1	21	1
select * from t1 where c1 = 25;
c1	c2	c3	c4	c5	c6
select * from t1 where c1 = 29;
c1	c2	c3	c4	c5	c6
29	1	1	1	29	1
select * from t1 where c1 = 33;
c1	c2	c3	c4	c5	c6
33	1	1	1	33	1
select * from t1 where c1 = 37;
c1	c2	c3	c4	c5	c6
select * from t1 where c1 = 40;
c1	c2	c3	c4	c5	c6
select * from t1 where (c1 >= 1 and c1 <= 16) or (c1 > 18 and c1 < 42);
c1	c2	c3	c4	c5	c6
21	1	1	1	21	1
22	2	2	2	22	2
23	3	3	3	23	3
24	4	4	4	24	4
29	1	1	1	29	1
30	2	2	2	30	2
31	3	3	3	31	3
32	4	4	4	32	4
33	1	1	1	33	1
34	2	2	2	34	2
35	3	3	3	35	3
36	4	4	4	36	4
41	1	1	1	41	1
select * from t1 where c1 > 1 and c1 < 14 or c1 = 21 or c1 > 25;
c1	c2	c3	c4	c5	c6
21	1	1	1	21	1
29	1	1	1	29	1
30	2	2	2	30	2
31	3	3	3	31	3
32	4	4	4	32	4
33	1	1	1	33	1
34	2	2	2	34	2
35	3	3	3	35	3
36	4	4	4	36	4
41	1	1	1	41	1
42	2	2	2	42	2
43	3	3	3	43	3
44	4	4	4	44	4
select c1 from t1 where c1 = 1;
c1
select c1 from t1 where c1 = 5;
c1
select c1 from t1 where c1 = 9;
c1
select c1 from t1 where c1 = 13;
c1
select c1 from t1 where c1 = 17;
c1
select c1 from t1 where c1 = 21;
c1
21
select c1 from t1 where c1 = 25;
c1
select c1 from t1 where c1 = 29;
c1
29
select c1 from t1 where c1 = 33;
c1
33
select c1 from t1 where c1 = 37;
c1
select c1 from t1 where c2 = 40;
c1
select c1 from t1 where (c1 >= 1 and c1 <= 16) or (c1 > 18 and c1 < 42);
c1
21
22
23
24
29
30
31
32
33
34
35
36
41
select c1 from t1 where c1 > 1 and c1 < 14 or c1 = 21 or c1 > 25;
c1
21
29
30
31
32
33
34
35
36
41
42
43
44
select * from t1 where c2 = 1;
c1	c2	c3	c4	c5	c6
21	1	1	1	21	1
29	1	1	1	29	1
33	1	1	1	33	1
41	1	1	1	41	1
select * from t1 where c2 = 2;
c1	c2	c3	c4	c5	c6
22	2	2	2	22	2
30	2	2	2	30	2
34	2	2	2	34	2
42	2	2	2	42	2
select * from t1 where c2 = 3;
c1	c2	c3	c4	c5	c6
23	3	3	3	23	3
31	3	3	3	31	3
35	3	3	3	35	3
43	3	3	3	43	3
select * from t1 where c2 = 4;
c1	c2	c3	c4	c5	c6
24	4	4	4	24	4
32	4	4	4	32	4
36	4	4	4	36	4
44	4	4	4	44	4
select * from t1 where c2 = 1 and c3 = 1;
c1	c2	c3	c4	c5	c6
21	1	1	1	21	1
29	1	1	1	29	1
33	1	1	1	33	1
41	1	1	1	41	1
select * from t1 where c2 = 2 and c3 = 2;
c1	c2	c3	c4	c5	c6
22	2	2	2	22	2
30	2	2	2	30	2
34	2	2	2	34	2
42	2	2	2	42	2
select * from t1 where c2 = 3 and c3 = 3;
c1	c2	c3	c4	c5	c6
23	3	3	3	23	3
31	3	3	3	31	3
35	3	3	3	35	3
43	3	3	3	43	3
select * from t1 where c2 = 4 and c4 = 4;
c1	c2	c3	c4	c5	c6
24	4	4	4	24	4
32	4	4	4	32	4
36	4	4	4	36	4
44	4	4	4	44	4
select * from t1 where c2 >= 1 and c2 <= 4;
c1	c2	c3	c4	c5	c6
21	1	1	1	21	1
22	2	2	2	22	2
23	3	3	3	23	3
24	4	4	4	24	4
29	1	1	1	29	1
30	2	2	2	30	2
31	3	3	3	31	3
32	4	4	4	32	4
33	1	1	1	33	1
34	2	2	2	34	2
35	3	3	3	35	3
36	4	4	4	36	4
41	1	1	1	41	1
42	2	2	2	42	2
43	3	3	3	43	3
44	4	4	4	44	4
select * from t1 where c2 >= 1 and c2 < 3 or c2 = 4;
c1	c2	c3	c4	c5	c6
21	1	1	1	21	1
22	2	2	2	22	2
24	4	4	4	24	4
29	1	1	1	29	1
30	2	2	2	30	2
32	4	4	4	32	4
33	1	1	1	33	1
34	2	2	2	34	2
36	4	4	4	36	4
41	1	1	1	41	1
42	2	2	2	42	2
44	4	4	4	44	4
select * from t1 where c3 = 1;
c1	c2	c3	c4	c5	c6
21	1	1	1	21	1
29	1	1	1	29	1
33	1	1	1	33	1
41	1	1	1	41	1
select * from t1 where c3 = 2;
c1	c2	c3	c4	c5	c6
22	2	2	2	22	2
30	2	2	2	30	2
34	2	2	2	34	2
42	2	2	2	42	2
select * from t1 where c3 = 3;
c1	c2	c3	c4	c5	c6
23	3	3	3	23	3
31	3	3	3	31	3
35	3	3	3	35	3
43	3	3	3	43	3
select * from t1 where c3 = 4;
c1	c2	c3	c4	c5	c6
24	4	4	4	24	4
32	4	4	4	32	4
36	4	4	4	36	4
44	4	4	4	44	4
select * from t1 where c3 >= 1 and c3 <= 4;
c1	c2	c3	c4	c5	c6
21	1	1	1	21	1
22	2	2	2	22	2
23	3	3	3	23	3
24	4	4	4	24	4
29	1	1	1	29	1
30	2	2	2	30	2
31	3	3	3	31	3
32	4	4	4	32	4
33	1	1	1	33	1
34	2	2	2	34	2
35	3	3	3	35	3
36	4	4	4	36	4
41	1	1	1	41	1
42	2	2	2	42	2
43	3	3	3	43	3
44	4	4	4	44	4
select * from t1 where c4 = 1;
c1	c2	c3	c4	c5	c6
21	1	1	1	21	1
29	1	1	1	29	1
33	1	1	1	33	1
41	1	1	1	41	1
select * from t1 where c4 = 2;
c1	c2	c3	c4	c5	c6
22	2	2	2	22	2
30	2	2	2	30	2
34	2	2	2	34	2
42	2	2	2	42	2
select * from t1 where c4 = 3;
c1	c2	c3	c4	c5	c6
23	3	3	3	23	3
31	3	3	3	31	3
35	3	3	3	35	3
43	3	3	3	43	3
select * from t1 where c4 = 4;
c1	c2	c3	c4	c5	c6
24	4	4	4	24	4
32	4	4	4	32	4
36	4	4	4	36	4
44	4	4	4	44	4
select * from t1 where c4 >= 1 and c4 < 3 or c4 = 4;
c1	c2	c3	c4	c5	c6
21	1	1	1	21	1
22	2	2	2	22	2
24	4	4	4	24	4
29	1	1	1	29	1
30	2	2	2	30	2
32	4	4	4	32	4
33	1	1	1	33	1
34	2	2	2	34	2
36	4	4	4	36	4
41	1	1	1	41	1
42	2	2	2	42	2
44	4	4	4	44	4
select * from t1 where c5 = 1;
c1	c2	c3	c4	c5	c6
select * from t1 where c5 = 5;
c1	c2	c3	c4	c5	c6
select * from t1 where c5 = 9;
c1	c2	c3	c4	c5	c6
select * from t1 where c5 = 13;
c1	c2	c3	c4	c5	c6
select * from t1 where c5 = 17;
c1	c2	c3	c4	c5	c6
select * from t1 where c5 = 21;
c1	c2	c3	c4	c5	c6
21	1	1	1	21	1
select * from t1 where c5 = 25;
c1	c2	c3	c4	c5	c6
select * from t1 where c5 = 29;
c1	c2	c3	c4	c5	c6
29	1	1	1	29	1
select * from t1 where c5 = 33;
c1	c2	c3	c4	c5	c6
33	1	1	1	33	1
select * from t1 where c5 = 37;
c1	c2	c3	c4	c5	c6
select * from t1 where c5 = 40;
c1	c2	c3	c4	c5	c6
select * from t1 where (c5 >= 1 and c5 <= 16) or (c5 > 18 and c5 < 40);
c1	c2	c3	c4	c5	c6
21	1	1	1	21	1
22	2	2	2	22	2
23	3	3	3	23	3
24	4	4	4	24	4
29	1	1	1	29	1
30	2	2	2	30	2
31	3	3	3	31	3
32	4	4	4	32	4
33	1	1	1	33	1
34	2	2	2	34	2
35	3	3	3	35	3
36	4	4	4	36	4
select * from t1 where c5 > 1 and c5 < 14 or c5 = 21 or c5 > 25;
c1	c2	c3	c4	c5	c6
21	1	1	1	21	1
29	1	1	1	29	1
30	2	2	2	30	2
31	3	3	3	31	3
32	4	4	4	32	4
33	1	1	1	33	1
34	2	2	2	34	2
35	3	3	3	35	3
36	4	4	4	36	4
41	1	1	1	41	1
42	2	2	2	42	2
43	3	3	3	43	3
44	4	4	4	44	4
select * from t1 where c6 = 1;
c1	c2	c3	c4	c5	c6
21	1	1	1	21	1
29	1	1	1	29	1
33	1	1	1	33	1
41	1	1	1	41	1
select * from t1 where c6 = 2;
c1	c2	c3	c4	c5	c6
22	2	2	2	22	2
30	2	2	2	30	2
34	2	2	2	34	2
42	2	2	2	42	2
select * from t1 where c6 = 3;
c1	c2	c3	c4	c5	c6
23	3	3	3	23	3
31	3	3	3	31	3
35	3	3	3	35	3
43	3	3	3	43	3
select * from t1 where c6 = 4;
c1	c2	c3	c4	c5	c6
24	4	4	4	24	4
32	4	4	4	32	4
36	4	4	4	36	4
44	4	4	4	44	4
select c1 from t1 order by c1;
c1
21
22
23
24
29
30
31
32
33
34
35
36
41
42
43
44
select c2 from t1 order by c2;
c2
1
1
1
1
2
2
2
2
3
3
3
3
4
4
4
4
select c3 from t1 order by c3;
c3
1
1
1
1
2
2
2
2
3
3
3
3
4
4
4
4
select c4 from t1 order by c4;
c4
1
1
1
1
2
2
2
2
3
3
3
3
4
4
4
4
select c5 from t1 order by c5;
c5
21
22
23
24
29
30
31
32
33
34
35
36
41
42
43
44
select c6 from t1 order by c6;
c6
1
1
1
1
2
2
2
2
3
3
3
3
4
4
4
4
select c1 from t1 order by c1 desc;
c1
44
43
42
41
36
35
34
33
32
31
30
29
24
23
22
21
select c2 from t1 order by c2 desc;
c2
4
4
4
4
3
3
3
3
2
2
2
2
1
1
1
1
select c3 from t1 order by c3 desc;
c3
4
4
4
4
3
3
3
3
2
2
2
2
1
1
1
1
select c4 from t1 order by c4 desc;
c4
4
4
4
4
3
3
3
3
2
2
2
2
1
1
1
1
select c5 from t1 order by c5 desc;
c5
44
43
42
41
36
35
34
33
32
31
30
29
24
23
22
21
select c6 from t1 order by c6 desc;
c6
4
4
4
4
3
3
3
3
2
2
2
2
1
1
1
1
select max(c1) from t1;
max(c1)
44
select max(c2) from t1;
max(c2)
4
select max(c3) from t1;
max(c3)
4
select max(c4) from t1;
max(c4)
4
select max(c5) from t1;
max(c5)
44
select max(c6) from t1;
max(c6)
4
select min(c1) from t1;
min(c1)
21
select min(c2) from t1;
min(c2)
1
select min(c3) from t1;
min(c3)
1
select min(c4) from t1;
min(c4)
1
select min(c5) from t1;
min(c5)
21
select min(c6) from t1;
min(c6)
1
select count(*) from t1;
count(*)
16
select count(1) from t1;
count(1)
16
select count(c1) from t1;
count(c1)
16
select count(c2) from t1;
count(c2)
16
select count(c3) from t1;
count(c3)
16
select count(c4) from t1;
count(c4)
16
select count(c5) from t1;
count(c5)
16
select count(c6) from t1;
count(c6)
16
######################################################################
select mac_set_def_label('P1', 'L3:C3:G1');
mac_set_def_label('P1', 'L3:C3:G1')
success to set def label
select * from t1;
c1	c2	c3	c4	c5	c6
10	2	2	2	10	2
11	3	3	3	11	3
12	4	4	4	12	4
25	1	1	1	25	1
26	2	2	2	26	2
27	3	3	3	27	3
28	4	4	4	28	4
29	1	1	1	29	1
30	2	2	2	30	2
31	3	3	3	31	3
32	4	4	4	32	4
41	1	1	1	41	1
42	2	2	2	42	2
43	3	3	3	43	3
44	4	4	4	44	4
5	1	1	1	5	1
6	2	2	2	6	2
7	3	3	3	7	3
8	4	4	4	8	4
9	1	1	1	9	1
select c1, c2, c3, c4, c5, c6, _gdb_mac_policy_1 from t1;
c1	c2	c3	c4	c5	c6	_gdb_mac_policy_1
10	2	2	2	10	2	10
11	3	3	3	11	3	10
12	4	4	4	12	4	10
25	1	1	1	25	1	21
26	2	2	2	26	2	21
27	3	3	3	27	3	21
28	4	4	4	28	4	21
29	1	1	1	29	1	23
30	2	2	2	30	2	23
31	3	3	3	31	3	23
32	4	4	4	32	4	23
41	1	1	1	41	1	32
42	2	2	2	42	2	32
43	3	3	3	43	3	32
44	4	4	4	44	4	32
5	1	1	1	5	1	1
6	2	2	2	6	2	1
7	3	3	3	7	3	1
8	4	4	4	8	4	1
9	1	1	1	9	1	10
select * from t1 where c1 = 1;
c1	c2	c3	c4	c5	c6
select * from t1 where c1 = 5;
c1	c2	c3	c4	c5	c6
5	1	1	1	5	1
select * from t1 where c1 = 9;
c1	c2	c3	c4	c5	c6
9	1	1	1	9	1
select * from t1 where c1 = 13;
c1	c2	c3	c4	c5	c6
select * from t1 where c1 = 17;
c1	c2	c3	c4	c5	c6
select * from t1 where c1 = 21;
c1	c2	c3	c4	c5	c6
select * from t1 where c1 = 25;
c1	c2	c3	c4	c5	c6
25	1	1	1	25	1
select * from t1 where c1 = 29;
c1	c2	c3	c4	c5	c6
29	1	1	1	29	1
select * from t1 where c1 = 33;
c1	c2	c3	c4	c5	c6
select * from t1 where c1 = 37;
c1	c2	c3	c4	c5	c6
select * from t1 where c1 = 40;
c1	c2	c3	c4	c5	c6
select * from t1 where (c1 >= 1 and c1 <= 16) or (c1 > 18 and c1 < 42);
c1	c2	c3	c4	c5	c6
10	2	2	2	10	2
11	3	3	3	11	3
12	4	4	4	12	4
25	1	1	1	25	1
26	2	2	2	26	2
27	3	3	3	27	3
28	4	4	4	28	4
29	1	1	1	29	1
30	2	2	2	30	2
31	3	3	3	31	3
32	4	4	4	32	4
41	1	1	1	41	1
5	1	1	1	5	1
6	2	2	2	6	2
7	3	3	3	7	3
8	4	4	4	8	4
9	1	1	1	9	1
select * from t1 where c1 > 1 and c1 < 14 or c1 = 21 or c1 > 25;
c1	c2	c3	c4	c5	c6
10	2	2	2	10	2
11	3	3	3	11	3
12	4	4	4	12	4
26	2	2	2	26	2
27	3	3	3	27	3
28	4	4	4	28	4
29	1	1	1	29	1
30	2	2	2	30	2
31	3	3	3	31	3
32	4	4	4	32	4
41	1	1	1	41	1
42	2	2	2	42	2
43	3	3	3	43	3
44	4	4	4	44	4
5	1	1	1	5	1
6	2	2	2	6	2
7	3	3	3	7	3
8	4	4	4	8	4
9	1	1	1	9	1
select c1 from t1 where c1 = 1;
c1
select c1 from t1 where c1 = 5;
c1
5
select c1 from t1 where c1 = 9;
c1
9
select c1 from t1 where c1 = 13;
c1
select c1 from t1 where c1 = 17;
c1
select c1 from t1 where c1 = 21;
c1
select c1 from t1 where c1 = 25;
c1
25
select c1 from t1 where c1 = 29;
c1
29
select c1 from t1 where c1 = 33;
c1
select c1 from t1 where c1 = 37;
c1
select c1 from t1 where c2 = 40;
c1
select c1 from t1 where (c1 >= 1 and c1 <= 16) or (c1 > 18 and c1 < 42);
c1
10
11
12
25
26
27
28
29
30
31
32
41
5
6
7
8
9
select c1 from t1 where c1 > 1 and c1 < 14 or c1 = 21 or c1 > 25;
c1
10
11
12
26
27
28
29
30
31
32
41
42
43
44
5
6
7
8
9
select * from t1 where c2 = 1;
c1	c2	c3	c4	c5	c6
5	1	1	1	5	1
9	1	1	1	9	1
25	1	1	1	25	1
29	1	1	1	29	1
41	1	1	1	41	1
select * from t1 where c2 = 2;
c1	c2	c3	c4	c5	c6
10	2	2	2	10	2
26	2	2	2	26	2
30	2	2	2	30	2
42	2	2	2	42	2
6	2	2	2	6	2
select * from t1 where c2 = 3;
c1	c2	c3	c4	c5	c6
11	3	3	3	11	3
27	3	3	3	27	3
31	3	3	3	31	3
43	3	3	3	43	3
7	3	3	3	7	3
select * from t1 where c2 = 4;
c1	c2	c3	c4	c5	c6
12	4	4	4	12	4
28	4	4	4	28	4
32	4	4	4	32	4
44	4	4	4	44	4
8	4	4	4	8	4
select * from t1 where c2 = 1 and c3 = 1;
c1	c2	c3	c4	c5	c6
25	1	1	1	25	1
29	1	1	1	29	1
41	1	1	1	41	1
5	1	1	1	5	1
9	1	1	1	9	1
select * from t1 where c2 = 2 and c3 = 2;
c1	c2	c3	c4	c5	c6
10	2	2	2	10	2
26	2	2	2	26	2
30	2	2	2	30	2
42	2	2	2	42	2
6	2	2	2	6	2
select * from t1 where c2 = 3 and c3 = 3;
c1	c2	c3	c4	c5	c6
11	3	3	3	11	3
27	3	3	3	27	3
31	3	3	3	31	3
43	3	3	3	43	3
7	3	3	3	7	3
select * from t1 where c2 = 4 and c4 = 4;
c1	c2	c3	c4	c5	c6
12	4	4	4	12	4
28	4	4	4	28	4
32	4	4	4	32	4
44	4	4	4	44	4
8	4	4	4	8	4
select * from t1 where c2 >= 1 and c2 <= 4;
c1	c2	c3	c4	c5	c6
10	2	2	2	10	2
11	3	3	3	11	3
12	4	4	4	12	4
25	1	1	1	25	1
26	2	2	2	26	2
27	3	3	3	27	3
28	4	4	4	28	4
29	1	1	1	29	1
30	2	2	2	30	2
31	3	3	3	31	3
32	4	4	4	32	4
41	1	1	1	41	1
42	2	2	2	42	2
43	3	3	3	43	3
44	4	4	4	44	4
5	1	1	1	5	1
6	2	2	2	6	2
7	3	3	3	7	3
8	4	4	4	8	4
9	1	1	1	9	1
select * from t1 where c2 >= 1 and c2 < 3 or c2 = 4;
c1	c2	c3	c4	c5	c6
10	2	2	2	10	2
12	4	4	4	12	4
25	1	1	1	25	1
26	2	2	2	26	2
28	4	4	4	28	4
29	1	1	1	29	1
30	2	2	2	30	2
32	4	4	4	32	4
41	1	1	1	41	1
42	2	2	2	42	2
44	4	4	4	44	4
5	1	1	1	5	1
6	2	2	2	6	2
8	4	4	4	8	4
9	1	1	1	9	1
select * from t1 where c3 = 1;
c1	c2	c3	c4	c5	c6
25	1	1	1	25	1
29	1	1	1	29	1
41	1	1	1	41	1
5	1	1	1	5	1
9	1	1	1	9	1
select * from t1 where c3 = 2;
c1	c2	c3	c4	c5	c6
10	2	2	2	10	2
26	2	2	2	26	2
30	2	2	2	30	2
42	2	2	2	42	2
6	2	2	2	6	2
select * from t1 where c3 = 3;
c1	c2	c3	c4	c5	c6
11	3	3	3	11	3
27	3	3	3	27	3
31	3	3	3	31	3
43	3	3	3	43	3
7	3	3	3	7	3
select * from t1 where c3 = 4;
c1	c2	c3	c4	c5	c6
12	4	4	4	12	4
28	4	4	4	28	4
32	4	4	4	32	4
44	4	4	4	44	4
8	4	4	4	8	4
select * from t1 where c3 >= 1 and c3 <= 4;
c1	c2	c3	c4	c5	c6
10	2	2	2	10	2
11	3	3	3	11	3
12	4	4	4	12	4
25	1	1	1	25	1
26	2	2	2	26	2
27	3	3	3	27	3
28	4	4	4	28	4
29	1	1	1	29	1
30	2	2	2	30	2
31	3	3	3	31	3
32	4	4	4	32	4
41	1	1	1	41	1
42	2	2	2	42	2
43	3	3	3	43	3
44	4	4	4	44	4
5	1	1	1	5	1
6	2	2	2	6	2
7	3	3	3	7	3
8	4	4	4	8	4
9	1	1	1	9	1
select * from t1 where c4 = 1;
c1	c2	c3	c4	c5	c6
25	1	1	1	25	1
29	1	1	1	29	1
41	1	1	1	41	1
5	1	1	1	5	1
9	1	1	1	9	1
select * from t1 where c4 = 2;
c1	c2	c3	c4	c5	c6
10	2	2	2	10	2
26	2	2	2	26	2
30	2	2	2	30	2
42	2	2	2	42	2
6	2	2	2	6	2
select * from t1 where c4 = 3;
c1	c2	c3	c4	c5	c6
11	3	3	3	11	3
27	3	3	3	27	3
31	3	3	3	31	3
43	3	3	3	43	3
7	3	3	3	7	3
select * from t1 where c4 = 4;
c1	c2	c3	c4	c5	c6
12	4	4	4	12	4
28	4	4	4	28	4
32	4	4	4	32	4
44	4	4	4	44	4
8	4	4	4	8	4
select * from t1 where c4 >= 1 and c4 < 3 or c4 = 4;
c1	c2	c3	c4	c5	c6
10	2	2	2	10	2
12	4	4	4	12	4
25	1	1	1	25	1
26	2	2	2	26	2
28	4	4	4	28	4
29	1	1	1	29	1
30	2	2	2	30	2
32	4	4	4	32	4
41	1	1	1	41	1
42	2	2	2	42	2
44	4	4	4	44	4
5	1	1	1	5	1
6	2	2	2	6	2
8	4	4	4	8	4
9	1	1	1	9	1
select * from t1 where c5 = 1;
c1	c2	c3	c4	c5	c6
select * from t1 where c5 = 5;
c1	c2	c3	c4	c5	c6
5	1	1	1	5	1
select * from t1 where c5 = 9;
c1	c2	c3	c4	c5	c6
9	1	1	1	9	1
select * from t1 where c5 = 13;
c1	c2	c3	c4	c5	c6
select * from t1 where c5 = 17;
c1	c2	c3	c4	c5	c6
select * from t1 where c5 = 21;
c1	c2	c3	c4	c5	c6
select * from t1 where c5 = 25;
c1	c2	c3	c4	c5	c6
25	1	1	1	25	1
select * from t1 where c5 = 29;
c1	c2	c3	c4	c5	c6
29	1	1	1	29	1
select * from t1 where c5 = 33;
c1	c2	c3	c4	c5	c6
select * from t1 where c5 = 37;
c1	c2	c3	c4	c5	c6
select * from t1 where c5 = 40;
c1	c2	c3	c4	c5	c6
select * from t1 where (c5 >= 1 and c5 <= 16) or (c5 > 18 and c5 < 40);
c1	c2	c3	c4	c5	c6
10	2	2	2	10	2
11	3	3	3	11	3
12	4	4	4	12	4
25	1	1	1	25	1
26	2	2	2	26	2
27	3	3	3	27	3
28	4	4	4	28	4
29	1	1	1	29	1
30	2	2	2	30	2
31	3	3	3	31	3
32	4	4	4	32	4
5	1	1	1	5	1
6	2	2	2	6	2
7	3	3	3	7	3
8	4	4	4	8	4
9	1	1	1	9	1
select * from t1 where c5 > 1 and c5 < 14 or c5 = 21 or c5 > 25;
c1	c2	c3	c4	c5	c6
10	2	2	2	10	2
11	3	3	3	11	3
12	4	4	4	12	4
26	2	2	2	26	2
27	3	3	3	27	3
28	4	4	4	28	4
29	1	1	1	29	1
30	2	2	2	30	2
31	3	3	3	31	3
32	4	4	4	32	4
41	1	1	1	41	1
42	2	2	2	42	2
43	3	3	3	43	3
44	4	4	4	44	4
5	1	1	1	5	1
6	2	2	2	6	2
7	3	3	3	7	3
8	4	4	4	8	4
9	1	1	1	9	1
select * from t1 where c6 = 1;
c1	c2	c3	c4	c5	c6
25	1	1	1	25	1
29	1	1	1	29	1
41	1	1	1	41	1
5	1	1	1	5	1
9	1	1	1	9	1
select * from t1 where c6 = 2;
c1	c2	c3	c4	c5	c6
10	2	2	2	10	2
26	2	2	2	26	2
30	2	2	2	30	2
42	2	2	2	42	2
6	2	2	2	6	2
select * from t1 where c6 = 3;
c1	c2	c3	c4	c5	c6
11	3	3	3	11	3
27	3	3	3	27	3
31	3	3	3	31	3
43	3	3	3	43	3
7	3	3	3	7	3
select * from t1 where c6 = 4;
c1	c2	c3	c4	c5	c6
12	4	4	4	12	4
28	4	4	4	28	4
32	4	4	4	32	4
44	4	4	4	44	4
8	4	4	4	8	4
select c1 from t1 order by c1;
c1
5
6
7
8
9
10
11
12
25
26
27
28
29
30
31
32
41
42
43
44
select c2 from t1 order by c2;
c2
1
1
1
1
1
2
2
2
2
2
3
3
3
3
3
4
4
4
4
4
select c3 from t1 order by c3;
c3
1
1
1
1
1
2
2
2
2
2
3
3
3
3
3
4
4
4
4
4
select c4 from t1 order by c4;
c4
1
1
1
1
1
2
2
2
2
2
3
3
3
3
3
4
4
4
4
4
select c5 from t1 order by c5;
c5
5
6
7
8
9
10
11
12
25
26
27
28
29
30
31
32
41
42
43
44
select c6 from t1 order by c6;
c6
1
1
1
1
1
2
2
2
2
2
3
3
3
3
3
4
4
4
4
4
select c1 from t1 order by c1 desc;
c1
44
43
42
41
32
31
30
29
28
27
26
25
12
11
10
9
8
7
6
5
select c2 from t1 order by c2 desc;
c2
4
4
4
4
4
3
3
3
3
3
2
2
2
2
2
1
1
1
1
1
select c3 from t1 order by c3 desc;
c3
4
4
4
4
4
3
3
3
3
3
2
2
2
2
2
1
1
1
1
1
select c4 from t1 order by c4 desc;
c4
4
4
4
4
4
3
3
3
3
3
2
2
2
2
2
1
1
1
1
1
select c5 from t1 order by c5 desc;
c5
44
43
42
41
32
31
30
29
28
27
26
25
12
11
10
9
8
7
6
5
select c6 from t1 order by c6 desc;
c6
4
4
4
4
4
3
3
3
3
3
2
2
2
2
2
1
1
1
1
1
select max(c1) from t1;
max(c1)
44
select max(c2) from t1;
max(c2)
4
select max(c3) from t1;
max(c3)
4
select max(c4) from t1;
max(c4)
4
select max(c5) from t1;
max(c5)
44
select max(c6) from t1;
max(c6)
4
select min(c1) from t1;
min(c1)
5
select min(c2) from t1;
min(c2)
1
select min(c3) from t1;
min(c3)
1
select min(c4) from t1;
min(c4)
1
select min(c5) from t1;
min(c5)
5
select min(c6) from t1;
min(c6)
1
select count(*) from t1;
count(*)
20
select count(1) from t1;
count(1)
20
select count(c1) from t1;
count(c1)
20
select count(c2) from t1;
count(c2)
20
select count(c3) from t1;
count(c3)
20
select count(c4) from t1;
count(c4)
20
select count(c5) from t1;
count(c5)
20
select count(c6) from t1;
count(c6)
20
######################################################################
select mac_set_def_label('P1', 'L3:C4:G1');
mac_set_def_label('P1', 'L3:C4:G1')
success to set def label
select * from t1;
c1	c2	c3	c4	c5	c6
29	1	1	1	29	1
30	2	2	2	30	2
31	3	3	3	31	3
32	4	4	4	32	4
41	1	1	1	41	1
42	2	2	2	42	2
43	3	3	3	43	3
44	4	4	4	44	4
select c1, c2, c3, c4, c5, c6, _gdb_mac_policy_1 from t1;
c1	c2	c3	c4	c5	c6	_gdb_mac_policy_1
29	1	1	1	29	1	23
30	2	2	2	30	2	23
31	3	3	3	31	3	23
32	4	4	4	32	4	23
41	1	1	1	41	1	32
42	2	2	2	42	2	32
43	3	3	3	43	3	32
44	4	4	4	44	4	32
select * from t1 where c1 = 1;
c1	c2	c3	c4	c5	c6
select * from t1 where c1 = 5;
c1	c2	c3	c4	c5	c6
select * from t1 where c1 = 9;
c1	c2	c3	c4	c5	c6
select * from t1 where c1 = 13;
c1	c2	c3	c4	c5	c6
select * from t1 where c1 = 17;
c1	c2	c3	c4	c5	c6
select * from t1 where c1 = 21;
c1	c2	c3	c4	c5	c6
select * from t1 where c1 = 25;
c1	c2	c3	c4	c5	c6
select * from t1 where c1 = 29;
c1	c2	c3	c4	c5	c6
29	1	1	1	29	1
select * from t1 where c1 = 33;
c1	c2	c3	c4	c5	c6
select * from t1 where c1 = 37;
c1	c2	c3	c4	c5	c6
select * from t1 where c1 = 40;
c1	c2	c3	c4	c5	c6
select * from t1 where (c1 >= 1 and c1 <= 16) or (c1 > 18 and c1 < 42);
c1	c2	c3	c4	c5	c6
29	1	1	1	29	1
30	2	2	2	30	2
31	3	3	3	31	3
32	4	4	4	32	4
41	1	1	1	41	1
select * from t1 where c1 > 1 and c1 < 14 or c1 = 21 or c1 > 25;
c1	c2	c3	c4	c5	c6
29	1	1	1	29	1
30	2	2	2	30	2
31	3	3	3	31	3
32	4	4	4	32	4
41	1	1	1	41	1
42	2	2	2	42	2
43	3	3	3	43	3
44	4	4	4	44	4
select c1 from t1 where c1 = 1;
c1
select c1 from t1 where c1 = 5;
c1
select c1 from t1 where c1 = 9;
c1
select c1 from t1 where c1 = 13;
c1
select c1 from t1 where c1 = 17;
c1
select c1 from t1 where c1 = 21;
c1
select c1 from t1 where c1 = 25;
c1
select c1 from t1 where c1 = 29;
c1
29
select c1 from t1 where c1 = 33;
c1
select c1 from t1 where c1 = 37;
c1
select c1 from t1 where c2 = 40;
c1
select c1 from t1 where (c1 >= 1 and c1 <= 16) or (c1 > 18 and c1 < 42);
c1
29
30
31
32
41
select c1 from t1 where c1 > 1 and c1 < 14 or c1 = 21 or c1 > 25;
c1
29
30
31
32
41
42
43
44
select * from t1 where c2 = 1;
c1	c2	c3	c4	c5	c6
29	1	1	1	29	1
41	1	1	1	41	1
select * from t1 where c2 = 2;
c1	c2	c3	c4	c5	c6
30	2	2	2	30	2
42	2	2	2	42	2
select * from t1 where c2 = 3;
c1	c2	c3	c4	c5	c6
31	3	3	3	31	3
43	3	3	3	43	3
select * from t1 where c2 = 4;
c1	c2	c3	c4	c5	c6
32	4	4	4	32	4
44	4	4	4	44	4
select * from t1 where c2 = 1 and c3 = 1;
c1	c2	c3	c4	c5	c6
29	1	1	1	29	1
41	1	1	1	41	1
select * from t1 where c2 = 2 and c3 = 2;
c1	c2	c3	c4	c5	c6
30	2	2	2	30	2
42	2	2	2	42	2
select * from t1 where c2 = 3 and c3 = 3;
c1	c2	c3	c4	c5	c6
31	3	3	3	31	3
43	3	3	3	43	3
select * from t1 where c2 = 4 and c4 = 4;
c1	c2	c3	c4	c5	c6
32	4	4	4	32	4
44	4	4	4	44	4
select * from t1 where c2 >= 1 and c2 <= 4;
c1	c2	c3	c4	c5	c6
29	1	1	1	29	1
30	2	2	2	30	2
31	3	3	3	31	3
32	4	4	4	32	4
41	1	1	1	41	1
42	2	2	2	42	2
43	3	3	3	43	3
44	4	4	4	44	4
select * from t1 where c2 >= 1 and c2 < 3 or c2 = 4;
c1	c2	c3	c4	c5	c6
29	1	1	1	29	1
30	2	2	2	30	2
32	4	4	4	32	4
41	1	1	1	41	1
42	2	2	2	42	2
44	4	4	4	44	4
select * from t1 where c3 = 1;
c1	c2	c3	c4	c5	c6
29	1	1	1	29	1
41	1	1	1	41	1
select * from t1 where c3 = 2;
c1	c2	c3	c4	c5	c6
30	2	2	2	30	2
42	2	2	2	42	2
select * from t1 where c3 = 3;
c1	c2	c3	c4	c5	c6
31	3	3	3	31	3
43	3	3	3	43	3
select * from t1 where c3 = 4;
c1	c2	c3	c4	c5	c6
32	4	4	4	32	4
44	4	4	4	44	4
select * from t1 where c3 >= 1 and c3 <= 4;
c1	c2	c3	c4	c5	c6
29	1	1	1	29	1
30	2	2	2	30	2
31	3	3	3	31	3
32	4	4	4	32	4
41	1	1	1	41	1
42	2	2	2	42	2
43	3	3	3	43	3
44	4	4	4	44	4
select * from t1 where c4 = 1;
c1	c2	c3	c4	c5	c6
29	1	1	1	29	1
41	1	1	1	41	1
select * from t1 where c4 = 2;
c1	c2	c3	c4	c5	c6
30	2	2	2	30	2
42	2	2	2	42	2
select * from t1 where c4 = 3;
c1	c2	c3	c4	c5	c6
31	3	3	3	31	3
43	3	3	3	43	3
select * from t1 where c4 = 4;
c1	c2	c3	c4	c5	c6
32	4	4	4	32	4
44	4	4	4	44	4
select * from t1 where c4 >= 1 and c4 < 3 or c4 = 4;
c1	c2	c3	c4	c5	c6
29	1	1	1	29	1
30	2	2	2	30	2
32	4	4	4	32	4
41	1	1	1	41	1
42	2	2	2	42	2
44	4	4	4	44	4
select * from t1 where c5 = 1;
c1	c2	c3	c4	c5	c6
select * from t1 where c5 = 5;
c1	c2	c3	c4	c5	c6
select * from t1 where c5 = 9;
c1	c2	c3	c4	c5	c6
select * from t1 where c5 = 13;
c1	c2	c3	c4	c5	c6
select * from t1 where c5 = 17;
c1	c2	c3	c4	c5	c6
select * from t1 where c5 = 21;
c1	c2	c3	c4	c5	c6
select * from t1 where c5 = 25;
c1	c2	c3	c4	c5	c6
select * from t1 where c5 = 29;
c1	c2	c3	c4	c5	c6
29	1	1	1	29	1
select * from t1 where c5 = 33;
c1	c2	c3	c4	c5	c6
select * from t1 where c5 = 37;
c1	c2	c3	c4	c5	c6
select * from t1 where c5 = 40;
c1	c2	c3	c4	c5	c6
select * from t1 where (c5 >= 1 and c5 <= 16) or (c5 > 18 and c5 < 40);
c1	c2	c3	c4	c5	c6
29	1	1	1	29	1
30	2	2	2	30	2
31	3	3	3	31	3
32	4	4	4	32	4
select * from t1 where c5 > 1 and c5 < 14 or c5 = 21 or c5 > 25;
c1	c2	c3	c4	c5	c6
29	1	1	1	29	1
30	2	2	2	30	2
31	3	3	3	31	3
32	4	4	4	32	4
41	1	1	1	41	1
42	2	2	2	42	2
43	3	3	3	43	3
44	4	4	4	44	4
select * from t1 where c6 = 1;
c1	c2	c3	c4	c5	c6
29	1	1	1	29	1
41	1	1	1	41	1
select * from t1 where c6 = 2;
c1	c2	c3	c4	c5	c6
30	2	2	2	30	2
42	2	2	2	42	2
select * from t1 where c6 = 3;
c1	c2	c3	c4	c5	c6
31	3	3	3	31	3
43	3	3	3	43	3
select * from t1 where c6 = 4;
c1	c2	c3	c4	c5	c6
32	4	4	4	32	4
44	4	4	4	44	4
select c1 from t1 order by c1;
c1
29
30
31
32
41
42
43
44
select c2 from t1 order by c2;
c2
1
1
2
2
3
3
4
4
select c3 from t1 order by c3;
c3
1
1
2
2
3
3
4
4
select c4 from t1 order by c4;
c4
1
1
2
2
3
3
4
4
select c5 from t1 order by c5;
c5
29
30
31
32
41
42
43
44
select c6 from t1 order by c6;
c6
1
1
2
2
3
3
4
4
select c1 from t1 order by c1 desc;
c1
44
43
42
41
32
31
30
29
select c2 from t1 order by c2 desc;
c2
4
4
3
3
2
2
1
1
select c3 from t1 order by c3 desc;
c3
4
4
3
3
2
2
1
1
select c4 from t1 order by c4 desc;
c4
4
4
3
3
2
2
1
1
select c5 from t1 order by c5 desc;
c5
44
43
42
41
32
31
30
29
select c6 from t1 order by c6 desc;
c6
4
4
3
3
2
2
1
1
select max(c1) from t1;
max(c1)
44
select max(c2) from t1;
max(c2)
4
select max(c3) from t1;
max(c3)
4
select max(c4) from t1;
max(c4)
4
select max(c5) from t1;
max(c5)
44
select max(c6) from t1;
max(c6)
4
select min(c1) from t1;
min(c1)
29
select min(c2) from t1;
min(c2)
1
select min(c3) from t1;
min(c3)
1
select min(c4) from t1;
min(c4)
1
select min(c5) from t1;
min(c5)
29
select min(c6) from t1;
min(c6)
1
select count(*) from t1;
count(*)
8
select count(1) from t1;
count(1)
8
select count(c1) from t1;
count(c1)
8
select count(c2) from t1;
count(c2)
8
select count(c3) from t1;
count(c3)
8
select count(c4) from t1;
count(c4)
8
select count(c5) from t1;
count(c5)
8
select count(c6) from t1;
count(c6)
8
######################################################################
select mac_set_def_label('P1', 'L3:C2,C3:G1');
mac_set_def_label('P1', 'L3:C2,C3:G1')
success to set def label
select * from t1;
c1	c2	c3	c4	c5	c6
10	2	2	2	10	2
11	3	3	3	11	3
12	4	4	4	12	4
17	1	1	1	17	1
18	2	2	2	18	2
19	3	3	3	19	3
20	4	4	4	20	4
21	1	1	1	21	1
22	2	2	2	22	2
23	3	3	3	23	3
24	4	4	4	24	4
25	1	1	1	25	1
26	2	2	2	26	2
27	3	3	3	27	3
28	4	4	4	28	4
29	1	1	1	29	1
30	2	2	2	30	2
31	3	3	3	31	3
32	4	4	4	32	4
33	1	1	1	33	1
34	2	2	2	34	2
35	3	3	3	35	3
36	4	4	4	36	4
37	1	1	1	37	1
38	2	2	2	38	2
39	3	3	3	39	3
40	4	4	4	40	4
41	1	1	1	41	1
42	2	2	2	42	2
43	3	3	3	43	3
44	4	4	4	44	4
5	1	1	1	5	1
6	2	2	2	6	2
7	3	3	3	7	3
8	4	4	4	8	4
9	1	1	1	9	1
select c1, c2, c3, c4, c5, c6, _gdb_mac_policy_1 from t1;
c1	c2	c3	c4	c5	c6	_gdb_mac_policy_1
10	2	2	2	10	2	10
11	3	3	3	11	3	10
12	4	4	4	12	4	10
17	1	1	1	17	1	17
18	2	2	2	18	2	17
19	3	3	3	19	3	17
20	4	4	4	20	4	17
21	1	1	1	21	1	19
22	2	2	2	22	2	19
23	3	3	3	23	3	19
24	4	4	4	24	4	19
25	1	1	1	25	1	21
26	2	2	2	26	2	21
27	3	3	3	27	3	21
28	4	4	4	28	4	21
29	1	1	1	29	1	23
30	2	2	2	30	2	23
31	3	3	3	31	3	23
32	4	4	4	32	4	23
33	1	1	1	33	1	26
34	2	2	2	34	2	26
35	3	3	3	35	3	26
36	4	4	4	36	4	26
37	1	1	1	37	1	30
38	2	2	2	38	2	30
39	3	3	3	39	3	30
40	4	4	4	40	4	30
41	1	1	1	41	1	32
42	2	2	2	42	2	32
43	3	3	3	43	3	32
44	4	4	4	44	4	32
5	1	1	1	5	1	1
6	2	2	2	6	2	1
7	3	3	3	7	3	1
8	4	4	4	8	4	1
9	1	1	1	9	1	10
select * from t1 where c1 = 1;
c1	c2	c3	c4	c5	c6
select * from t1 where c1 = 5;
c1	c2	c3	c4	c5	c6
5	1	1	1	5	1
select * from t1 where c1 = 9;
c1	c2	c3	c4	c5	c6
9	1	1	1	9	1
select * from t1 where c1 = 13;
c1	c2	c3	c4	c5	c6
select * from t1 where c1 = 17;
c1	c2	c3	c4	c5	c6
17	1	1	1	17	1
select * from t1 where c1 = 21;
c1	c2	c3	c4	c5	c6
21	1	1	1	21	1
select * from t1 where c1 = 25;
c1	c2	c3	c4	c5	c6
25	1	1	1	25	1
select * from t1 where c1 = 29;
c1	c2	c3	c4	c5	c6
29	1	1	1	29	1
select * from t1 where c1 = 33;
c1	c2	c3	c4	c5	c6
33	1	1	1	33	1
select * from t1 where c1 = 37;
c1	c2	c3	c4	c5	c6
37	1	1	1	37	1
select * from t1 where c1 = 40;
c1	c2	c3	c4	c5	c6
40	4	4	4	40	4
select * from t1 where (c1 >= 1 and c1 <= 16) or (c1 > 18 and c1 < 42);
c1	c2	c3	c4	c5	c6
10	2	2	2	10	2
11	3	3	3	11	3
12	4	4	4	12	4
19	3	3	3	19	3
20	4	4	4	20	4
21	1	1	1	21	1
22	2	2	2	22	2
23	3	3	3	23	3
24	4	4	4	24	4
25	1	1	1	25	1
26	2	2	2	26	2
27	3	3	3	27	3
28	4	4	4	28	4
29	1	1	1	29	1
30	2	2	2	30	2
31	3	3	3	31	3
32	4	4	4	32	4
33	1	1	1	33	1
34	2	2	2	34	2
35	3	3	3	35	3
36	4	4	4	36	4
37	1	1	1	37	1
38	2	2	2	38	2
39	3	3	3	39	3
40	4	4	4	40	4
41	1	1	1	41	1
5	1	1	1	5	1
6	2	2	2	6	2
7	3	3	3	7	3
8	4	4	4	8	4
9	1	1	1	9	1
select * from t1 where c1 > 1 and c1 < 14 or c1 = 21 or c1 > 25;
c1	c2	c3	c4	c5	c6
10	2	2	2	10	2
11	3	3	3	11	3
12	4	4	4	12	4
21	1	1	1	21	1
26	2	2	2	26	2
27	3	3	3	27	3
28	4	4	4	28	4
29	1	1	1	29	1
30	2	2	2	30	2
31	3	3	3	31	3
32	4	4	4	32	4
33	1	1	1	33	1
34	2	2	2	34	2
35	3	3	3	35	3
36	4	4	4	36	4
37	1	1	1	37	1
38	2	2	2	38	2
39	3	3	3	39	3
40	4	4	4	40	4
41	1	1	1	41	1
42	2	2	2	42	2
43	3	3	3	43	3
44	4	4	4	44	4
5	1	1	1	5	1
6	2	2	2	6	2
7	3	3	3	7	3
8	4	4	4	8	4
9	1	1	1	9	1
select c1 from t1 where c1 = 1;
c1
select c1 from t1 where c1 = 5;
c1
5
select c1 from t1 where c1 = 9;
c1
9
select c1 from t1 where c1 = 13;
c1
select c1 from t1 where c1 = 17;
c1
17
select c1 from t1 where c1 = 21;
c1
21
select c1 from t1 where c1 = 25;
c1
25
select c1 from t1 where c1 = 29;
c1
29
select c1 from t1 where c1 = 33;
c1
33
select c1 from t1 where c1 = 37;
c1
37
select c1 from t1 where c2 = 40;
c1
select c1 from t1 where (c1 >= 1 and c1 <= 16) or (c1 > 18 and c1 < 42);
c1
10
11
12
19
20
21
22
23
24
25
26
27
28
29
30
31
32
33
34
35
36
37
38
39
40
41
5
6
7
8
9
select c1 from t1 where c1 > 1 and c1 < 14 or c1 = 21 or c1 > 25;
c1
10
11
12
21
26
27
28
29
30
31
32
33
34
35
36
37
38
39
40
41
42
43
44
5
6
7
8
9
select * from t1 where c2 = 1;
c1	c2	c3	c4	c5	c6
5	1	1	1	5	1
9	1	1	1	9	1
17	1	1	1	17	1
21	1	1	1	21	1
25	1	1	1	25	1
29	1	1	1	29	1
33	1	1	1	33	1
37	1	1	1	37	1
41	1	1	1	41	1
select * from t1 where c2 = 2;
c1	c2	c3	c4	c5	c6
10	2	2	2	10	2
18	2	2	2	18	2
22	2	2	2	22	2
26	2	2	2	26	2
30	2	2	2	30	2
34	2	2	2	34	2
38	2	2	2	38	2
42	2	2	2	42	2
6	2	2	2	6	2
select * from t1 where c2 = 3;
c1	c2	c3	c4	c5	c6
11	3	3	3	11	3
19	3	3	3	19	3
23	3	3	3	23	3
27	3	3	3	27	3
31	3	3	3	31	3
35	3	3	3	35	3
39	3	3	3	39	3
43	3	3	3	43	3
7	3	3	3	7	3
select * from t1 where c2 = 4;
c1	c2	c3	c4	c5	c6
12	4	4	4	12	4
20	4	4	4	20	4
24	4	4	4	24	4
28	4	4	4	28	4
32	4	4	4	32	4
36	4	4	4	36	4
40	4	4	4	40	4
44	4	4	4	44	4
8	4	4	4	8	4
select * from t1 where c2 = 1 and c3 = 1;
c1	c2	c3	c4	c5	c6
17	1	1	1	17	1
21	1	1	1	21	1
25	1	1	1	25	1
29	1	1	1	29	1
33	1	1	1	33	1
37	1	1	1	37	1
41	1	1	1	41	1
5	1	1	1	5	1
9	1	1	1	9	1
select * from t1 where c2 = 2 and c3 = 2;
c1	c2	c3	c4	c5	c6
10	2	2	2	10	2
18	2	2	2	18	2
22	2	2	2	22	2
26	2	2	2	26	2
30	2	2	2	30	2
34	2	2	2	34	2
38	2	2	2	38	2
42	2	2	2	42	2
6	2	2	2	6	2
select * from t1 where c2 = 3 and c3 = 3;
c1	c2	c3	c4	c5	c6
11	3	3	3	11	3
19	3	3	3	19	3
23	3	3	3	23	3
27	3	3	3	27	3
31	3	3	3	31	3
35	3	3	3	35	3
39	3	3	3	39	3
43	3	3	3	43	3
7	3	3	3	7	3
select * from t1 where c2 = 4 and c4 = 4;
c1	c2	c3	c4	c5	c6
12	4	4	4	12	4
20	4	4	4	20	4
24	4	4	4	24	4
28	4	4	4	28	4
32	4	4	4	32	4
36	4	4	4	36	4
40	4	4	4	40	4
44	4	4	4	44	4
8	4	4	4	8	4
select * from t1 where c2 >= 1 and c2 <= 4;
c1	c2	c3	c4	c5	c6
10	2	2	2	10	2
11	3	3	3	11	3
12	4	4	4	12	4
17	1	1	1	17	1
18	2	2	2	18	2
19	3	3	3	19	3
20	4	4	4	20	4
21	1	1	1	21	1
22	2	2	2	22	2
23	3	3	3	23	3
24	4	4	4	24	4
25	1	1	1	25	1
26	2	2	2	26	2
27	3	3	3	27	3
28	4	4	4	28	4
29	1	1	1	29	1
30	2	2	2	30	2
31	3	3	3	31	3
32	4	4	4	32	4
33	1	1	1	33	1
34	2	2	2	34	2
35	3	3	3	35	3
36	4	4	4	36	4
37	1	1	1	37	1
38	2	2	2	38	2
39	3	3	3	39	3
40	4	4	4	40	4
41	1	1	1	41	1
42	2	2	2	42	2
43	3	3	3	43	3
44	4	4	4	44	4
5	1	1	1	5	1
6	2	2	2	6	2
7	3	3	3	7	3
8	4	4	4	8	4
9	1	1	1	9	1
select * from t1 where c2 >= 1 and c2 < 3 or c2 = 4;
c1	c2	c3	c4	c5	c6
10	2	2	2	10	2
12	4	4	4	12	4
17	1	1	1	17	1
18	2	2	2	18	2
20	4	4	4	20	4
21	1	1	1	21	1
22	2	2	2	22	2
24	4	4	4	24	4
25	1	1	1	25	1
26	2	2	2	26	2
28	4	4	4	28	4
29	1	1	1	29	1
30	2	2	2	30	2
32	4	4	4	32	4
33	1	1	1	33	1
34	2	2	2	34	2
36	4	4	4	36	4
37	1	1	1	37	1
38	2	2	2	38	2
40	4	4	4	40	4
41	1	1	1	41	1
42	2	2	2	42	2
44	4	4	4	44	4
5	1	1	1	5	1
6	2	2	2	6	2
8	4	4	4	8	4
9	1	1	1	9	1
select * from t1 where c3 = 1;
c1	c2	c3	c4	c5	c6
17	1	1	1	17	1
21	1	1	1	21	1
25	1	1	1	25	1
29	1	1	1	29	1
33	1	1	1	33	1
37	1	1	1	37	1
41	1	1	1	41	1
5	1	1	1	5	1
9	1	1	1	9	1
select * from t1 where c3 = 2;
c1	c2	c3	c4	c5	c6
10	2	2	2	10	2
18	2	2	2	18	2
22	2	2	2	22	2
26	2	2	2	26	2
30	2	2	2	30	2
34	2	2	2	34	2
38	2	2	2	38	2
42	2	2	2	42	2
6	2	2	2	6	2
select * from t1 where c3 = 3;
c1	c2	c3	c4	c5	c6
11	3	3	3	11	3
19	3	3	3	19	3
23	3	3	3	23	3
27	3	3	3	27	3
31	3	3	3	31	3
35	3	3	3	35	3
39	3	3	3	39	3
43	3	3	3	43	3
7	3	3	3	7	3
select * from t1 where c3 = 4;
c1	c2	c3	c4	c5	c6
12	4	4	4	12	4
20	4	4	4	20	4
24	4	4	4	24	4
28	4	4	4	28	4
32	4	4	4	32	4
36	4	4	4	36	4
40	4	4	4	40	4
44	4	4	4	44	4
8	4	4	4	8	4
select * from t1 where c3 >= 1 and c3 <= 4;
c1	c2	c3	c4	c5	c6
10	2	2	2	10	2
11	3	3	3	11	3
12	4	4	4	12	4
17	1	1	1	17	1
18	2	2	2	18	2
19	3	3	3	19	3
20	4	4	4	20	4
21	1	1	1	21	1
22	2	2	2	22	2
23	3	3	3	23	3
24	4	4	4	24	4
25	1	1	1	25	1
26	2	2	2	26	2
27	3	3	3	27	3
28	4	4	4	28	4
29	1	1	1	29	1
30	2	2	2	30	2
31	3	3	3	31	3
32	4	4	4	32	4
33	1	1	1	33	1
34	2	2	2	34	2
35	3	3	3	35	3
36	4	4	4	36	4
37	1	1	1	37	1
38	2	2	2	38	2
39	3	3	3	39	3
40	4	4	4	40	4
41	1	1	1	41	1
42	2	2	2	42	2
43	3	3	3	43	3
44	4	4	4	44	4
5	1	1	1	5	1
6	2	2	2	6	2
7	3	3	3	7	3
8	4	4	4	8	4
9	1	1	1	9	1
select * from t1 where c4 = 1;
c1	c2	c3	c4	c5	c6
17	1	1	1	17	1
21	1	1	1	21	1
25	1	1	1	25	1
29	1	1	1	29	1
33	1	1	1	33	1
37	1	1	1	37	1
41	1	1	1	41	1
5	1	1	1	5	1
9	1	1	1	9	1
select * from t1 where c4 = 2;
c1	c2	c3	c4	c5	c6
10	2	2	2	10	2
18	2	2	2	18	2
22	2	2	2	22	2
26	2	2	2	26	2
30	2	2	2	30	2
34	2	2	2	34	2
38	2	2	2	38	2
42	2	2	2	42	2
6	2	2	2	6	2
select * from t1 where c4 = 3;
c1	c2	c3	c4	c5	c6
11	3	3	3	11	3
19	3	3	3	19	3
23	3	3	3	23	3
27	3	3	3	27	3
31	3	3	3	31	3
35	3	3	3	35	3
39	3	3	3	39	3
43	3	3	3	43	3
7	3	3	3	7	3
select * from t1 where c4 = 4;
c1	c2	c3	c4	c5	c6
12	4	4	4	12	4
20	4	4	4	20	4
24	4	4	4	24	4
28	4	4	4	28	4
32	4	4	4	32	4
36	4	4	4	36	4
40	4	4	4	40	4
44	4	4	4	44	4
8	4	4	4	8	4
select * from t1 where c4 >= 1 and c4 < 3 or c4 = 4;
c1	c2	c3	c4	c5	c6
10	2	2	2	10	2
12	4	4	4	12	4
17	1	1	1	17	1
18	2	2	2	18	2
20	4	4	4	20	4
21	1	1	1	21	1
22	2	2	2	22	2
24	4	4	4	24	4
25	1	1	1	25	1
26	2	2	2	26	2
28	4	4	4	28	4
29	1	1	1	29	1
30	2	2	2	30	2
32	4	4	4	32	4
33	1	1	1	33	1
34	2	2	2	34	2
36	4	4	4	36	4
37	1	1	1	37	1
38	2	2	2	38	2
40	4	4	4	40	4
41	1	1	1	41	1
42	2	2	2	42	2
44	4	4	4	44	4
5	1	1	1	5	1
6	2	2	2	6	2
8	4	4	4	8	4
9	1	1	1	9	1
select * from t1 where c5 = 1;
c1	c2	c3	c4	c5	c6
select * from t1 where c5 = 5;
c1	c2	c3	c4	c5	c6
5	1	1	1	5	1
select * from t1 where c5 = 9;
c1	c2	c3	c4	c5	c6
9	1	1	1	9	1
select * from t1 where c5 = 13;
c1	c2	c3	c4	c5	c6
select * from t1 where c5 = 17;
c1	c2	c3	c4	c5	c6
17	1	1	1	17	1
select * from t1 where c5 = 21;
c1	c2	c3	c4	c5	c6
21	1	1	1	21	1
select * from t1 where c5 = 25;
c1	c2	c3	c4	c5	c6
25	1	1	1	25	1
select * from t1 where c5 = 29;
c1	c2	c3	c4	c5	c6
29	1	1	1	29	1
select * from t1 where c5 = 33;
c1	c2	c3	c4	c5	c6
33	1	1	1	33	1
select * from t1 where c5 = 37;
c1	c2	c3	c4	c5	c6
37	1	1	1	37	1
select * from t1 where c5 = 40;
c1	c2	c3	c4	c5	c6
40	4	4	4	40	4
select * from t1 where (c5 >= 1 and c5 <= 16) or (c5 > 18 and c5 < 40);
c1	c2	c3	c4	c5	c6
10	2	2	2	10	2
11	3	3	3	11	3
12	4	4	4	12	4
19	3	3	3	19	3
20	4	4	4	20	4
21	1	1	1	21	1
22	2	2	2	22	2
23	3	3	3	23	3
24	4	4	4	24	4
25	1	1	1	25	1
26	2	2	2	26	2
27	3	3	3	27	3
28	4	4	4	28	4
29	1	1	1	29	1
30	2	2	2	30	2
31	3	3	3	31	3
32	4	4	4	32	4
33	1	1	1	33	1
34	2	2	2	34	2
35	3	3	3	35	3
36	4	4	4	36	4
37	1	1	1	37	1
38	2	2	2	38	2
39	3	3	3	39	3
5	1	1	1	5	1
6	2	2	2	6	2
7	3	3	3	7	3
8	4	4	4	8	4
9	1	1	1	9	1
select * from t1 where c5 > 1 and c5 < 14 or c5 = 21 or c5 > 25;
c1	c2	c3	c4	c5	c6
10	2	2	2	10	2
11	3	3	3	11	3
12	4	4	4	12	4
21	1	1	1	21	1
26	2	2	2	26	2
27	3	3	3	27	3
28	4	4	4	28	4
29	1	1	1	29	1
30	2	2	2	30	2
31	3	3	3	31	3
32	4	4	4	32	4
33	1	1	1	33	1
34	2	2	2	34	2
35	3	3	3	35	3
36	4	4	4	36	4
37	1	1	1	37	1
38	2	2	2	38	2
39	3	3	3	39	3
40	4	4	4	40	4
41	1	1	1	41	1
42	2	2	2	42	2
43	3	3	3	43	3
44	4	4	4	44	4
5	1	1	1	5	1
6	2	2	2	6	2
7	3	3	3	7	3
8	4	4	4	8	4
9	1	1	1	9	1
select * from t1 where c6 = 1;
c1	c2	c3	c4	c5	c6
17	1	1	1	17	1
21	1	1	1	21	1
25	1	1	1	25	1
29	1	1	1	29	1
33	1	1	1	33	1
37	1	1	1	37	1
41	1	1	1	41	1
5	1	1	1	5	1
9	1	1	1	9	1
select * from t1 where c6 = 2;
c1	c2	c3	c4	c5	c6
10	2	2	2	10	2
18	2	2	2	18	2
22	2	2	2	22	2
26	2	2	2	26	2
30	2	2	2	30	2
34	2	2	2	34	2
38	2	2	2	38	2
42	2	2	2	42	2
6	2	2	2	6	2
select * from t1 where c6 = 3;
c1	c2	c3	c4	c5	c6
11	3	3	3	11	3
19	3	3	3	19	3
23	3	3	3	23	3
27	3	3	3	27	3
31	3	3	3	31	3
35	3	3	3	35	3
39	3	3	3	39	3
43	3	3	3	43	3
7	3	3	3	7	3
select * from t1 where c6 = 4;
c1	c2	c3	c4	c5	c6
12	4	4	4	12	4
20	4	4	4	20	4
24	4	4	4	24	4
28	4	4	4	28	4
32	4	4	4	32	4
36	4	4	4	36	4
40	4	4	4	40	4
44	4	4	4	44	4
8	4	4	4	8	4
select c1 from t1 order by c1;
c1
5
6
7
8
9
10
11
12
17
18
19
20
21
22
23
24
25
26
27
28
29
30
31
32
33
34
35
36
37
38
39
40
41
42
43
44
select c2 from t1 order by c2;
c2
1
1
1
1
1
1
1
1
1
2
2
2
2
2
2
2
2
2
3
3
3
3
3
3
3
3
3
4
4
4
4
4
4
4
4
4
select c3 from t1 order by c3;
c3
1
1
1
1
1
1
1
1
1
2
2
2
2
2
2
2
2
2
3
3
3
3
3
3
3
3
3
4
4
4
4
4
4
4
4
4
select c4 from t1 order by c4;
c4
1
1
1
1
1
1
1
1
1
2
2
2
2
2
2
2
2
2
3
3
3
3
3
3
3
3
3
4
4
4
4
4
4
4
4
4
select c5 from t1 order by c5;
c5
5
6
7
8
9
10
11
12
17
18
19
20
21
22
23
24
25
26
27
28
29
30
31
32
33
34
35
36
37
38
39
40
41
42
43
44
select c6 from t1 order by c6;
c6
1
1
1
1
1
1
1
1
1
2
2
2
2
2
2
2
2
2
3
3
3
3
3
3
3
3
3
4
4
4
4
4
4
4
4
4
select c1 from t1 order by c1 desc;
c1
44
43
42
41
40
39
38
37
36
35
34
33
32
31
30
29
28
27
26
25
24
23
22
21
20
19
18
17
12
11
10
9
8
7
6
5
select c2 from t1 order by c2 desc;
c2
4
4
4
4
4
4
4
4
4
3
3
3
3
3
3
3
3
3
2
2
2
2
2
2
2
2
2
1
1
1
1
1
1
1
1
1
select c3 from t1 order by c3 desc;
c3
4
4
4
4
4
4
4
4
4
3
3
3
3
3
3
3
3
3
2
2
2
2
2
2
2
2
2
1
1
1
1
1
1
1
1
1
select c4 from t1 order by c4 desc;
c4
4
4
4
4
4
4
4
4
4
3
3
3
3
3
3
3
3
3
2
2
2
2
2
2
2
2
2
1
1
1
1
1
1
1
1
1
select c5 from t1 order by c5 desc;
c5
44
43
42
41
40
39
38
37
36
35
34
33
32
31
30
29
28
27
26
25
24
23
22
21
20
19
18
17
12
11
10
9
8
7
6
5
select c6 from t1 order by c6 desc;
c6
4
4
4
4
4
4
4
4
4
3
3
3
3
3
3
3
3
3
2
2
2
2
2
2
2
2
2
1
1
1
1
1
1
1
1
1
select max(c1) from t1;
max(c1)
44
select max(c2) from t1;
max(c2)
4
select max(c3) from t1;
max(c3)
4
select max(c4) from t1;
max(c4)
4
select max(c5) from t1;
max(c5)
44
select max(c6) from t1;
max(c6)
4
select min(c1) from t1;
min(c1)
5
select min(c2) from t1;
min(c2)
1
select min(c3) from t1;
min(c3)
1
select min(c4) from t1;
min(c4)
1
select min(c5) from t1;
min(c5)
5
select min(c6) from t1;
min(c6)
1
select count(*) from t1;
count(*)
36
select count(1) from t1;
count(1)
36
select count(c1) from t1;
count(c1)
36
select count(c2) from t1;
count(c2)
36
select count(c3) from t1;
count(c3)
36
select count(c4) from t1;
count(c4)
36
select count(c5) from t1;
count(c5)
36
select count(c6) from t1;
count(c6)
36
set @save_opt=@@optimizer_switch;
set @@optimizer_switch="mrr=on,mrr_cost_based=off,batched_key_access=on";
CREATE TABLE tmp1 (a int, b int);
CREATE TABLE tmp2 (a int, b int, key(a));
INSERT INTO tmp1 VALUES (1,2), (2,1), (3,2), (4,3), (5,6), (6,5), (7,8), (8,7), (9,10);
INSERT INTO tmp2 VALUES (3,0), (4,1), (6,4), (7,5);
call sys_mac.mac_apply_row_policy('db', 'tmp1', 'P1', 'L3:C3,C4:G1', 0);
select mac_set_def_label('P1', 'L3:C3,C4:G1');
mac_set_def_label('P1', 'L3:C3,C4:G1')
success to set def label
SELECT * FROM tmp1 LEFT JOIN tmp2 ON tmp1.a = tmp2.a;
a	b	a	b
3	2	3	0
4	3	4	1
6	5	6	4
7	8	7	5
1	2	NULL	NULL
2	1	NULL	NULL
5	6	NULL	NULL
8	7	NULL	NULL
9	10	NULL	NULL
call sys_mac.mac_apply_row_policy('db', 'tmp2', 'P1', 'L3:C3,C4:G1', 0);
SELECT * FROM tmp1 LEFT JOIN tmp2 ON tmp1.a = tmp2.a;
ERROR HY000: This command is not supported with mac.
drop table tmp1, tmp2;
set @@optimizer_switch=@save_opt;
create table tmp(a int, b int);
call sys_mac.mac_apply_row_policy('db', 'tmp', 'P1', 'L3:C3,C4:G1', 0);
select mac_set_def_label('P1', 'L3:C3:G1');
mac_set_def_label('P1', 'L3:C3:G1')
success to set def label
insert into tmp values(1, 1);
insert into tmp values(1, 1);
insert into tmp values(2, 2);
select mac_set_def_label('P1', 'L3:C4:G1');
mac_set_def_label('P1', 'L3:C4:G1')
success to set def label
insert into tmp values(1, 1);
insert into tmp values(2, 2);
select a, b, count(*) from tmp group by a, b, _gdb_mac_policy_1;
a	b	count(*)
1	1	1
2	2	1
select mac_set_def_label('P1', 'L3:C3,C4:G1');
mac_set_def_label('P1', 'L3:C3,C4:G1')
success to set def label
select a, b, count(*) from tmp group by a, b, _gdb_mac_policy_1;
a	b	count(*)
1	1	2
2	2	1
1	1	1
2	2	1
drop table tmp;
#######################################################################
#test hide column#
select mac_reset_session_labels('P1');
mac_reset_session_labels('P1')
success to reset session labels
select mac_get_session_labels('P1');
mac_get_session_labels('P1')

READ_LABEL : L4:C2,C3,C4:G1,G1_1,G1_2,G1_1_1
WRITE_LABEL : L2:C2,C3:G1,G1_1,G1_2,G1_1_1
DEF_READ_LABEL : L3:C3,C4:G1,G1_1,G1_2,G1_1_1
DEF_WRITE_LABEL : L2:C3:G1,G1_1,G1_2,G1_1_1
DEF_ROW_LABEL : L3:C3:G1

create table t2 (c1 int primary key, c2 int);
create table t3 (c1 int primary key, c2 int);
insert into t2 values(1, 1);
insert into t3 values(1, 1);
call sys_mac.mac_apply_row_policy('db', 't2', 'P1', 'L3:C3,C4:G1', 0);
insert into t2 values(2, 2);
insert into t2 values(3, 3, mac_char_to_label('P1','L3:C3:G1'));
ERROR 21S01: Column count doesn't match value count at row 1
insert into t2 (c1, c2) values(4, 4);
insert into t2 (c1, c2, _gdb_mac_policy_1) values(5, 5, mac_char_to_label('P1','L3:C3:G1'));
insert into t2 select 6, 6;
insert into t2 select 7, 7, mac_char_to_label('P1','L3:C3:G1');
ERROR 21S01: Column count doesn't match value count at row 1
insert into t2 (c1, c2, _gdb_mac_policy_1) select 8, 8, mac_char_to_label('P1','L3:C3:G1');
######################################################################
not hide
call sys_mac.mac_apply_row_policy('db', 't3', 'P1', 'L3:C3,C4:G1', 1);
insert into t3 values(2, 2);
ERROR 21S01: Column count doesn't match value count at row 1
insert into t3 values(2, 2, mac_char_to_label('P1','L3:C3:G1'));
insert into t3 (c1, c2) values(4, 4);
insert into t3 (c1, c2, _gdb_mac_policy_1) values(5, 5, mac_char_to_label('P1','L3:C3:G1'));
insert into t3 select 6, 6;
ERROR 21S01: Column count doesn't match value count at row 1
insert into t3 select 7, 7, mac_char_to_label('P1','L3:C3:G1');
insert into t3 (c1, c2, _gdb_mac_policy_1) select 8, 8, mac_char_to_label('P1','L3:C3:G1');
select c1, c2, mac_label_to_char(_gdb_mac_policy_1) from t2;
c1	c2	mac_label_to_char(_gdb_mac_policy_1)
1	1	L3:C3,C4:G1
2	2	L3:C3:G1
4	4	L3:C3:G1
5	5	L3:C3:G1
6	6	L3:C3:G1
8	8	L3:C3:G1
select c1, c2, mac_label_to_char(_gdb_mac_policy_1) from t3;
c1	c2	mac_label_to_char(_gdb_mac_policy_1)
1	1	L3:C3,C4:G1
2	2	L3:C3:G1
4	4	L3:C3:G1
5	5	L3:C3:G1
7	7	L3:C3:G1
8	8	L3:C3:G1
test insert error
#######################################################################
insert into t2 (c1 , c2, _gdb_mac_policy_1) values(9, 9, mac_char_to_label('P1', 'L1::'));
ERROR HY000: mac row write denied to user 'root'@'localhost' for table 't2'
insert into t3 values(9, 9, mac_char_to_label('P1', 'L1::'));
ERROR HY000: mac row write denied to user 'root'@'localhost' for table 't3'
#######################################################################
test create select
create table t4 like t2;
show create table t4;
Table	Create Table
t4	CREATE TABLE `t4` (
  `c1` int NOT NULL,
  `c2` int DEFAULT NULL,
  `_gdb_mac_policy_1` int NOT NULL DEFAULT '8',
  PRIMARY KEY (`c1`)
) ENGINE=InnoDB DEFAULT CHARSET=utf8mb4 COLLATE=utf8mb4_0900_ai_ci
create table t5 as select * from t2;
show create table t5;
Table	Create Table
t5	CREATE TABLE `t5` (
  `c1` int NOT NULL,
  `c2` int DEFAULT NULL
) ENGINE=InnoDB DEFAULT CHARSET=utf8mb4 COLLATE=utf8mb4_0900_ai_ci
select * from t5;
c1	c2
1	1
2	2
4	4
5	5
6	6
8	8
drop table t4;
drop table t5;
#######################################################################
create table t4 like t3;
show create table t4;
Table	Create Table
t4	CREATE TABLE `t4` (
  `c1` int NOT NULL,
  `c2` int DEFAULT NULL,
  `_gdb_mac_policy_1` int NOT NULL DEFAULT '8',
  PRIMARY KEY (`c1`)
) ENGINE=InnoDB DEFAULT CHARSET=utf8mb4 COLLATE=utf8mb4_0900_ai_ci
create table t5 as select * from t3;
show create table t5;
Table	Create Table
t5	CREATE TABLE `t5` (
  `c1` int NOT NULL,
  `c2` int DEFAULT NULL,
  `_gdb_mac_policy_1` int NOT NULL DEFAULT '8'
) ENGINE=InnoDB DEFAULT CHARSET=utf8mb4 COLLATE=utf8mb4_0900_ai_ci
select * from t5;
c1	c2	_gdb_mac_policy_1
1	1	8
2	2	1
4	4	1
5	5	1
7	7	1
8	8	1
select mac_set_def_label('P1', 'L2::');
mac_set_def_label('P1', 'L2::')
success to set def label
select * from t5;
c1	c2	_gdb_mac_policy_1
1	1	8
2	2	1
4	4	1
5	5	1
7	7	1
8	8	1
drop table t4;
drop table t5;
select mac_reset_session_labels('P1');
mac_reset_session_labels('P1')
success to reset session labels
#######################################################################
create table t4(c1 int primary key, c2 int);
insert into t4 values(10, 10),(11, 11),(12, 12);
create table t5(c1 int primary key, c2 int, c3 int);
insert into t5 values(20, 20, mac_char_to_label('P1', 'L3:C3:G1')), (21, 21, mac_char_to_label('P1', 'L3:C3:G1')),(22, 22, mac_char_to_label('P1', 'L3:C3:G1'));
insert into t2 select * from t4;
insert into t2 select * from t5;
ERROR 21S01: Column count doesn't match value count at row 1
insert into t3 select * from t4;
ERROR 21S01: Column count doesn't match value count at row 1
insert into t3 select * from t5;
select c1, c2, mac_label_to_char(_gdb_mac_policy_1) from t2;
c1	c2	mac_label_to_char(_gdb_mac_policy_1)
1	1	L3:C3,C4:G1
2	2	L3:C3:G1
4	4	L3:C3:G1
5	5	L3:C3:G1
6	6	L3:C3:G1
8	8	L3:C3:G1
10	10	L3:C3:G1
11	11	L3:C3:G1
12	12	L3:C3:G1
select c1, c2, mac_label_to_char(_gdb_mac_policy_1) from t3;
c1	c2	mac_label_to_char(_gdb_mac_policy_1)
1	1	L3:C3,C4:G1
2	2	L3:C3:G1
4	4	L3:C3:G1
5	5	L3:C3:G1
7	7	L3:C3:G1
8	8	L3:C3:G1
20	20	L3:C3:G1
21	21	L3:C3:G1
22	22	L3:C3:G1
delete from t2;
delete from t3;
insert into t2 (c1, c2) select * from t4;
insert into t2 (c1, c2) select c1, c2 from t5;
insert into t3 (c1, c2) select * from t4;
insert into t3 (c1, c2) select c1, c2 from t5;
select c1, c2, mac_label_to_char(_gdb_mac_policy_1) from t2;
c1	c2	mac_label_to_char(_gdb_mac_policy_1)
10	10	L3:C3:G1
11	11	L3:C3:G1
12	12	L3:C3:G1
20	20	L3:C3:G1
21	21	L3:C3:G1
22	22	L3:C3:G1
select c1, c2, mac_label_to_char(_gdb_mac_policy_1) from t3;
c1	c2	mac_label_to_char(_gdb_mac_policy_1)
10	10	L3:C3:G1
11	11	L3:C3:G1
12	12	L3:C3:G1
20	20	L3:C3:G1
21	21	L3:C3:G1
22	22	L3:C3:G1
delete from t2;
delete from t3;
insert into t2 (c1, c2, _gdb_mac_policy_1) select * from t5;
insert into t3 (c1, c2, _gdb_mac_policy_1) select * from t5;
delete from t2;
delete from t3;
####################################################################
select mac_reset_session_labels('P1');
mac_reset_session_labels('P1')
success to reset session labels
insert into t2 values(1, 1),(2, 2),(3, 3);
select mac_set_def_label('P1', 'L4::');
mac_set_def_label('P1', 'L4::')
success to set def label
insert into t2 values(4, 4),(5, 5),(6, 6);
select mac_reset_session_labels('P1');
mac_reset_session_labels('P1')
success to reset session labels
update t2 set c2 = 4 where c1 = 3;
select * from t2 where c1 = 3;
c1	c2
3	4
update t2 set c2 = 7 where c1 = 6;
select * from t2 where c1 = 6;
c1	c2
update t2 set c2 = 4;
select * from t2;
c1	c2
1	4
2	4
3	4
call sys_mac.mac_alter_user_policy('root','localhost','P1','L4:C2,C3,C4:G1', 'L2:C2,C3,C4:G1', 'L3:C3,C4:G1','L3:C3,C4:');
select mac_reset_session_labels('P1');
mac_reset_session_labels('P1')
success to reset session labels
insert into t2(c1, c2) values(7, 7),(8, 8),(9, 9);
call sys_mac.mac_alter_user_policy('root','localhost','P1','L4:C2,C3,C4:G1', 'L2:C2,C3:G1', 'L3:C3,C4:G1','L3:C3:G1');
select mac_reset_session_labels('P1');
mac_reset_session_labels('P1')
success to reset session labels
select mac_get_session_labels('P1');
mac_get_session_labels('P1')

READ_LABEL : L4:C2,C3,C4:G1,G1_1,G1_2,G1_1_1
WRITE_LABEL : L2:C2,C3:G1,G1_1,G1_2,G1_1_1
DEF_READ_LABEL : L3:C3,C4:G1,G1_1,G1_2,G1_1_1
DEF_WRITE_LABEL : L2:C3:G1,G1_1,G1_2,G1_1_1
DEF_ROW_LABEL : L3:C3:G1

update t2 set c2 = 10 where c1 = 7;
ERROR HY000: mac row write denied to user 'root'@'localhost' for table 't2'
select * from t2 where c1 = 7;
c1	c2
7	7
update t2 set c2 = 11 where c1 = 6;
select * from t2 where c1 = 6;
c1	c2
update t2 set c2 = 12 where c1 = 3;
select * from t2 where c1 = 3;
c1	c2
3	12
update t2 set c2 = 13;
ERROR HY000: mac row write denied to user 'root'@'localhost' for table 't2'
select * from t2;
c1	c2
1	4
2	4
3	12
7	7
8	8
9	9
call sys_mac.mac_drop_row_policy('db', 't2', 'P1');
select * from t2;
c1	c2
1	4
2	4
3	12
4	4
5	5
6	6
7	7
8	8
9	9
delete from t2;
####################################################################
call sys_mac.mac_apply_row_policy('db', 't2', 'P1', 'L3:C3,C4:G1', 0);
select mac_reset_session_labels('P1');
mac_reset_session_labels('P1')
success to reset session labels
insert into t2 values(1, 1),(2, 2),(3, 3);
select mac_set_def_label('P1', 'L4::');
mac_set_def_label('P1', 'L4::')
success to set def label
insert into t2 values(4, 4),(5, 5),(6, 6);
select mac_reset_session_labels('P1');
mac_reset_session_labels('P1')
success to reset session labels
delete from t2 where c1 = 3;
select * from t2 where c1 = 3;
c1	c2
delete from t2 where c1 = 6;
select * from t2 where c1 = 6;
c1	c2
call sys_mac.mac_alter_user_policy('root','localhost','P1','L4:C2,C3,C4:G1', 'L2:C2,C3,C4:G1', 'L3:C3,C4:G1','L3:C3,C4:');
select mac_reset_session_labels('P1');
mac_reset_session_labels('P1')
success to reset session labels
insert into t2(c1, c2) values(7, 7),(8, 8),(9, 9);
call sys_mac.mac_alter_user_policy('root','localhost','P1','L4:C2,C3,C4:G1', 'L2:C2,C3:G1', 'L3:C3,C4:G1','L3:C3:G1');
select mac_reset_session_labels('P1');
mac_reset_session_labels('P1')
success to reset session labels
select mac_get_session_labels('P1');
mac_get_session_labels('P1')

READ_LABEL : L4:C2,C3,C4:G1,G1_1,G1_2,G1_1_1
WRITE_LABEL : L2:C2,C3:G1,G1_1,G1_2,G1_1_1
DEF_READ_LABEL : L3:C3,C4:G1,G1_1,G1_2,G1_1_1
DEF_WRITE_LABEL : L2:C3:G1,G1_1,G1_2,G1_1_1
DEF_ROW_LABEL : L3:C3:G1

delete from t2 where c1 = 7;
ERROR HY000: mac row write denied to user 'root'@'localhost' for table 't2'
select * from t2 where c1 = 7;
c1	c2
7	7
delete from t2 where c1 = 5;
select * from t2 where c1 = 5;
c1	c2
update t2 set c2 = 11 where c1 = 2;
select * from t2 where c1 = 2;
c1	c2
2	11
delete from t2;
ERROR HY000: mac row write denied to user 'root'@'localhost' for table 't2'
select * from t2;
c1	c2
1	1
2	11
7	7
8	8
9	9
call sys_mac.mac_drop_row_policy('db', 't2', 'P1');
select * from t2;
c1	c2
1	1
2	11
4	4
5	5
6	6
7	7
8	8
9	9
delete from t2;
####################################################################
#test two policy
insert into t2 values(1, 1),(2, 2);
call sys_mac.mac_apply_row_policy('db', 't2', 'P1', 'L3:C3,C4:', 0);
call sys_mac.mac_apply_row_policy('db', 't2', 'P2', 'L3:C3,C4:G1', 0);
SET NAMES utf8mb4;
SET CHARACTER_SET_CLIENT=utf8mb4;
SET COLLATION_CONNECTION=utf8mb4_bin;
call sys_mac.mac_apply_user_policy('root','localhost','P2','L4:C2,C3,C4:G1', 'L2:C2,C3:G1', 'L3:C3,C4:G1','L3:C3:G1');
SET NAMES utf8mb4;
SET CHARACTER_SET_CLIENT=utf8mb4;
SET COLLATION_CONNECTION=utf8mb4_bin;
use db;
select * from t2;
c1	c2
1	1
2	2
select mac_set_def_label('P1','L3::');
mac_set_def_label('P1','L3::')
success to set def label
update t2 set c2 = 3;
delete from t2;
select * from t2;
c1	c2
select mac_set_def_label('P1','L3:C3,C4:');
mac_set_def_label('P1','L3:C3,C4:')
success to set def label
update t2 set c2 = 3;
ERROR HY000: mac row write denied to user 'root'@'localhost' for table 't2'
delete from t2;
ERROR HY000: mac row write denied to user 'root'@'localhost' for table 't2'
select * from t2;
c1	c2
1	1
2	2
select mac_set_def_label('P1','L3:C3,C4:G1');
mac_set_def_label('P1','L3:C3,C4:G1')
success to set def label
insert into t2 values(3, 3);
update t2 set c2 = 4 where c1 = 3;
select * from t2;
c1	c2
1	1
2	2
3	4
delete from t2 where c1 = 3;
select * from t2;
c1	c2
1	1
2	2
call sys_mac.mac_drop_row_policy('db', 't2', 'P1');
call sys_mac.mac_drop_row_policy('db', 't2', 'P2');
show create table t2;
Table	Create Table
t2	CREATE TABLE `t2` (
  `c1` int NOT NULL,
  `c2` int DEFAULT NULL,
  PRIMARY KEY (`c1`)
) ENGINE=InnoDB DEFAULT CHARSET=utf8mb4 COLLATE=utf8mb4_0900_ai_ci
drop database db;
