drop table if exists test_to_number;
CREATE TABLE `test_to_number` (
`c0` int NOT NULL AUTO_INCREMENT,
`c1` date DEFAULT NULL,
`c2` time DEFAULT NULL,
`c3` datetime DEFAULT NULL,
`c4` year DEFAULT NULL,
`c5` int DEFAULT NULL,
`c6` decimal(10,6) DEFAULT NULL,
`c7` double DEFAULT NULL,
`c8` float DEFAULT NULL,
`c9` varchar(255) DEFAULT NULL,
PRIMARY KEY (`c0`)
) ENGINE=InnoDB AUTO_INCREMENT=5 DEFAULT CHARSET=utf8mb4 COLLATE=utf8mb4_0900_ai_ci;
INSERT INTO `test_to_number` VALUES ('1', '2021-04-26', '15:36:37', '2021-04-27 15:36:41', '2021', '5', '6.000000', '7.1', '118.169', 'a8.168111');
INSERT INTO `test_to_number` VALUES ('2', '2021-04-28', '15:36:37', '2021-04-27 15:36:41', '2021', '6', '7877.126000', '8.1', '119.187', 'a9.16');
INSERT INTO `test_to_number` VALUES ('3', '2021-04-29', '15:36:37', '2021-04-27 15:36:41', '2021', '6', '7877.126890', '8.1', '119.187', 'a9.1682');
INSERT INTO `test_to_number` VALUES ('4', '2021-04-30', '15:36:37', '2021-04-27 15:36:41', '2021', '6', '7877.126890', '8.1', '119.187', 'a9.168333');
select c7,to_number(c7) from test_to_number;
c7	to_number(c7)
7.1	7.1
8.1	8.1
8.1	8.1
8.1	8.1
select c9,to_number(c9) from test_to_number;
ERROR 22003: NUMBER value is out of range in 'to_number'
select to_number("12340")+1.1 ,to_number("12345")-1.1,to_number("12345")*2,to_number("12345")/2 ;
to_number("12340")+1.1	to_number("12345")-1.1	to_number("12345")*2	to_number("12345")/2
12341.1	12343.9	24690	6172.5000
select to_number(123.456,'999.99');
ERROR 22003: NUMBER value is out of range in 'to_number'
select to_number(123.456,'') ;
ERROR HY000: Invalid argument error: args 1 in function to_number.
select to_number(123.456,'a999.99') ;
ERROR HY000: Invalid argument error: a999.99 in function to_number.
select to_number(123333.456,'999.99') ;
ERROR 22003: NUMBER value is out of range in 'to_number'
select to_number(12333333333333333333333333333333333333333.456,'999999999999999999999999999999999999999999999999999999999999999999999999999.99') ;
ERROR 42000: Identifier name '999999999999999999999999999999999999999999999999999999999999999999999999999.99' is too long
select to_number(sum(null));
to_number(sum(null))
NULL
select to_number(null) from dual ;
to_number(null)
NULL
select to_number('') from dual ;
to_number('')
NULL
select to_number(' 1.2') from dual where to_number(null) is null ;
to_number(' 1.2')
1.2
select to_number(' 1.2') from dual where to_number('') is null ;
to_number(' 1.2')
1.2
select to_number(' 1.2 ') from dual where to_number('') is null ;
to_number(' 1.2 ')
1.2
select to_number(' 1.2') from dual where to_number(' 1.2')=1.2 ;
to_number(' 1.2')
1.2
select to_number(' 1.2 ') from dual where to_number(' 1.2 ')=1.2 ;
to_number(' 1.2 ')
1.2
select to_number(11.12) from dual where to_number(11.12)=11.122;
to_number(11.12)
select to_number(11.12) from dual where to_number(11.12)=11.12;
to_number(11.12)
11.12
select to_number('11.12') from dual where to_number('11.12')=11.122;
to_number('11.12')
select to_number('11.12') from dual where to_number('11.12')=11.12;
to_number('11.12')
11.12
select to_number(' 1.2') from dual where to_number(' ') is null ;
ERROR 22003: NUMBER value is out of range in 'to_number'
select to_number(' ') from dual ;
ERROR 22003: NUMBER value is out of range in 'to_number'
select to_number(' 1.2') from dual where to_number(' 1.2') is null ;
to_number(' 1.2')
select 'null' from dual where to_number('') is null ;
null
null
select * from test_to_number order by to_number(c9);
ERROR 22003: NUMBER value is out of range in 'to_number'
select c9 from test_to_number group by to_number(c9);
ERROR 42000: Expression #1 of SELECT list is not in GROUP BY clause and contains nonaggregated column 'test.test_to_number.c9' which is not functionally dependent on columns in GROUP BY clause; this is incompatible with sql_mode=only_full_group_by
select to_number('11.1100') union all select to_number('11.00') ;
to_number('11.1100')
11
11
select to_number(c6) from test_to_number group by to_number(c6);
to_number(c6)
6
7877
select to_number('12345.00') , to_number('12345');
to_number('12345.00')	to_number('12345')
12345	12345
create table `T_UCP_STAFFBASICINFO` (
`DLMODULUS` Decimal (6),
`DLMODULUS2` Decimal (10,5)
);
insert into `T_UCP_STAFFBASICINFO` (`DLMODULUS`,`DLMODULUS2`) values('0.00','0.00');
insert into `T_UCP_STAFFBASICINFO` (`DLMODULUS`,`DLMODULUS2`) values('0','0');
insert into `T_UCP_STAFFBASICINFO` (`DLMODULUS`,`DLMODULUS2`) values('0.1','0.1');
insert into `T_UCP_STAFFBASICINFO` (`DLMODULUS`,`DLMODULUS2`) values('1.0','1.0');
insert into `T_UCP_STAFFBASICINFO` (`DLMODULUS`,`DLMODULUS2`) values('0.01','0.01');
SELECT DLMODULUS,DLMODULUS2 FROM T_UCP_STAFFBASICINFO;
DLMODULUS	DLMODULUS2
0	0.00000
0	0.00000
0	0.10000
1	1.00000
0	0.01000
set sql_mode=oracle;
SELECT DLMODULUS,DLMODULUS2 FROM T_UCP_STAFFBASICINFO;
DLMODULUS	DLMODULUS2
0	0
0	0
0	0.1
1	1
0	0.01
select to_number(null) from dual where to_number(null) is null ;
to_number(null)
NULL
select to_number('') from dual where to_number('') is null ;
to_number('')
NULL
select to_number(' 1.2') from dual where to_number(' 1.2')=1.2 ;
to_number(' 1.2')
1.2
select to_number('11.1100') union all select to_number('11.00') ;
to_number('11.1100')
11.11
11
select to_number(c6) from test_to_number group by to_number(c6);
to_number(c6)
6
7877.126
7877.12689
select to_number('12345.00') , to_number('12345');
to_number('12345.00')	to_number('12345')
12345	12345
drop table if exists test_to_number;
drop table if exists T_UCP_STAFFBASICINFO;
set sql_mode=DEFAULT;
select to_number('1,234.567','9,999.999') FROM dual;
to_number('1,234.567','9,999.999')
1234.567
select to_number('12,34','99,99.99') from dual;
to_number('12,34','99,99.99')
1234
select to_number('34','99,99.99') from dual;
to_number('34','99,99.99')
34
select to_number('12,12,12','99,99,99.99') from dual;
to_number('12,12,12','99,99,99.99')
121212
select to_number('34.1','99,99.99') from dual;
to_number('34.1','99,99.99')
34.1
select to_number('12,12,12.01','99,99,99.99') from dual;
to_number('12,12,12.01','99,99,99.99')
121212.01
select to_number('12,12,12.001','99,99,99.99') from dual;
ERROR 22003: NUMBER value is out of range in 'to_number'
select to_number('234','99,99.99') from dual;
ERROR 22003: NUMBER value is out of range in 'to_number'
SELECT to_number('1,234.567','99,99.999') FROM dual;
ERROR 22003: NUMBER value is out of range in 'to_number'
select to_number('1234','99,99.99') from dual;
ERROR 22003: NUMBER value is out of range in 'to_number'
select to_number('34.112','99,99.99') from dual;
ERROR 22003: NUMBER value is out of range in 'to_number'
select to_number('34.112','99,99.99') from dual;
ERROR 22003: NUMBER value is out of range in 'to_number'
select to_number('112,12,12','99,99,99.99') from dual;
ERROR 22003: NUMBER value is out of range in 'to_number'
select to_number('12,12,112','999,999,999.99') from dual;
ERROR 22003: NUMBER value is out of range in 'to_number'
select to_number('112,12','99,99,99.99') from dual;
ERROR 22003: NUMBER value is out of range in 'to_number'
SELECT to_number('0.12','0.99') FROM dual;
to_number('0.12','0.99')
0.12
SELECT to_number('1.1','0.99') FROM dual;
to_number('1.1','0.99')
1.1
SELECT to_number('1.111','0.99') FROM dual;
ERROR 22003: NUMBER value is out of range in 'to_number'
SELECT to_number('11.11','9.99') FROM dual;
ERROR 22003: NUMBER value is out of range in 'to_number'
SELECT to_number('1.6E+02','9.9EEEE') FROM dual;
to_number('1.6E+02','9.9EEEE')
160
SELECT to_number('1.6E-02','9.9EEEE') FROM dual;
to_number('1.6E-02','9.9EEEE')
0.016
SELECT to_number('1.6e+02','9.9EEEE') FROM dual;
to_number('1.6e+02','9.9EEEE')
160
SELECT to_number('1.6e-02','9.9EEEE') FROM dual;
to_number('1.6e-02','9.9EEEE')
0.016
SELECT to_number('1.6','9.9EEEE') FROM dual;
to_number('1.6','9.9EEEE')
1.6
SELECT to_number('1','9.9EEEE') FROM dual;
to_number('1','9.9EEEE')
1
SELECT to_number('-1','9.9EEEE') FROM dual;
to_number('-1','9.9EEEE')
-1
SELECT to_number('0','9.9EEEE') FROM dual;
to_number('0','9.9EEEE')
0
SELECT to_number('0.6','9.9EEEE') FROM dual;
to_number('0.6','9.9EEEE')
0.6
SELECT to_number('.6','9.9EEEE') FROM dual;
to_number('.6','9.9EEEE')
0.6
SELECT to_number('-1.0','9.9EEEE') FROM dual;
to_number('-1.0','9.9EEEE')
-1
SELECT to_number('1E+01', '9.9EEEE') FROM DUAL;
to_number('1E+01', '9.9EEEE')
10
SELECT to_number('1.66e+02','9.9EEEE') FROM dual;
ERROR 22003: NUMBER value is out of range in 'to_number'
SELECT to_number('1.6-02','9.9EEEE') FROM dual;
ERROR 22003: NUMBER value is out of range in 'to_number'
SELECT to_number('1.6A-02','9.9EEEE') FROM dual;
ERROR 22003: NUMBER value is out of range in 'to_number'
SELECT to_number('A-E02','9.9EEEE') FROM dual;
ERROR 22003: NUMBER value is out of range in 'to_number'
SELECT to_number('11','99.9EEEE') FROM dual;
ERROR 22003: NUMBER value is out of range in 'to_number'
SELECT to_number('-11','99.9EEEE') FROM dual;
ERROR 22003: NUMBER value is out of range in 'to_number'
SELECT to_number('1.66','9.9EEEE') FROM dual;
ERROR 22003: NUMBER value is out of range in 'to_number'
SELECT to_number('1.66E-02','9.9EEEE') FROM dual;
ERROR 22003: NUMBER value is out of range in 'to_number'
SELECT to_number('4D2','XXX') FROM dual;
to_number('4D2','XXX')
1234
SELECT to_number('f','XXX') FROM dual;
to_number('f','XXX')
15
SELECT to_number('f1','XXX') FROM dual;
to_number('f1','XXX')
241
SELECT to_number('f12','XXX') FROM dual;
to_number('f12','XXX')
3858
SELECT to_number('f123','XXX') FROM dual;
ERROR 22003: NUMBER value is out of range in 'to_number'
SELECT to_number('4D2A','XXX') FROM dual;
ERROR 22003: NUMBER value is out of range in 'to_number'
SELECT to_number('fj','XXX') FROM dual;
ERROR 22003: NUMBER value is out of range in 'to_number'
SELECT to_number('jf','XXX') FROM dual;
ERROR 22003: NUMBER value is out of range in 'to_number'
DROP TABLE IF EXISTS `test1`;
Warnings:
Note	1051	Unknown table 'test.test1'
CREATE TABLE `test1` (
`id` int NOT NULL,
`name` varchar(100) DEFAULT NULL,
PRIMARY KEY (`id`)
) ENGINE=InnoDB DEFAULT CHARSET=utf8mb4 COLLATE=utf8mb4_0900_ai_ci;
INSERT INTO `test1` VALUES (1, '3');
INSERT INTO `test1` VALUES (2, '20');
INSERT INTO `test1` VALUES (3, '');
INSERT INTO `test1` VALUES (4, '21');
INSERT INTO `test1` VALUES (5, '8');
select name, to_number(name,'9999') from test1;
name	to_number(name,'9999')
3	3
20	20
	NULL
21	21
8	8
select name, to_number(name,'99.009') from test1;
name	to_number(name,'99.009')
3	3
20	20
	NULL
21	21
8	8
INSERT INTO `test1` VALUES (6, '-1.6e+020');
INSERT INTO `test1` VALUES (7, ',0,.0');
INSERT INTO `test1` VALUES (8, '-1.6e+02');
select name,to_number(name,'9.9EEEE') from test1 where id >5;
name	to_number(name,'9.9EEEE')
-1.6e+020	-1.6e20
,0,.0	0
-1.6e+02	-160
DROP TABLE IF EXISTS `test1`;
select to_number('-123.456','999.999') FROM dual;
to_number('-123.456','999.999')
-123.456
select to_number('-1.6e+010','9.9EEEE') FROM dual;
to_number('-1.6e+010','9.9EEEE')
-16000000000
select to_number(-0.000000,'999.999') FROM dual;
to_number(-0.000000,'999.999')
0
select to_number(1234.0100,'999.99') FROM dual;
ERROR 22003: NUMBER value is out of range in 'to_number'
select to_number(123.0100,'999.99') FROM dual;
to_number(123.0100,'999.99')
123.01
select to_number(12340,'9999') FROM dual;
ERROR 22003: NUMBER value is out of range in 'to_number'
select to_number(1234.0,'9999.9') FROM dual;
to_number(1234.0,'9999.9')
1234
select to_number(1234.1,'9999.9') FROM dual;
to_number(1234.1,'9999.9')
1234.1
select to_number(1234.12,'9999.9') FROM dual;
ERROR 22003: NUMBER value is out of range in 'to_number'
select to_number(234.000,'999.99') FROM dual;
to_number(234.000,'999.99')
234
select to_number(123.4560,'999.999') FROM dual;
to_number(123.4560,'999.999')
123.456
select to_number(-100,'999.999') FROM dual;
to_number(-100,'999.999')
-100
select to_number('-123.456','999.999') FROM dual;
to_number('-123.456','999.999')
-123.456
select to_number(-1.6e+010,'9.9EEEE') FROM dual;
ERROR 22003: NUMBER value is out of range in 'to_number'
select to_number('100','9999') FROM dual;
to_number('100','9999')
100
select to_number(1234.000,'999.99') FROM dual;
ERROR 22003: NUMBER value is out of range in 'to_number'
select to_number(123.001,'999.99') FROM dual;
ERROR 22003: NUMBER value is out of range in 'to_number'
select to_number(1234000,'9999999') FROM dual;
to_number(1234000,'9999999')
1234000
select to_number(1234.00,'9999') FROM dual;
to_number(1234.00,'9999')
1234
select to_number(1,234.000,'999,999.99') FROM dual;
ERROR 42000: You have an error in your SQL syntax; check the manual that corresponds to your MySQL server version for the right syntax to use near ','999,999.99') FROM dual' at line 1
select to_number(1234.0,'9999') FROM dual;
to_number(1234.0,'9999')
1234
select to_number(1234.000,'9999') FROM dual;
to_number(1234.000,'9999')
1234
select to_number(-1234.0,'9999') FROM dual;
to_number(-1234.0,'9999')
-1234
select to_number(-1.00,'9.9EEEE') FROM dual;
to_number(-1.00,'9.9EEEE')
-1
select to_number('-1','9.9EEEE') FROM dual;
to_number('-1','9.9EEEE')
-1
select to_number(-1.00,'9.9EEEE') FROM dual;
to_number(-1.00,'9.9EEEE')
-1
select to_number('-1','9.9EEEE') FROM dual;
to_number('-1','9.9EEEE')
-1
select to_number('1.6e+05','9.999EEEE') FROM dual;
to_number('1.6e+05','9.999EEEE')
160000
select to_number('-1.0e+00','9.9EEEE') FROM dual;
to_number('-1.0e+00','9.9EEEE')
-1
select to_number('-1.10e+00','9.99EEEE') FROM dual;
to_number('-1.10e+00','9.99EEEE')
-1.1
select to_number('-1.10e+00','9.999EEEE') FROM dual;
to_number('-1.10e+00','9.999EEEE')
-1.1
select to_number('1.000e+05','9.9EEEE') FROM dual;
ERROR 22003: NUMBER value is out of range in 'to_number'
select to_number(1.000e+05,'9.9EEEE') FROM dual;
ERROR 22003: NUMBER value is out of range in 'to_number'
select to_number('1.66000e+05','9.999EEEE') FROM dual;
ERROR 22003: NUMBER value is out of range in 'to_number'
select to_number('1.6666e+05','9.999EEEE') FROM dual;
ERROR 22003: NUMBER value is out of range in 'to_number'
select to_number('1.666e+05','9.999EEEE') FROM dual;
to_number('1.666e+05','9.999EEEE')
166600
select to_number(Ascii('A'),'XXXX') FROM dual;
to_number(Ascii('A'),'XXXX')
101
select to_number(1234,'XXXX') FROM dual;
to_number(1234,'XXXX')
4660
select to_number(123.45601+123.45600,'9999.9999') FROM dual;
ERROR 22003: NUMBER value is out of range in 'to_number'
select to_number(123123.4560,'9999.9999') FROM dual;
ERROR 22003: NUMBER value is out of range in 'to_number'
select to_number(123.456780,'9999.9999') FROM dual;
ERROR 22003: NUMBER value is out of range in 'to_number'
SELECT to_number('-1.6e+010','9.9EEEE') FROM dual;
to_number('-1.6e+010','9.9EEEE')
-16000000000
SELECT to_number('1.6e+010','9.9EEEE') FROM dual;
to_number('1.6e+010','9.9EEEE')
16000000000
SELECT to_number('1.6e+030','9.9EEEE') FROM dual;
to_number('1.6e+030','9.9EEEE')
1.6e30
select to_number(0.1000000000,'9.9EEEE') FROM dual;
to_number(0.1000000000,'9.9EEEE')
0.1
select to_number(1.1000000000,'9.9EEEE') FROM dual;
to_number(1.1000000000,'9.9EEEE')
1.1
select to_number(10.1000000000,'9.9EEEE') FROM dual;
ERROR 22003: NUMBER value is out of range in 'to_number'
SELECT to_number('1e+123', '9.9EEEE') FROM DUAL;
ERROR HY000: Invalid argument error: args 0 exponent greater than 80 in function to_number.
SELECT to_number('1e+80', '9.9EEEE') FROM DUAL;
to_number('1e+80', '9.9EEEE')
1e80
SELECT to_number('1e+81', '9.9EEEE') FROM DUAL;
ERROR HY000: Invalid argument error: args 0 exponent greater than 80 in function to_number.
select to_number(1,'.99') from dual;
ERROR 22003: NUMBER value is out of range in 'to_number'
select to_number(1,'$99') from dual;
ERROR 22003: NUMBER value is out of range in 'to_number'
select to_number(1,'9') from dual;
to_number(1,'9')
1
select to_number(1,nvl(null,'9')) from dual;
to_number(1,nvl(null,'9'))
1
select to_number(1,'Fm9') from dual;
ERROR 22003: NUMBER value is out of range in 'to_number'
select to_number(1,null) from dual;
to_number(1,null)
NULL
select to_number('-f12','XXXXXXXX') FROM dual;
to_number('-f12','XXXXXXXX')
-3858
select to_number('0','99.99') from dual;
to_number('0','99.99')
0
select to_number('1','999.90') from dual;
to_number('1','999.90')
1
select to_number(-1.1,'99.') FROM dual;
ERROR 22003: NUMBER value is out of range in 'to_number'
select to_number('0','B90.99') from dual;
ERROR 22003: NUMBER value is out of range in 'to_number'
select to_number('0','B9999') from dual;
ERROR 22003: NUMBER value is out of range in 'to_number'
select to_number(1,'B9999') from dual;
ERROR 22003: NUMBER value is out of range in 'to_number'
select to_number('-121','B999') FROM dual;
ERROR 22003: NUMBER value is out of range in 'to_number'
select to_number('123.456','FM999.009') from dual;
ERROR 22003: NUMBER value is out of range in 'to_number'
SELECT to_number('12454.80', 'FM99999.99') FROM dual;
ERROR 22003: NUMBER value is out of range in 'to_number'
select to_number('123.45','L999.99') from dual;
ERROR HY000: Invalid argument error: L999.99 in function to_number.
select to_number('123.45','FML999.99') from dual;
ERROR HY000: Invalid argument error: FML999.99 in function to_number.
select to_number('123','999S') from dual;
ERROR 22003: NUMBER value is out of range in 'to_number'
SELECT to_number('12,454.8-', '99G999D9S') FROM dual;
ERROR 22003: NUMBER value is out of range in 'to_number'
select to_number('1-','9999S') FROM dual;
ERROR 22003: NUMBER value is out of range in 'to_number'
select to_number('$10','$99') from dual;
ERROR HY000: Invalid argument error: args 0 is invald in function to_number.
select to_number('-1','S9999') FROM dual;
ERROR 22003: NUMBER value is out of range in 'to_number'
select to_number('1,1-','9999MI') FROM dual;
ERROR 22003: NUMBER value is out of range in 'to_number'
select to_number('<1>','9999PR') FROM dual;
ERROR 22003: NUMBER value is out of range in 'to_number'
select to_number(13.0,'9999999999999999V') from dual;
ERROR 22003: NUMBER value is out of range in 'to_number'
select to_number(13000,'99V99') from dual;
ERROR 22003: NUMBER value is out of range in 'to_number'
select TO_NUMBER('-100.11', '9G999D99') FROM dual;
TO_NUMBER('-100.11', '9G999D99')
-100.11
select TO_NUMBER('-100.11', '9,999.99') FROM dual;
TO_NUMBER('-100.11', '9,999.99')
-100.11
select TO_NUMBER('+100.11', '9G999D99') FROM dual;
ERROR 22003: NUMBER value is out of range in 'to_number'
select TO_NUMBER('+100.11', '9,999.99') FROM dual;
ERROR 22003: NUMBER value is out of range in 'to_number'
select TO_NUMBER('100.11', '9G999D99') FROM dual;
TO_NUMBER('100.11', '9G999D99')
100.11
select TO_NUMBER('100.11', '9,999.99') FROM dual;
TO_NUMBER('100.11', '9,999.99')
100.11
select to_number('-1,1','9G999') FROM dual;
to_number('-1,1','9G999')
-11
select to_number('11,1','9,999') FROM dual;
to_number('11,1','9,999')
111
select to_number(',11,1','9,999') FROM dual;
to_number(',11,1','9,999')
111
select to_number('1,1,11','9,999') FROM dual;
to_number('1,1,11','9,999')
1111
select to_number('1,111','9,999') FROM dual;
to_number('1,111','9,999')
1111
select to_number('-1,1','9G999') FROM dual;
to_number('-1,1','9G999')
-11
select to_number(',0,','9,9') FROM dual;
to_number(',0,','9,9')
0
select to_number('-0,0,0,','9,0,9.9') FROM dual;
to_number('-0,0,0,','9,0,9.9')
0
select to_number(',0,.0','9,9.9') FROM dual;
to_number(',0,.0','9,9.9')
0
select to_number('111,1','9,999') FROM dual;
ERROR 22003: NUMBER value is out of range in 'to_number'
select to_number(',1111','9,999') FROM dual;
ERROR 22003: NUMBER value is out of range in 'to_number'
select to_number('11,11','9,999') FROM dual;
ERROR 22003: NUMBER value is out of range in 'to_number'
select to_number('1,,1','9999') FROM dual;
to_number('1,,1','9999')
11
select to_number('1,,,1','9999') FROM dual;
to_number('1,,,1','9999')
11
select to_number('1,,,,1','9999') FROM dual;
to_number('1,,,,1','9999')
11
select to_number('1,,1,1,1','9999') FROM dual;
to_number('1,,1,1,1','9999')
1111
select to_number('1,1,1,,,,,,,,1','9999') FROM dual;
to_number('1,1,1,,,,,,,,1','9999')
1111
select to_number('1,1,,,,,,,,,,1','9999') FROM dual;
to_number('1,1,,,,,,,,,,1','9999')
111
select to_number('1,1,1,,,1,,,,,1','9999') FROM dual;
ERROR 22003: NUMBER value is out of range in 'to_number'
SELECT to_number(',0','9.9EEEE') FROM dual;
to_number(',0','9.9EEEE')
0
select to_number(',0,.0','9.9EEEE') FROM dual;
to_number(',0,.0','9.9EEEE')
0
select to_number('-1.6e0000020','9.90EEEE') FROM dual;
to_number('-1.6e0000020','9.90EEEE')
-1.6e20
select to_number('-1.6,e20,,','9.90EEEE') FROM dual;
ERROR 22003: NUMBER value is out of range in 'to_number'
set sql_mode = NO_BACKSLASH_ESCAPES;
select to_number('-\,0.0','9,9.9') FROM dual;
ERROR 22003: NUMBER value is out of range in 'to_number'
set sql_mode=DEFAULT;
select to_number('-\,0.0','9,9.9') FROM dual;
to_number('-\,0.0','9,9.9')
0
select to_number(1,'9,,9,9.9') FROM dual;
to_number(1,'9,,9,9.9')
1
select to_number(101,'909.9') FROM dual;
to_number(101,'909.9')
101
select to_number('01','909.9') FROM dual;
to_number('01','909.9')
1
select to_number('01','09') from dual;
to_number('01','09')
1
select to_number('-001','9099') from dual;
to_number('-001','9099')
-1
select to_number('-01','909.9') FROM dual;
to_number('-01','909.9')
-1
select to_number(-101,'909.9') FROM dual;
to_number(-101,'909.9')
-101
select to_number('1','909.9') FROM dual;
ERROR 22003: NUMBER value is out of range in 'to_number'
select to_number(01,'909.9') FROM dual;
ERROR 22003: NUMBER value is out of range in 'to_number'
select to_number(1,'9,,0,9.9') FROM dual;
ERROR 22003: NUMBER value is out of range in 'to_number'
select to_number('-1','909.9') FROM dual;
ERROR 22003: NUMBER value is out of range in 'to_number'
select to_number(-01,'909.9') FROM dual;
ERROR 22003: NUMBER value is out of range in 'to_number'
select to_number(-1,'9,,0,9.9') FROM dual;
ERROR 22003: NUMBER value is out of range in 'to_number'
select to_number(1+'0.0','9,,0,9.9') FROM dual;
ERROR 22003: NUMBER value is out of range in 'to_number'
select to_number(1,'9,,0,9.9') FROM dual;
ERROR 22003: NUMBER value is out of range in 'to_number'
select to_number('1','09') from dual;
ERROR 22003: NUMBER value is out of range in 'to_number'
select to_number('01','9099') from dual;
ERROR 22003: NUMBER value is out of range in 'to_number'
select to_number('1,.0','9.9EEEE') FROM dual;
to_number('1,.0','9.9EEEE')
1
select to_number('-,1,.0','9.9EEEE') FROM dual;
to_number('-,1,.0','9.9EEEE')
-1
select to_number(',0.','xxx') FROM dual;
ERROR 22003: NUMBER value is out of range in 'to_number'
select to_number('0.','xxx') FROM dual;
ERROR 22003: NUMBER value is out of range in 'to_number'
select to_number('0.1','xxx') FROM dual;
ERROR 22003: NUMBER value is out of range in 'to_number'
select to_number(',0,','xxx') FROM dual;
to_number(',0,','xxx')
0
select to_number(',10','xxx') FROM dual;
to_number(',10','xxx')
16
select to_number('1,f','xxx') FROM dual;
to_number('1,f','xxx')
31
select to_number('-\\\,0\.0','9,9.9') FROM dual;
ERROR 22003: NUMBER value is out of range in 'to_number'
select to_number(''',0.0','9,9.9') FROM dual;
ERROR 22003: NUMBER value is out of range in 'to_number'
select to_number('-1.0','9999') FROM dual;
ERROR 22003: NUMBER value is out of range in 'to_number'
select to_number('-1.0','9,999') FROM dual;
ERROR 22003: NUMBER value is out of range in 'to_number'
select to_number('-1.00','9,999.9') FROM dual;
ERROR 22003: NUMBER value is out of range in 'to_number'
select to_number(-1.0,'9999') FROM dual;
to_number(-1.0,'9999')
-1
select to_number(-0.000000,'999.999') FROM dual;
to_number(-0.000000,'999.999')
0
select to_number(-1.0,'9,999') FROM dual;
to_number(-1.0,'9,999')
-1
select to_number(-1.00,'9,999.9') FROM dual;
to_number(-1.00,'9,999.9')
-1
DROP TABLE IF EXISTS `test1`;
Warnings:
Note	1051	Unknown table 'test.test1'
CREATE TABLE `test1` (
`id` int NOT NULL,
`name` varchar(100) DEFAULT NULL,
fmt varchar(100) DEFAULT NULL,
deci decimal(50,10),
floa float(50,8),
PRIMARY KEY (`id`)
) ENGINE=InnoDB DEFAULT CHARSET=utf8mb4 COLLATE=utf8mb4_0900_ai_ci;
Warnings:
Warning	1681	Specifying number of digits for floating point data types is deprecated and will be removed in a future release.
INSERT INTO `test1` VALUES (1, '1,234.567','9,999.999',1234.567, 1234.567);
INSERT INTO `test1` VALUES (2, '12,12,12','99,99,99.999',121212, 121212);
INSERT INTO `test1` VALUES (3, '12,12,12.01','99,99,99.999',121212.01, 121212.01);
INSERT INTO `test1` VALUES (4, '4D2','XXX',4.4, 4.04);
INSERT INTO `test1` VALUES (5, 'ffff','XXXx',0xffff, 0xffff);
select floa,to_number(floa,'999999.999999999') from test1;
floa	to_number(floa,'999999.999999999')
1234.56701660	1234.5670166
121212.00000000	121212
121212.00781250	121212.0078125
4.03999996	4.03999996
65535.00000000	65535
select deci, to_number(deci,'999999.999') from test1;
deci	to_number(deci,'999999.999')
1234.5670000000	1234.567
121212.0000000000	121212
121212.0100000000	121212.01
4.4000000000	4.4
65535.0000000000	65535
select name, to_number(name,fmt) from test1;
name	to_number(name,fmt)
1,234.567	1234.567
12,12,12	121212
12,12,12.01	121212.01
4D2	1234
ffff	65535
DROP TABLE IF EXISTS `test1`;
select to_number(-1.6e+020,null) FROM dual;
to_number(-1.6e+020,null)
NULL
select to_number('-1.6e+020 ',null) FROM dual;
to_number('-1.6e+020 ',null)
NULL
select to_number(-1.6e+020,'') FROM dual;
ERROR HY000: Invalid argument error: args 1 in function to_number.
select to_number('-1.6e+020','') FROM dual;
ERROR HY000: Invalid argument error: args 1 in function to_number.
CREATE TABLE `test1` (
`id` int NOT NULL,
`name` varchar(100) DEFAULT NULL,
fmt varchar(100) DEFAULT NULL,
deci decimal(50,10),
floa float(50,8),
PRIMARY KEY (`id`)
) ENGINE=InnoDB DEFAULT CHARSET=utf8mb4 COLLATE=utf8mb4_0900_ai_ci;
Warnings:
Warning	1681	Specifying number of digits for floating point data types is deprecated and will be removed in a future release.
INSERT INTO `test1` VALUES (10, null,null,-1610000000, 1610000000);
INSERT INTO `test1` VALUES (11, '-0.19','9.90EEEE',-0.190, -0.19);
INSERT INTO `test1` VALUES (12, '-1.6e+020',null,-1610000000, 1610000000);
select name,to_number(name,fmt) from test1 where id=12;
name	to_number(name,fmt)
-1.6e+020	NULL
delete from test1;
INSERT INTO `test1` VALUES (1, '1,234.567','9,999.999',1234.567, 1234.567);
INSERT INTO `test1` VALUES (2, '12,12,12','99,99,99.999',-121212, 121212);
INSERT INTO `test1` VALUES (3, '12,12,12.01','99,99,99.999',121212.01, -121212.01);
INSERT INTO `test1` VALUES (4, '4D2','XXX',4.4, 4.04);
INSERT INTO `test1` VALUES (5, 'ffff','XXXx',0xffff, 0xffff);
INSERT INTO `test1` VALUES (6, '-,0','9.9EEEE',0.1, 0.1);
INSERT INTO `test1` VALUES (7, '1e+123', '9.9EEEE',123, 123.1);
select to_number(floa-deci,'999999.999999999999999') from test1;
to_number(floa-deci,'999999.999999999999999')
0.0000166016
242424
-242424.0178125
-0.3600000381
0
0.0000000015
0.0999984741
select to_number(floa+deci,'999999.999999999999999') from test1;
to_number(floa+deci,'999999.999999999999999')
2469.1340166016
0
0.0021875
8.4399999619
131070
0.2000000015
246.0999984741
delete from test1;
INSERT INTO `test1` VALUES (1, '1,234.567','9,999.999',1234.567, 1234.567);
INSERT INTO `test1` VALUES (2, '12,12,12','99,99,99.999',-121212, 121212);
INSERT INTO `test1` VALUES (3, '12,12,12.01','99,99,99.999',121212.01, -121212.01);
INSERT INTO `test1` VALUES (4, '4D2','XXX',4.4, 4.04);
INSERT INTO `test1` VALUES (5, 'ffff','XXXx',0xffff, 0xffff);
INSERT INTO `test1` VALUES (6, '-,0','9.9EEEE',0.1, 0.1);
INSERT INTO `test1` VALUES (7, '1e+78', '9.9EEEE',123, 123.1);
INSERT INTO `test1` VALUES (8, '-1.6e+020','9.9EEEE',-1610000000, 1610000000);
INSERT INTO `test1` VALUES (9, null,'9.9EEEE',-1610000000, 1610000000);
INSERT INTO `test1` VALUES (10, null,null,-1610000000, 1610000000);
INSERT INTO `test1` VALUES (11, '-0.19','9.90EEEE',-0.190, -0.19);
select * from test1 where id=9 and  to_number(name,fmt) is not null ;
id	name	fmt	deci	floa
select * from test1 where id=10 and  to_number(name,fmt) is not null ;
id	name	fmt	deci	floa
select * from test1 where to_number(name,fmt) is not null ;
id	name	fmt	deci	floa
1	1,234.567	9,999.999	1234.5670000000	1234.56701660
2	12,12,12	99,99,99.999	-121212.0000000000	121212.00000000
3	12,12,12.01	99,99,99.999	121212.0100000000	-121212.00781250
4	4D2	XXX	4.4000000000	4.03999996
5	ffff	XXXx	65535.0000000000	65535.00000000
6	-,0	9.9EEEE	0.1000000000	0.10000000
7	1e+78	9.9EEEE	123.0000000000	123.09999847
8	-1.6e+020	9.9EEEE	-1610000000.0000000000	1610000000.00000000
11	-0.19	9.90EEEE	-0.1900000000	-0.19000000
select * from test1 where to_number(name,fmt) is null ;
id	name	fmt	deci	floa
9	NULL	9.9EEEE	-1610000000.0000000000	1610000000.00000000
10	NULL	NULL	-1610000000.0000000000	1610000000.00000000
select * from test1 order by to_number(name,fmt);
id	name	fmt	deci	floa
9	NULL	9.9EEEE	-1610000000.0000000000	1610000000.00000000
10	NULL	NULL	-1610000000.0000000000	1610000000.00000000
8	-1.6e+020	9.9EEEE	-1610000000.0000000000	1610000000.00000000
11	-0.19	9.90EEEE	-0.1900000000	-0.19000000
6	-,0	9.9EEEE	0.1000000000	0.10000000
7	1e+78	9.9EEEE	123.0000000000	123.09999847
2	12,12,12	99,99,99.999	-121212.0000000000	121212.00000000
3	12,12,12.01	99,99,99.999	121212.0100000000	-121212.00781250
1	1,234.567	9,999.999	1234.5670000000	1234.56701660
4	4D2	XXX	4.4000000000	4.03999996
5	ffff	XXXx	65535.0000000000	65535.00000000
INSERT INTO `test1` VALUES (12, '-1.6e+020',null,-1610000000, 1610000000);
INSERT INTO `test1` VALUES (13, '-1.6e+014','9.9EEEE',-1610000000, 1610000000);
select * from test1 where to_number(name,fmt) is null and id<13;
id	name	fmt	deci	floa
9	NULL	9.9EEEE	-1610000000.0000000000	1610000000.00000000
10	NULL	NULL	-1610000000.0000000000	1610000000.00000000
12	-1.6e+020	NULL	-1610000000.0000000000	1610000000.00000000
select * from test1 where id=12 and  to_number(name,fmt) is  null ;
id	name	fmt	deci	floa
12	-1.6e+020	NULL	-1610000000.0000000000	1610000000.00000000
select * from test1 where id<13 order by to_number(name,fmt);
id	name	fmt	deci	floa
9	NULL	9.9EEEE	-1610000000.0000000000	1610000000.00000000
10	NULL	NULL	-1610000000.0000000000	1610000000.00000000
12	-1.6e+020	NULL	-1610000000.0000000000	1610000000.00000000
8	-1.6e+020	9.9EEEE	-1610000000.0000000000	1610000000.00000000
11	-0.19	9.90EEEE	-0.1900000000	-0.19000000
6	-,0	9.9EEEE	0.1000000000	0.10000000
7	1e+78	9.9EEEE	123.0000000000	123.09999847
2	12,12,12	99,99,99.999	-121212.0000000000	121212.00000000
3	12,12,12.01	99,99,99.999	121212.0100000000	-121212.00781250
1	1,234.567	9,999.999	1234.5670000000	1234.56701660
4	4D2	XXX	4.4000000000	4.03999996
5	ffff	XXXx	65535.0000000000	65535.00000000
DROP TABLE IF EXISTS `test1`;
select to_number('+12,12,12','99,99,99.99') from dual;
ERROR 22003: NUMBER value is out of range in 'to_number'
select to_number('-12,12,12','99,99,99.99') from dual;
to_number('-12,12,12','99,99,99.99')
-121212
select to_number(+12,12,12,'99,99,99.99') from dual;
ERROR 42000: You have an error in your SQL syntax; check the manual that corresponds to your MySQL server version for the right syntax to use near ',12,'99,99,99.99') from dual' at line 1
select to_number(-12,12,12,'99,99,99.99') from dual;
ERROR 42000: You have an error in your SQL syntax; check the manual that corresponds to your MySQL server version for the right syntax to use near ',12,'99,99,99.99') from dual' at line 1
SELECT to_number('+10.12','99.99') FROM dual;
ERROR 22003: NUMBER value is out of range in 'to_number'
SELECT to_number('-10.12','99.99') FROM dual;
to_number('-10.12','99.99')
-10.12
SELECT to_number(+10.12,'99.99') FROM dual;
to_number(+10.12,'99.99')
10.12
SELECT to_number(-10.12,'99.99') FROM dual;
to_number(-10.12,'99.99')
-10.12
SELECT to_number('+1.6E+02','9.9EEEE') FROM dual;
ERROR 22003: NUMBER value is out of range in 'to_number'
SELECT to_number('-1.6E+02','9.9EEEE') FROM dual;
to_number('-1.6E+02','9.9EEEE')
-160
SELECT to_number(+1.6E+02,'9.9EEEE') FROM dual;
ERROR 22003: NUMBER value is out of range in 'to_number'
SELECT to_number(-1.6E+02,'9.9EEEE') FROM dual;
ERROR 22003: NUMBER value is out of range in 'to_number'
SELECT to_number('+f','XXX') FROM dual;
ERROR 22003: NUMBER value is out of range in 'to_number'
SELECT to_number('-f','XXX') FROM dual;
to_number('-f','XXX')
-15
SELECT to_number(+f,'XXX') FROM dual;
ERROR 42S22: Unknown column 'f' in 'field list'
SELECT to_number(-f,'XXX') FROM dual;
ERROR 42S22: Unknown column 'f' in 'field list'
select to_number('19123..','999999.99') FROM dual;
ERROR HY000: Invalid argument error: args 0 is invald in function to_number.
select to_number(',, .','999999.99') FROM dual;
ERROR 22003: NUMBER value is out of range in 'to_number'
select to_number(' ','999999.99') FROM dual;
ERROR HY000: Invalid argument error: args 0 is invald in function to_number.
select to_number('ab','999999.99') FROM dual;
ERROR HY000: Invalid argument error: args 0 is invald in function to_number.
select to_number('$10','$99') from dual;
ERROR HY000: Invalid argument error: args 0 is invald in function to_number.
SELECT to_number('e+02','9.99EEEE') FROM dual;
ERROR 22003: NUMBER value is out of range in 'to_number'
SELECT to_number('-e+02','9.99EEEE') FROM dual;
ERROR 22003: NUMBER value is out of range in 'to_number'
SELECT to_number('+e+02','9.99EEEE') FROM dual;
ERROR 22003: NUMBER value is out of range in 'to_number'
SELECT to_number('1.1eee','9.9EEEE') FROM dual;
ERROR 22003: NUMBER value is out of range in 'to_number'
SELECT to_number('+.1e1','9.9EEEE') FROM dual;
ERROR 22003: NUMBER value is out of range in 'to_number'
SELECT to_number('.e','9.9EEEE') FROM dual;
ERROR 22003: NUMBER value is out of range in 'to_number'
SELECT to_number('1.e','9.9EEEE') FROM dual;
ERROR 22003: NUMBER value is out of range in 'to_number'
SELECT to_number('0.e','9.9EEEE') FROM dual;
ERROR 22003: NUMBER value is out of range in 'to_number'
select to_number('1,9,123','9,9,9,999') FROM dual;
to_number('1,9,123','9,9,9,999')
19123
select to_number('1,9,123','9,9G9,999') FROM dual;
ERROR HY000: Invalid argument error: 9,9G9,999 in function to_number.
select to_number('1,9,123','9G9,9,999') FROM dual;
ERROR HY000: Invalid argument error: 9G9,9,999 in function to_number.
select to_number('1,9,123','999,9G999') FROM dual;
ERROR HY000: Invalid argument error: 999,9G999 in function to_number.
SELECT to_number('12,454.80', '99G999D99') FROM dual;
to_number('12,454.80', '99G999D99')
12454.8
SELECT to_number('12,454.80', '99,999D99') FROM dual;
ERROR HY000: Invalid argument error: 99,999D99 in function to_number.
SELECT to_number('12,454.80', '99G999.99') FROM dual;
ERROR HY000: Invalid argument error: 99G999.99 in function to_number.
SELECT to_number('12G454D80', '99G999D99') FROM dual;
ERROR 22003: NUMBER value is out of range in 'to_number'
SELECT to_number('1,9,123,,,','9,9G9,999,') FROM dual;
ERROR HY000: Invalid argument error: 9,9G9,999, in function to_number.
SELECT to_number('12,454.80', '99,999D99') FROM dual;
ERROR HY000: Invalid argument error: 99,999D99 in function to_number.
select to_number('-.00','999.99') FROM dual;
to_number('-.00','999.99')
0
select to_number('-.01','999.99') FROM dual;
to_number('-.01','999.99')
-0.01
select to_number('-.1','999.99') FROM dual;
to_number('-.1','999.99')
-0.1
select to_number('.00','9.99') from dual;
to_number('.00','9.99')
0
select to_number('-','999.') FROM dual;
ERROR HY000: Invalid argument error: args 0 is invald in function to_number.
select to_number('-','999') FROM dual;
ERROR HY000: Invalid argument error: args 0 is invald in function to_number.
select to_number('+','999') FROM dual;
ERROR HY000: Invalid argument error: args 0 is invald in function to_number.
select to_number(to_char(1234.7,'999999990D90'),'9999.99') FROM dual;
to_number(to_char(1234.7,'999999990D90'),'9999.99')
1234.7
select to_number(TO_CHAR(16,'XXXX'),'XXXX') from dual;
to_number(TO_CHAR(16,'XXXX'),'XXXX')
16
select to_number('   10','XXXX') from dual;
to_number('   10','XXXX')
16
select to_number('   10','99') from dual;
to_number('   10','99')
10
select to_number('   10','9999999999') from dual;
to_number('   10','9999999999')
10
select to_number(' 1','999999') from dual;
to_number(' 1','999999')
1
select to_number('10    ','XXXX') from dual;
ERROR 22003: NUMBER value is out of range in 'to_number'
select to_number('10    ','99') from dual;
ERROR 22003: NUMBER value is out of range in 'to_number'
select to_number('10        ','9999999') from dual;
ERROR 22003: NUMBER value is out of range in 'to_number'
select to_number('9,,,123,,,','9,9,9,999,') FROM dual;
ERROR 22003: NUMBER value is out of range in 'to_number'
select to_number('1,,1,,1','9,9,9.99') FROM dual;
ERROR 22003: NUMBER value is out of range in 'to_number'
select to_number(',123,','9,9,9,999,') FROM dual;
to_number(',123,','9,9,9,999,')
123
select to_number(',123','9,9,9,999') FROM dual;
to_number(',123','9,9,9,999')
123
select to_number('123,','9,9,9,999,') FROM dual;
to_number('123,','9,9,9,999,')
123
select to_number('1,123,','9,9,9,999,') FROM dual;
to_number('1,123,','9,9,9,999,')
1123
select to_number('9,123,,,','9,9,9,999,') FROM dual;
to_number('9,123,,,','9,9,9,999,')
9123
select to_number('9,123,,,','9,9,9,999') FROM dual;
to_number('9,123,,,','9,9,9,999')
9123
select to_number('3,2,,1','9,9,9.99') FROM dual;
to_number('3,2,,1','9,9,9.99')
321
select to_number('1,,1,,1','9,9,9.99') FROM dual;
ERROR 22003: NUMBER value is out of range in 'to_number'
select to_number('9,,,123,,,','9,9,9,999,') FROM dual;
ERROR 22003: NUMBER value is out of range in 'to_number'
select to_number('1,,,1,,1','9,9,9.99') FROM dual;
ERROR 22003: NUMBER value is out of range in 'to_number'
select to_number('9,,,,123,,,','9,9,9,999,') FROM dual;
ERROR 22003: NUMBER value is out of range in 'to_number'
select to_number('10    ','9999999999') from dual;
ERROR 22003: NUMBER value is out of range in 'to_number'
select to_number('1   0','9999999999') from dual;
ERROR 22003: NUMBER value is out of range in 'to_number'
select to_number('10    ','999,9999999') from dual;
ERROR 22003: NUMBER value is out of range in 'to_number'
select to_number('1   0','999,9999999') from dual;
ERROR 22003: NUMBER value is out of range in 'to_number'
select to_number('    10','9999999999') from dual;
to_number('    10','9999999999')
10
select to_number('    10','999,9999999') from dual;
to_number('    10','999,9999999')
10
SELECT to_number('1.12','90.99') FROM dual;
to_number('1.12','90.99')
1.12
SELECT to_number(1.12,'90.99') FROM dual;
to_number(1.12,'90.99')
1.12
SELECT to_number(-1.12,'90.99') FROM dual;
to_number(-1.12,'90.99')
-1.12
SELECT to_number('01.12','09.99') FROM dual;
to_number('01.12','09.99')
1.12
SELECT to_number('-01.12','09.99') FROM dual;
to_number('-01.12','09.99')
-1.12
SELECT to_number('1.12','09.99') FROM dual;
ERROR 22003: NUMBER value is out of range in 'to_number'
SELECT to_number(1.12,'09.99') FROM dual;
ERROR 22003: NUMBER value is out of range in 'to_number'
SELECT to_number(+0.12,'0.99') FROM dual;
ERROR 22003: NUMBER value is out of range in 'to_number'
SELECT to_number(-0.12,'0.99') FROM dual;
ERROR 22003: NUMBER value is out of range in 'to_number'
SELECT to_number(0.12,'0.99') FROM dual;
ERROR 22003: NUMBER value is out of range in 'to_number'
SELECT to_number('+0.12','0.99') FROM dual;
ERROR 22003: NUMBER value is out of range in 'to_number'
SELECT to_number('-0.12','0.99') FROM dual;
to_number('-0.12','0.99')
-0.12
SELECT to_number('0.12','0.99') FROM dual;
to_number('0.12','0.99')
0.12
SELECT to_number(+1.12,'0.99') FROM dual;
to_number(+1.12,'0.99')
1.12
SELECT to_number(-1.12,'0.99') FROM dual;
to_number(-1.12,'0.99')
-1.12
SELECT to_number(1.12,'0.99') FROM dual;
to_number(1.12,'0.99')
1.12
SELECT to_number(+0.12,'9.99') FROM dual;
to_number(+0.12,'9.99')
0.12
SELECT to_number(-0.12,'9.99') FROM dual;
to_number(-0.12,'9.99')
-0.12
SELECT to_number(0.12,'9.99') FROM dual;
to_number(0.12,'9.99')
0.12
DROP TABLE IF EXISTS t1;
Warnings:
Note	1051	Unknown table 'test.t1'
create table t1(
id int,
c1 char(20),
c2 varchar(50),
c3 float(15),
c4 decimal(15,5),
c5 number(15,5)
) ;
insert into t1 values (1,'000123','1.6E+08',1313.12,1234.567,1234.567);
insert into t1 values (2,null,'-1.6e+020','-1313.12',-1234.567,'-1234.567');
insert into t1 values (3,'aaaa',null,'2313',null,null);
insert into t1 values (4,'0000','1.00E10','-2313',-121212.01,-1610000000);
insert into t1 values (5,'123000','1,123,1234.1234','1234.00',-0.190, -0.19);
insert into t1 values (6,'-123000','1,234.5670',null,0.190, 0.19);
insert into t1 values (7,'1234.00','4Dd2',-121212.12,121212.01,7877.12600);
insert into t1 values (8,'-1234.00','0xFFFF',0xffff, '1234567890',0xffff);
select id,c4,to_number(cast(c4 as float),'999,99999.999') c5 from t1 where id in(1,2,3,5,6);
id	c4	c5
1	1234.56700	1234.57
2	-1234.56700	-1234.57
3	NULL	NULL
5	-0.19000	-0.19
6	0.19000	0.19
select id,c4,to_number(to_char(c4,'999,99999.999'),'999,99999.999') c5 from t1 where id in(1,2,3,5,6);
id	c4	c5
1	1234.56700	1234.567
2	-1234.56700	-1234.567
3	NULL	NULL
5	-0.19000	-0.19
6	0.19000	0.19
select id,c4,to_number(to_char(c4,'999,99999.999'),'999,99999.999') c4 from t1 where id!=8;
id	c4	c4
1	1234.56700	1234.567
2	-1234.56700	-1234.567
3	NULL	NULL
4	-121212.01000	-121212.01
5	-0.19000	-0.19
6	0.19000	0.19
7	121212.01000	121212.01
DROP TABLE IF EXISTS t1;
create table t1(
id int,
c1 char(20)
) ;
insert into t1 values (1,'000123');
insert into t1 values (3,'20220902');
insert into t1 values (4,' 20220902 ');
SELECT to_number(substr(t1.c1, 1, 2)),t1.c1 from t1;
to_number(substr(t1.c1, 1, 2))	c1
0	000123
20	20220902
2	 20220902
SELECT C1 from t1;
C1
000123
20220902
 20220902
DROP TABLE IF EXISTS t1;
