set sql_mode='oracle';
drop table if exists t1,t2;
create table t1 (a int auto_increment , primary key (a));
insert into t1 values (NULL),(NULL),(NULL),(NULL),(NULL),(NULL),(NULL),(NULL),(NULL),(NULL),(NULL),(NULL),(NULL),(NULL),(NULL),(NULL),(NULL),(NULL),(NULL),(NULL),(NULL),(NULL),(NULL),(NULL),(NULL),(NULL),(NULL),(NULL),(NULL),(NULL),(NULL),(NULL),(NULL),(NULL),(NULL),(NULL);
update t1 set (a) = (a+1) where a > 35;
select * from t1;
a
1
2
3
4
5
6
7
8
9
10
11
12
13
14
15
16
17
18
19
20
21
22
23
24
25
26
27
28
29
30
31
32
33
34
35
37
update t1 set (a) = (a+100) where a > 0;
select * from t1;
a
101
102
103
104
105
106
107
108
109
110
111
112
113
114
115
116
117
118
119
120
121
122
123
124
125
126
127
128
129
130
131
132
133
134
135
137
update t1 set (a) = a+100 limit 0;
select * from t1;
a
101
102
103
104
105
106
107
108
109
110
111
112
113
114
115
116
117
118
119
120
121
122
123
124
125
126
127
128
129
130
131
132
133
134
135
137
update t1 set () = (a+1);
ERROR 42000: This version of MySQL doesn't yet support 'update set with empty variable.'
update t1 set (a) = default;
ERROR 42000: This version of MySQL doesn't yet support 'update set with DEFAULT variable.'
drop table t1;
CREATE TABLE t1
(
place_id int (10) unsigned NOT NULL,
shows int(10) unsigned DEFAULT '0' NOT NULL,
ishows int(10) unsigned DEFAULT '0' NOT NULL,
ushows int(10) unsigned DEFAULT '0' NOT NULL,
clicks int(10) unsigned DEFAULT '0' NOT NULL,
iclicks int(10) unsigned DEFAULT '0' NOT NULL,
uclicks int(10) unsigned DEFAULT '0' NOT NULL,
ts timestamp,
PRIMARY KEY (place_id,ts)
);
INSERT INTO t1 (place_id,shows,ishows,ushows,clicks,iclicks,uclicks,ts)
VALUES (1,0,0,0,0,0,0,20000928174434);
UPDATE t1 SET (shows,ishows,ushows,clicks,iclicks,uclicks) = (shows+1,ishows+1,ushows+1,clicks+1,iclicks+1,uclicks+1) WHERE place_id=1 AND ts>='2000-09-28 00:00:00';
select * from t1;
place_id	shows	ishows	ushows	clicks	iclicks	uclicks	ts
1	1	1	1	1	1	1	2000-09-28 17:44:34
drop table t1;
create table t1 (a int not null, b int not null, key (a));
insert into t1 values (1,1),(1,2),(1,3),(3,1),(3,2),(3,3),(3,1),(3,2),(3,3),(2,1),(2,2),(2,3);
SET @tmp=0;
update t1 set (b)=(@tmp:=@tmp+1) order by a;
select * from t1;
a	b
1	1
1	2
1	3
3	7
3	8
3	9
3	10
3	11
3	12
2	4
2	5
2	6
update t1 set (b)=(99) where a=1 order by b asc limit 1;
select * from t1 order by a,b;
a	b
1	2
1	3
1	99
2	4
2	5
2	6
3	7
3	8
3	9
3	10
3	11
3	12
update t1 set (b)=100 where a=1 order by b desc limit 2;
select * from t1;
a	b
1	100
1	2
1	100
3	7
3	8
3	9
3	10
3	11
3	12
2	4
2	5
2	6
update t1 set (b)=a+10+b where a=1 order by b;
select * from t1 order by a,b;
a	b
1	13
1	111
1	111
2	4
2	5
2	6
3	7
3	8
3	9
3	10
3	11
3	12
create table t2 (a int not null, b int not null);
insert into t2 values (1,1),(1,2),(1,3);
update t1 set (b)=(select distinct 1 from (select * from t2) a);
select * from t1;
a	b
1	1
1	1
1	1
3	1
3	1
3	1
3	1
3	1
3	1
2	1
2	1
2	1
drop table t1,t2;
CREATE TABLE t1 ( 
`colA` int(10) unsigned NOT NULL auto_increment,
`colB` int(11) NOT NULL default '0',
PRIMARY KEY  (`colA`)
);
INSERT INTO t1 VALUES (4433,5424);
CREATE TABLE t2 (
`colC` int(10) unsigned NOT NULL default '0',
`colA` int(10) unsigned NOT NULL default '0',
`colD` int(10) unsigned NOT NULL default '0',
`colE` int(10) unsigned NOT NULL default '0',
`colF` int(10) unsigned NOT NULL default '0',
PRIMARY KEY  (`colC`,`colA`,`colD`,`colE`)
);
INSERT INTO t2 VALUES (3,4433,10005,495,500);
INSERT INTO t2 VALUES (3,4433,10005,496,500);
INSERT INTO t2 VALUES (3,4433,10009,494,500);
INSERT INTO t2 VALUES (3,4433,10011,494,500);
INSERT INTO t2 VALUES (3,4433,10005,497,500);
INSERT INTO t2 VALUES (3,4433,10013,489,500);
INSERT INTO t2 VALUES (3,4433,10005,494,500);
INSERT INTO t2 VALUES (3,4433,10005,493,500);
INSERT INTO t2 VALUES (3,4433,10005,492,500);
UPDATE IGNORE t2,t1 set (t2.colE,colF)=(t2.colE + 1,0) WHERE t1.colA = t2.colA AND (t1.colB & 4096) > 0 AND (colE + 1) < colF;
SELECT * FROM t2;
colC	colA	colD	colE	colF
3	4433	10005	492	500
3	4433	10005	493	500
3	4433	10005	494	500
3	4433	10005	495	500
3	4433	10005	496	500
3	4433	10005	498	0
3	4433	10009	495	0
3	4433	10011	495	0
3	4433	10013	490	0
DROP TABLE t1;
DROP TABLE t2;
create table t1 (c1 int, c2 char(6), c3 int);
create table t2 (c1 int, c2 char(6));
insert into t1 values (1, 't1c2-1', 10), (2, 't1c2-2', 20);
update t1 left join t2 on t1.c1 = t2.c1 set (t2.c2) = ('t2c2-1');
select * from t2;
c1	c2
update t1 left join t2 on t1.c1 = t2.c1 set (t2.c2) = ('t2c2-1') where t1.c3 = 10;
select * from t2;
c1	c2
drop table t1, t2;
create table t1 ( a int, b int default 0, index (a) );
insert into t1 (a) values (0),(0),(0),(0),(0),(0),(0),(0);
select * from t1;
a	b
0	0
0	0
0	0
0	0
0	0
0	0
0	0
0	0
update t1 set (a,b)=(a+10,1) order by a limit 3;
select * from t1;
a	b
10	1
10	1
10	1
0	0
0	0
0	0
0	0
0	0
update t1 set (a,b)=(a+11,2) order by a limit 3;
select * from t1;
a	b
10	1
10	1
10	1
0	0
11	2
11	2
0	0
11	2
update t1 set (a,b)=(a+12,3) order by a limit 3;
select * from t1 order by a;
a	b
10	1
10	1
11	2
11	2
11	2
12	3
12	3
22	3
drop table t1;
End of 5.0 tests
#
# test of TEMPORARY TABLE
#
CREATE TABLE t1 (f1 INTEGER AUTO_INCREMENT, PRIMARY KEY (f1));
CREATE TEMPORARY TABLE t2 LIKE t1;
INSERT INTO t1 VALUES (1);
INSERT INTO t2 VALUES (1);
ALTER TABLE t2 COMMENT = 'ABC';
UPDATE t2, t1 SET (t2.f1,t1.f1)=(2,9);
select * from t1;
f1
9
select * from t2;
f1
2
ALTER TABLE t2 COMMENT = 'DEF';
DROP TABLE t1, t2;
#
# test of view
# 
CREATE TABLE t1 ( a INT, c int, KEY( a ) );
INSERT INTO t1 VALUES (0,0), (1,1);
CREATE VIEW v1 AS SELECT t11.a, t12.a AS b, t11.c FROM t1 t11, t1 t12;
UPDATE v1 SET (a,c) = (1,4);
select * from v1 ;
a	b	c
1	1	4
1	1	4
1	1	4
1	1	4
select * from t1 ;
a	c
1	4
1	4
DROP TABLE t1;
DROP VIEW v1;
# Bug #21143080: UPDATE ON VARCHAR AND TEXT COLUMNS PRODUCE INCORRECT
#                RESULTS
CREATE TABLE t1 (a VARCHAR(50), b TEXT, c CHAR(50)) ENGINE=INNODB;
INSERT INTO t1 (a, b, c) VALUES ('start trail', '', 'even longer string');
UPDATE t1 SET (b,a)=(a,'inject');
SELECT a, b FROM t1;
a	b
inject	start trail
UPDATE t1 SET (b,c)=(c,'inject');
SELECT c, b FROM t1;
c	b
inject	even longer string
DROP TABLE t1;
create table t1 (c1 int, c2 varchar(100), c3 int);
create table t2 (c1 int, c2 varchar(100));
insert into t1 values (1, 't1c2-1', 10), (2, 't1c2-2', 20),(3, 't1c3-3', 30);
insert into t2 values (10, 't2c2-10'), (20, 't2c2-20');
update t1 fir set (fir.c1,fir.c2,fir.c3) = (select sec.c1,sec.c2,sec.c1 from t2 sec where sec.c1=10) where fir.c1=1;
select * from t1;
c1	c2	c3
10	t2c2-10	10
2	t1c2-2	20
3	t1c3-3	30
update t1 fir set (fir.c1,fir.c2,fir.c3) = (select sec.c1,sec.c2,sec.c1 from t2 sec where sec.c1=3) where fir.c1=2;
select * from t1;
c1	c2	c3
10	t2c2-10	10
NULL	NULL	NULL
3	t1c3-3	30
update t1 fir set (fir.c1,fir.c2,fir.c3) = (select sec.c1,sec.c2,sec.c1 from t2 sec where sec.c1=10) where fir.c1=10;
select * from t1;
c1	c2	c3
10	t2c2-10	10
NULL	NULL	NULL
3	t1c3-3	30
DROP TABLE t1,t2;
create table t1 (c1 int, c2 varchar(100), c3 int);
create table t2 (c1 int, c2 varchar(100));
create table t3 (c1 int, c2 varchar(100),c3 int, c4 varchar(100));
insert into t1 values (1, 't1c2-1', 10), (2, 't1c2-2', 20),(3, 't1c3-3', 30);
insert into t2 values (1, 't2c2-10'), (20, 't2c2-20'),(2, 't2c2-2');
insert into t3 values (100, 't3c2-100', 100,'t3c2-100'), (200, 't3c2-200', 200,'t3c2-200'),(300, 't3c3-300', 300,'t3c2-300');
update t1 fir,t2 sec set (fir.c1,fir.c2,fir.c3,sec.c1,sec.c2) = (select thir.c1,thir.c2,thir.c3,thir.c1,thir.c4 from t3 thir where thir.c1=100) where fir.c1=sec.c1;
ERROR 42000: This version of MySQL doesn't yet support 'update set with more than one table.'
UPDATE t2 SET (c1, c2)=(SELECT * FROM t2) WHERE c1=1;
ERROR HY000: You can't specify target table 't2' for update in FROM clause
update t1 fir set (fir.c1,fir.c2,fir.c3) = (select thir.c1,thir.c2,sec.c1 from t2 sec,t3 thir where thir.c1=100 and sec.c1=20) where fir.c1=2;
select * from t1;
c1	c2	c3
1	t1c2-1	10
100	t3c2-100	20
3	t1c3-3	30
update t1 fir set (fir.c1,fir.c2,fir.c3) = (select thir.c1,thir.c2,sec.c1 from t2 sec,t3 thir where thir.c1=100 and sec.c1=20) order by fir.c1 desc limit 2;
select * from t1;
c1	c2	c3
1	t1c2-1	10
100	t3c2-100	20
100	t3c2-100	20
truncate table t1;
insert into t1 values (4, 't1c2-4', 40), (5, 't1c2-5', 50),(6, 't1c3-6', 60);
alter table t2 drop c2;
update t1 fir set (fir.c1,fir.c2,fir.c3) = (select thir.c1,thir.c2,sec.c1 from t2 sec,t3 thir where thir.c1=100 and sec.c1=20) where fir.c1=4;
select * from t1;
c1	c2	c3
100	t3c2-100	20
5	t1c2-5	50
6	t1c3-6	60
DROP TABLE t1,t2,t3;
create table t1 (c1 int, c2 varchar(100), c3 int);
create table t2 (c1 int, c2 varchar(100));
insert into t1 values (1, 't1c2-1', 10), (2, 't1c2-2', 20),(3, 't1c3-3', 30);
insert into t2 values (10, 't2c2-10'), (20, 't2c2-20');
CREATE or replace procedure p1() as
var int;
begin
update t1 fir set (fir.c1,fir.c2,fir.c3) = (select sec.c1,sec.c2,sec.c1 from t2 sec where sec.c1=10) where fir.c1=1;
select c3 into var from t1 where c1=10;
select var;
end//
call p1;
var
10
select * from t1;
c1	c2	c3
10	t2c2-10	10
2	t1c2-2	20
3	t1c3-3	30
truncate table t1;
insert into t1 values (1, 't1c2-1', 10), (2, 't1c2-2', 20),(3, 't1c3-3', 30);
call p1;
var
10
select * from t1;
c1	c2	c3
10	t2c2-10	10
2	t1c2-2	20
3	t1c3-3	30
drop procedure p1;
DROP TABLE t1,t2;
# test of function
#
CREATE TABLE t1 (a VARCHAR(50), b VARCHAR(50), c CHAR(50)) ENGINE=INNODB;
INSERT INTO t1 (a, b, c) VALUES ('start trail', 'bb', 'even longer string');
UPDATE t1 SET (a,b,c)=(concat(a,b),concat(b,c),translate(a,'t','@@'));
SELECT * FROM t1;
a	b	c
start trailbb	bbeven longer string	s@ar@ @railbb
drop table t1;
# test of DDL
#
CREATE TABLE t1 (a VARCHAR(50), b VARCHAR(50), c CHAR(50)) ENGINE=INNODB;
INSERT INTO t1 (a, b, c) VALUES ('start trail', 'bb', 'even longer string');
UPDATE t1 SET (a,b,c)=(concat(a,b),concat(b,c),translate(a,'t','@@'));
SELECT * FROM t1;
a	b	c
start trailbb	bbeven longer string	s@ar@ @railbb
truncate table t1;
INSERT INTO t1 (a, b, c) VALUES ('start trail', 'bb', 'even longer string');
UPDATE t1 SET (a,b,c)=('start trail1', 'bb1', 'even longer string1');
SELECT * FROM t1;
a	b	c
start trail1	bb1	even longer string1
alter table t1 add i INT FIRST;
INSERT INTO t1 (a, b, c) VALUES ('start trailadd', 'bbadd', 'even longer stringadd');
UPDATE t1 SET (i,a,b,c)=(1,'start trail1', 'bb1', 'even longer string1') where a='start trailadd';
SELECT * FROM t1;
i	a	b	c
NULL	start trail1	bb1	even longer string1
1	start trail1	bb1	even longer string1
alter table t1 drop c;
UPDATE t1 SET (i,a,b)=(2,'start traildrop', 'bbdrop');
SELECT * FROM t1;
i	a	b
2	start traildrop	bbdrop
2	start traildrop	bbdrop
ALTER TABLE t1 ALTER i SET DEFAULT 1000;
INSERT INTO t1 (a, b) VALUES ('start traildef', 'bbdef');
UPDATE t1 SET (a,b)=('start traildefup', 'bbdefup');
SELECT * FROM t1;
i	a	b
2	start traildefup	bbdefup
2	start traildefup	bbdefup
1000	start traildefup	bbdefup
ALTER TABLE t1 RENAME TO t2;
UPDATE t2 SET (i,a,b)=(3,'start trailrename', 'bbrename') where i=1000;
SELECT * FROM t2;
i	a	b
2	start traildefup	bbdefup
2	start traildefup	bbdefup
3	start trailrename	bbrename
drop table t2;
# test of view and null value
#
CREATE TABLE data (c1 int, c2 CHAR(10));
INSERT INTO data VALUES (11, 'c 1'), (12, null), (null, 'null c1');
CREATE VIEW v_1 AS SELECT * FROM data;
CREATE TABLE tt1 (tc1 int,tc2 char(10));
INSERT INTO tt1 VALUES (1,'aaa'), (2,'bbb'), (3,'ccc');
UPDATE tt1 SET (tc1, tc2)=(SELECT * FROM v_1 where c1=10) WHERE tc1=1;
select * from tt1;
tc1	tc2
NULL	NULL
2	bbb
3	ccc
UPDATE tt1 SET (tc1, tc2)=(SELECT * FROM v_1 where c1=11) WHERE tc1 is null;
select * from tt1;
tc1	tc2
11	c 1
2	bbb
3	ccc
UPDATE tt1 SET (tc1, tc2)=(SELECT * FROM v_1 where c1 is null) WHERE tc1=2;
select * from tt1;
tc1	tc2
11	c 1
NULL	null c1
3	ccc
UPDATE tt1 SET (tc1, tc2)=(SELECT * FROM v_1 where c2 is null) WHERE tc1=3;
select * from tt1;
tc1	tc2
11	c 1
NULL	null c1
12	NULL
drop table data,tt1;
drop view v_1;
# test of tmp table and null value
#
CREATE TEMPORARY TABLE t12(c1 int, c2 CHAR(10));
INSERT INTO t12 VALUES (10, 'aa'), (12, null), (null, 'ccc');
CREATE TABLE tt1 (tc1 int,tc2 char(10));
INSERT INTO tt1 VALUES (1,'aaa'), (2,'bbb'), (3,'ccc');
UPDATE tt1 SET (tc1, tc2)=(SELECT * FROM t12 where c1=10) WHERE tc1=1;
select * from tt1;
tc1	tc2
10	aa
2	bbb
3	ccc
UPDATE tt1 SET (tc1, tc2)=(SELECT * FROM t12 where c1=11) WHERE tc1=10;
select * from tt1;
tc1	tc2
NULL	NULL
2	bbb
3	ccc
UPDATE tt1 SET (tc1, tc2)=(SELECT * FROM t12 where c1 is null) WHERE tc1=2;
select * from tt1;
tc1	tc2
NULL	NULL
NULL	ccc
3	ccc
UPDATE tt1 SET (tc1, tc2)=(SELECT * FROM t12 where c2 is null) WHERE tc1=3;
select * from tt1;
tc1	tc2
NULL	NULL
NULL	ccc
12	NULL
drop table t12,tt1;
# test of trigger
#
CREATE TEMPORARY TABLE t12(c1 int, c2 CHAR(10));
INSERT INTO t12 VALUES (10, 'aa'), (12, null), (null, 'ccc');
CREATE TABLE tt1 (tc1 int,tc2 char(10));
INSERT INTO tt1 VALUES (1,'aaa'), (2,'bbb'), (3,'ccc');
CREATE TABLE data (c1 int, c2 CHAR(10));
INSERT INTO data VALUES (11, 'c 1'), (12, null), (null, 'null c1');
CREATE TRIGGER SumOfSalary
BEFORE INSERT ON data
FOR EACH ROW
UPDATE tt1 SET (tc1, tc2)=(SELECT * FROM t12 where c1=10) WHERE tc1=3;
INSERT INTO data VALUES (4,'ddd');
select * from tt1;
tc1	tc2
1	aaa
2	bbb
10	aa
drop TRIGGER SumOfSalary;
drop table t12,tt1,data;
# test of subquery
#
CREATE TEMPORARY TABLE t12(c1 int, c2 CHAR(10));
INSERT INTO t12 VALUES (10, 'aa'), (12, null), (null, 'ccc');
CREATE TABLE tt1 (c1 int,c2 char(10),c3 int);
INSERT INTO tt1 VALUES (10,'tt1aa',10), (2,'tt1bbb',20), (3,'tt1ccc',30);
update tt1 fir set (fir.c1,c2,fir.c3) = (select sec.c1,c2,c1 from t12 sec where c1=fir.c1) where c1=10;
select * from tt1;
c1	c2	c3
10	aa	10
2	tt1bbb	20
3	tt1ccc	30
drop table t12,tt1;
# test of bug#7479
#
create table zgh_t1(a int, b char,c char,d int);
insert into zgh_t1 values(1,'a',1,3);
insert into zgh_t1 values(2,'b',2,4);
insert into zgh_t1 values(3,'c',3,5);
create table zgh_t2 as select * from zgh_t1;
alter table zgh_t2 modify a int primary key;
update zgh_t2 set b='d',c=2,d=6;
insert into zgh_t2 values(4,'d',2,7);
insert into zgh_t2 values(5,'e',2,8);
insert into zgh_t2 values(6,'f',2,9);
select * from zgh_t1;
a	b	c	d
1	a	1	3
2	b	2	4
3	c	3	5
select * from zgh_t2;
a	b	c	d
1	d	2	6
2	d	2	6
3	d	2	6
4	d	2	7
5	e	2	8
6	f	2	9
update zgh_t2 set (a,b,c)=(c,d);
ERROR 42000: This version of MySQL doesn't yet support 'update set with different column size.'
update zgh_t2 set (b,c,d)=(select b,c,d from zgh_t1 where zgh_t1.a=zgh_t2.a) where c in (select c from zgh_t1);
select * from zgh_t2;
a	b	c	d
1	a	1	3
2	b	2	4
3	c	3	5
4	NULL	NULL	NULL
5	NULL	NULL	NULL
6	NULL	NULL	NULL
UPDATE zgh_t1
JOIN zgh_t2 ON zgh_t1.a = zgh_t2.a
SET (zgh_t1.a,zgh_t1.b,zgh_t1.c)=(select a,b,c from zgh_t2);
ERROR 42000: This version of MySQL doesn't yet support 'update set with join table.'
UPDATE (zgh_t1
JOIN zgh_t2 ON zgh_t1.a = zgh_t2.a)
SET (zgh_t1.a,zgh_t1.b,zgh_t1.c)=(select a,b,c from zgh_t2);
ERROR 42000: This version of MySQL doesn't yet support 'update set with join table.'
drop table zgh_t2;
# test of bug#8373
#
CREATE OR REPLACE TYPE t_air as object(id int,type varchar(10));
CREATE OR REPLACE TYPE t_air_table AS TABLE OF t_air;
create table temp1 as select * from table(t_air_table(t_air(1,'aa'),t_air(2,'bb'),t_air(3,'aa'),t_air(4,'bb')));
UPDATE temp1 SET (id,type)=(select * from table(t_air_table(t_air(7777,'setTable()')))) 
WHERE type IN (select type from table(t_air_table(t_air(3,'aa'),t_air(4,'bb'))) );
# test of vfield
#
CREATE TABLE `triangle1` (
`sidea` INT(11) DEFAULT NULL,
`sideb` INT(11) DEFAULT NULL,
`sidec` INT(11) GENERATED ALWAYS AS (SQRT(((`sidea` * `sidea`) + (`sideb` * `sideb`)))) VIRTUAL
) ENGINE=INNODB DEFAULT CHARSET=utf8mb4;
Warnings:
Warning	1681	Integer display width is deprecated and will be removed in a future release.
Warning	1681	Integer display width is deprecated and will be removed in a future release.
Warning	1681	Integer display width is deprecated and will be removed in a future release.
insert into triangle1(sidea,sideb) values(2,4),(3,2);
select * from triangle1;
sidea	sideb	sidec
2	4	4
3	2	4
update triangle1 set (sidea,sideb)=(select c,d from zgh_t1 where zgh_t1.a=triangle1.sidea) where sideb in (select c from zgh_t1);
select * from triangle1;
sidea	sideb	sidec
2	4	4
3	5	6
# test of bug9050
#
create table test1(a int,b varchar(10));
insert into test1 values(1,'aa'),(null,'bb'),(2,null);
create view view1 as select * from test1;
select * from view1;
a	b
1	aa
NULL	bb
2	NULL
update view1 set (a,b)=(select 10,20 from dual);
select * from view1;
a	b
10	20
10	20
10	20
update view1 set (a,b)=(select c,b from zgh_t1 where a=3);
select * from view1;
a	b
3	c
3	c
3	c
drop table test1;
drop view view1;
drop table zgh_t1;
drop table triangle1;
drop table temp1;
drop type t_air_table;
drop type t_air;
create table t1(id int, c1 varchar2(32), c2 timestamp(3));
insert into t1 values(1, 'aaaa', '2038-01-19 03:14:07.123');
insert into t1 values(2, 'bbbb', '2028-01-19 03:14:07.123');
select * from t1;
id	c1	c2
1	aaaa	2038-01-19 03:14:07.123
2	bbbb	2028-01-19 03:14:07.123
update t1 set (c1,c2) = (select  '123.456' ,to_date('2023-01-02 10:11:12 PM', 'YYYY-MM-DD HH12:MI:SS PM') from dual) where id = 1;
select * from t1;
id	c1	c2
1	123.456	2023-01-02 22:11:12.000
2	bbbb	2028-01-19 03:14:07.123
drop table t1;
# test of bug11163
#
set @@udt_format_result=dba;
create type tp310 as object(id int,type varchar(20));
create type tp311 is object(id2 int,name2 varchar(20));
create type tp312 as object(id3 int,name3 varchar(20));
create table tbl133 (
id int auto_increment,
f1 tp310 default null, 
primary key (id)
);
create table tbl134 (
id int auto_increment,
f1 tp310 default null, 
f2 tp311,
primary key (id)
);
insert into tbl133 select 1,tp310(1,'aaaaa');
alter table tbl133 add f2 tp311;
insert into tbl133(id,f1,f2) values(   2, tp310(2,'bbbbb'),  tp311(null,null));
insert into tbl133(f2) select (tp311(3,'ccccc'));
alter table tbl133 add f2_2 tp311;
alter table tbl133 add f3 tp312;
insert into tbl133 values (4,tp310(4,'ddd'||'DDDD'), tp311(nvl2(null,rownum,rownum+1),null), null, tp312(4,initcap('hello world')));
insert into tbl133 select 5, tp310(5,'eeee'), tp311(5,'eeee'), tp311(5,'eeee'),tp312(5,'eeee');
insert into tbl133 select 6, tp310(null,'NULL'), tp311(null,'fffff'), tp311(null,null),  tp312(6,null);
insert into   tbl134(f1,f2) select f1, f2 from tbl133  where  f2 is not null limit 2;
insert into tbl134 values (101, tp310(101,'101aaa'), tp311(101,'101aaa') );
insert into tbl134 values (  102, tp310(2,'bbbbb'),  tp311(3,'ccccc'));
insert into tbl134 values (  103,null, tp311(null,'NULL'));
update  tbl133 a
set  (a.f1,a.f3) = ( select  b.f1,tp312(999,'999-update')  from   tbl134 b where  b.id=1  )
where  a.id=1;
table tbl133;
id	f1	f2	f2_2	f3
1	id:2 | type:bbbbb	NULL	NULL	id3:999 | name3:999-update
2	id:2 | type:bbbbb	id2:NULL | name2:NULL	NULL	NULL
3	NULL	id2:3 | name2:ccccc	NULL	NULL
4	id:4 | type:dddDDDD	id2:1 | name2:NULL	NULL	id3:4 | name3:Hello World
5	id:5 | type:eeee	id2:5 | name2:eeee	id2:5 | name2:eeee	id3:5 | name3:eeee
6	id:NULL | type:NULL	id2:NULL | name2:fffff	id2:NULL | name2:NULL	id3:6 | name3:NULL
drop table tbl133,tbl134;
drop type tp310;
drop type tp311;
drop type tp312;
